adult,belongs_to_collection,budget,genres,homepage,id,imdb_id,original_language,original_title,overview,popularity,poster_path,production_companies,production_countries,release_date,revenue,runtime,spoken_languages,status,tagline,title,video,vote_average,vote_count
False,,0,"[{'id': 18, 'name': 'Drama'}, {'id': 12, 'name': 'Adventure'}, {'id': 10749, 'name': 'Romance'}]",,73462,tt0088758,en,The Aviator,A 1920s mail pilot and a rich man's daughter crash-land on a mountain full of hungry wolves.,0.825362,/5um5OytqGq2aS8XHtYVp0I2hDRf.jpg,[],"[{'iso_3166_1': 'US', 'name': 'United States of America'}]",1985-03-01,1304192.0,96.0,"[{'iso_639_1': 'en', 'name': 'English'}]",Released,,The Aviator,False,5.7,6.0
False,,24000000,"[{'id': 35, 'name': 'Comedy'}, {'id': 18, 'name': 'Drama'}, {'id': 10749, 'name': 'Romance'}]",,15019,tt0466839,en,I Could Never Be Your Woman,This movie follows a mother who falls for a younger man while her daughter falls in love for the first time. Mother Nature messes with their fates.,11.414893,/wLALWNYH9lMq6dVhEMAIJXLCPSU.jpg,"[{'name': 'Scott Rudin Productions', 'id': 258}, {'name': 'I Could Never Ltd.', 'id': 3587}, {'name': 'Bauer Martinez Studios', 'id': 34999}]","[{'iso_3166_1': 'US', 'name': 'United States of America'}]",2007-05-11,9576495.0,97.0,"[{'iso_639_1': 'en', 'name': 'English'}]",Released,Find Yourself. In Love.,I Could Never Be Your Woman,False,5.7,94.0
False,,25000000,"[{'id': 35, 'name': 'Comedy'}, {'id': 18, 'name': 'Drama'}, {'id': 10749, 'name': 'Romance'}]",,8051,tt0272338,en,Punch-Drunk Love,A beleaguered small-business owner gets a harmonium and embarks on a romantic journey with a mysterious woman.,6.753969,/k4pekJKEdaV2fv4S89A8GCV7u7Y.jpg,"[{'name': 'Columbia Pictures', 'id': 5}, {'name': 'New Line Cinema', 'id': 12}, {'name': 'Ghoulardi Film Company', 'id': 178}]","[{'iso_3166_1': 'US', 'name': 'United States of America'}]",2002-10-25,17000000.0,95.0,"[{'iso_639_1': 'en', 'name': 'English'}]",Released,,Punch-Drunk Love,False,6.9,542.0
False,,0,"[{'id': 35, 'name': 'Comedy'}, {'id': 10749, 'name': 'Romance'}]",,162059,tt0026388,en,Front Page Woman,"Reporter Curt Devlin loves sob sister Ellen Garfield but believes women are ""bum newspapermen"". When she learns the identity of a murdered arsonist, he calls it luck. When she goes after the murderer he gets enough evidence to have Maitland Coulter arrested. She finds a bunch of ""not guilty"" ballots and publishes the wrong story; he eavesdrops on the jury and gets the correct verdict. After being fired she gets a confession from the real killer and gets Coulter released.",0.698276,/aizW1yBSU1XhRi6RvYlUbiuTgzr.jpg,"[{'name': 'Warner Bros.', 'id': 6194}]","[{'iso_3166_1': 'US', 'name': 'United States of America'}]",1935-07-11,0.0,82.0,"[{'iso_639_1': 'en', 'name': 'English'}]",Released,"A woman reporter tries to prove she's just as good as any man, but runs into trouble along the way.",Front Page Woman,False,6.8,2.0
False,,0,"[{'id': 10770, 'name': 'TV Movie'}, {'id': 10749, 'name': 'Romance'}]",http://www.hallmarkchannel.com/love-on-a-limb,412974,tt5968910,en,Love on a Limb,"Aimie Roarke is always up for a cause and when the town’s beloved Oak tree is set to be cut down, she takes it upon herself try and save it. When the Mayor hires a handsome new landscaper to cut it down, she decides the only way to save the tree is to chain herself to it. As Kyle attempts to wait her out and the two start to spend more time together, they may find the Old Tree brings them both more than they could have imagined in life and love.",0.880199,/lpG2im597gp4qI6HRyjgz8mAPSs.jpg,[],[],2016-10-01,0.0,84.0,"[{'iso_639_1': 'en', 'name': 'English'}]",Released,,Love on a Limb,False,6.6,7.0
False,,4,"[{'id': 35, 'name': 'Comedy'}, {'id': 10749, 'name': 'Romance'}]",,68202,tt1547090,en,Without Men,The women of a remote Latin American town are forced to pick up the pieces and remake their world when all the town's men are forcibly recruited by communist guerrillas.,0.915353,/tTDRgWNWNalqaOVd7ofDuch6TBN.jpg,[],"[{'iso_3166_1': 'US', 'name': 'United States of America'}]",2011-06-29,0.0,83.0,"[{'iso_639_1': 'en', 'name': 'English'}]",Released,,Without Men,False,4.6,8.0
False,,0,"[{'id': 10749, 'name': 'Romance'}, {'id': 18, 'name': 'Drama'}]",,261246,tt0106537,en,Century,Turn-of-the-century love story centered around a young doctor and the emergence of modern science.,1.461029,/c9Mn1aE7uSXNRGcBquXh5hw0aGo.jpg,"[{'name': 'BBC', 'id': 5996}]","[{'iso_3166_1': 'GB', 'name': 'United Kingdom'}]",1993-12-31,0.0,112.0,"[{'iso_639_1': 'en', 'name': 'English'}]",Released,,Century,False,5.0,1.0
False,,0,"[{'id': 28, 'name': 'Action'}, {'id': 12, 'name': 'Adventure'}, {'id': 10749, 'name': 'Romance'}]",,198558,tt0056207,it,Maciste contro i cacciatori di teste,Maciste and his people flee their volcano-ravaged island. They end up caught in between two warring tribes.,0.072197,/wmCTjQhll7H5tyuA0aJbD0YcZCJ.jpg,"[{'name': 'Alta Vista', 'id': 60294}, {'name': 'RCM Produzione Cinematografica', 'id': 60295}]","[{'iso_3166_1': 'IT', 'name': 'Italy'}]",1963-01-10,0.0,81.0,"[{'iso_639_1': 'it', 'name': 'Italiano'}]",Released,In a Time of Titans Colussus Towered Above All!!!,Colossus and the Headhunters,False,1.5,2.0
False,,0,"[{'id': 18, 'name': 'Drama'}, {'id': 10749, 'name': 'Romance'}]",,208431,tt2571610,el,Η αγάπη έρχεται στο τέλος,"A girl on a cruise with her family, falls in love with the ship's lieutenant and has to make a dramatic decision when they reach Istanbul, in the end. A boy, secretly in love with his best friend, finally manages to express his feelings, through a fake Facebook profile... Until she finds out the truth! And two strangers spent a night together in Thessaloniki, falling in love, but when they part ways, the girl's mobile phone is stolen, along with the boy's number...",0.116854,/he3yX4Fr5GKMyCtuqiBozRyuHHC.jpg,[],[],2013-02-13,0.0,90.0,"[{'iso_639_1': 'el', 'name': 'ελληνικά'}]",Released,,Love in the End,False,8.3,3.0
False,,30000000,"[{'id': 18, 'name': 'Drama'}, {'id': 10749, 'name': 'Romance'}]",,6023,tt0431308,en,P.S. I Love You,A young widow discovers that her late husband has left her 10 messages intended to help ease her pain and start a new life.,10.304881,/esfuYEvv7WrLvXNkCg7MCufEEdH.jpg,"[{'name': 'Wendy Finerman Productions', 'id': 412}, {'name': 'Alcon Entertainment', 'id': 1088}, {'name': 'Grosvenor Park Productions', 'id': 17449}]","[{'iso_3166_1': 'US', 'name': 'United States of America'}]",2007-11-15,156835339.0,126.0,"[{'iso_639_1': 'en', 'name': 'English'}]",Released,"His life ended. Now, a new one will begin.",P.S. I Love You,False,7.0,1011.0
False,,17,"[{'id': 18, 'name': 'Drama'}, {'id': 36, 'name': 'History'}, {'id': 10749, 'name': 'Romance'}]",http://cequelejourdoitalanuit.com/,119193,tt1934205,en,Ce que le jour doit à la nuit,"Algeria, the 1930s. Younes is nine years old when he is put in his uncle's care in Oran. Rebaptized Jonas, he grows up among the Rio Salado youths, with whom he becomes friends. Emilie is one of the gang; everyone is in love with her. A great love story develops between Jonas and Emilie, which is soon unsettled by the conflicts troubling the country.",3.553601,/rVZyjWpfsBpKPXZ4m98GCP7oyn2.jpg,"[{'name': 'Wild Bunch', 'id': 856}]","[{'iso_3166_1': 'FR', 'name': 'France'}]",2012-09-12,0.0,182.0,"[{'iso_639_1': 'fr', 'name': 'Français'}]",Released,,What the Day Owes the Night,False,7.4,48.0
False,,0,"[{'id': 35, 'name': 'Comedy'}, {'id': 18, 'name': 'Drama'}, {'id': 10749, 'name': 'Romance'}]",,26686,tt0077289,en,California Suite,Misadventures of four groups of guests at the Beverly Hills Hotel.,3.075976,/qHHdjLAvSOtZu9CnAwLPeeyKhKT.jpg,"[{'name': 'Columbia Pictures', 'id': 5}, {'name': 'Rastar Films', 'id': 1177}]","[{'iso_3166_1': 'US', 'name': 'United States of America'}]",1978-12-15,0.0,103.0,"[{'iso_639_1': 'en', 'name': 'English'}]",Released,The best two-hour vacation in town!,California Suite,False,6.0,24.0
False,,886000,"[{'id': 35, 'name': 'Comedy'}, {'id': 10402, 'name': 'Music'}, {'id': 10749, 'name': 'Romance'}]",,20325,tt0028333,en,Swing Time,"Lucky is tricked into missing his wedding to Margaret by the other members of Pop's magic and dance act, and has to make $25000 to be allowed to marry her. He and Pop go to New York where they run into Penny, a dancing instructor. She and Lucky form a successful dance partnership, but romance is blighted (till the end of the film at least!) by his old attachment to Margaret and hers for Ricardo, the band leader who won't play for them to dance together.",6.507597,/kvCtsd0YcaLzHGS1Tc6RQ6roQm1.jpg,"[{'name': 'RKO Radio Pictures', 'id': 6}]","[{'iso_3166_1': 'US', 'name': 'United States of America'}]",1936-08-27,2600000.0,103.0,"[{'iso_639_1': 'en', 'name': 'English'}]",Released,A glorious songburst of gaiety and laughter!,Swing Time,False,7.1,47.0
False,,0,"[{'id': 10749, 'name': 'Romance'}, {'id': 18, 'name': 'Drama'}]",,1837,tt0227458,fr,Le Secret,"Marie, who works as a successful door-to-door encyclopedia salesperson, has been married to her husband Francois for 12 years and has a two-year-old son. Though she is relatively content with her life, she feels something is wanting. Enter 50-year old African-American Bill. Initially she is annoyed by his insouciance, but she finds that she is irresistibly attracted to him. Soon the two are in the midst of sordid illicit affair. She knows little about her new lover, and he seems uninterested in learning about her, but the long sessions of lovemaking are something else entirely. Feeling out of control, Marie is increasingly repelled by her own actions. Psychologically, she struggles to reconcile her torrid encounters with Bill and mundane domestic chores such as bathing her son. Moreover, she finds herself incapable of hiding her adulterous behavior, rather she comes home with scratches and hickeys all over her body, to the devastation Francois.",1.036431,/bReVJs3tSsIOn6naXRwuhvdiDDu.jpg,"[{'name': 'Les Productions Bagheera', 'id': 760}]","[{'iso_3166_1': 'FR', 'name': 'France'}]",2000-06-21,0.0,107.0,"[{'iso_639_1': 'fr', 'name': 'Français'}]",Released,,The Secret,False,5.0,2.0
False,,0,"[{'id': 10749, 'name': 'Romance'}, {'id': 99, 'name': 'Documentary'}, {'id': 18, 'name': 'Drama'}]",http://anata-river.com/,306598,tt4063314,ko,"님아, 그 강을 건너지 마오","There live a couple known as ‘100-year-old lovebirds’. As fairy tale's characters, the husband is strong like a  woodman, and the wife is full of charms like a princess. They dearly love each other wearing Korean traditional clothes all the time, and still fall asleep hand in hand. However, the death, quietly and like a thief, sit between them. This film starts from this moment, and follows the last moments of 76 years of their marriage.",0.444564,/cPqEaPoPy5gBeKd7NYEZQOrisje.jpg,"[{'name': 'Argus Film', 'id': 78686}]","[{'iso_3166_1': 'KR', 'name': 'South Korea'}]",2014-11-27,0.0,86.0,"[{'iso_639_1': 'ko', 'name': '한국어/조선말'}]",Released,,"My Love, Don't Cross That River",False,6.0,6.0
False,,0,"[{'id': 18, 'name': 'Drama'}, {'id': 10769, 'name': 'Foreign'}, {'id': 10749, 'name': 'Romance'}]",,42085,tt0087027,es,Camila,"In Buenos Aires of the 1840s, a young Jesuit and a wealthy socialite fall in love and begin a torrid affair. They escape from the city, and, in disguise, set up house in a village, assuming they are safe and beyond the cares of anyone. However, both the church and Camila's family are enraged, vowing to hunt down the lovers for a capital crime. Based on a true story.",0.265963,/5YFteQzqTZzMWAcSAUbKqC74cRo.jpg,[],"[{'iso_3166_1': 'ES', 'name': 'Spain'}, {'iso_3166_1': 'AR', 'name': 'Argentina'}]",1984-05-17,0.0,105.0,"[{'iso_639_1': 'es', 'name': 'Español'}]",Released,,Camila,False,7.0,4.0
False,,0,"[{'id': 18, 'name': 'Drama'}, {'id': 10749, 'name': 'Romance'}]",,210408,tt2586682,en,Aşk Kırmızı,"The film asks the question would have been triple love. Ferhat and Zeynep is a happily married couple. Karlıdağ outside of marriage appears happy couple, the first love of life remained in the years ahead will be turned upside down with the introduction of the Euphrates Nazlıgül again. Zeynep even a night encounter with the former love of her husband Nazlıgül powdery mildew that can not bear to be separated , and that is the love in his heart can not prevent the re-ignition.",0.413849,/o2MBEZ8IXYHUdEU0b6Rd5W5f5uP.jpg,"[{'name': 'Sinegraf', 'id': 41675}]",[],2013-03-15,0.0,114.0,"[{'iso_639_1': 'tr', 'name': 'Türkçe'}]",Released,,Aşk Kırmızı,False,5.3,3.0
False,,0,"[{'id': 18, 'name': 'Drama'}, {'id': 10402, 'name': 'Music'}, {'id': 10749, 'name': 'Romance'}]",,86231,tt0095362,en,The In Crowd,"A young man of the rock and roll generation is in his senior year of high school. When one day he successfully gets on a popular teen dance television show he becomes a star. The plot follows him as he lives his new life in his new world. What he finds are adoring fans, jealous rivals, bitter friends left behind, and the girl of his dreams...his dance partner.",0.755195,/kcQpcG2wEn1cymI2G2SG6KxJCbe.jpg,"[{'name': 'Force 10 Productions', 'id': 37464}]","[{'iso_3166_1': 'US', 'name': 'United States of America'}]",1988-02-01,124880.0,95.0,"[{'iso_639_1': 'en', 'name': 'English'}]",Released,They had all the moves!,The In Crowd,False,5.3,5.0
False,,0,"[{'id': 35, 'name': 'Comedy'}, {'id': 10749, 'name': 'Romance'}]",,126083,tt0026519,en,If You Could Only Cook,An auto engineer (Herbert Marshall) and a professor's daughter (Jean Arthur) pose as married servants in a mobster's (Leo Carrillo) mansion.,0.430813,/nK47ri03W6Dx3eHXsYsbtgcMYmd.jpg,"[{'name': 'Columbia Pictures', 'id': 5}]","[{'iso_3166_1': 'US', 'name': 'United States of America'}]",1935-12-30,0.0,72.0,"[{'iso_639_1': 'en', 'name': 'English'}]",Released,SHE GAVE UP HER PARK BENCH FOR HIM! HE GAVE UP MILLIONS FOR HER!,If You Could Only Cook,False,6.8,4.0
False,,0,"[{'id': 35, 'name': 'Comedy'}, {'id': 9648, 'name': 'Mystery'}, {'id': 28, 'name': 'Action'}, {'id': 10749, 'name': 'Romance'}, {'id': 12, 'name': 'Adventure'}]",http://www.ForAFewBullets.com/,406099,tt5882704,en,快手枪手快枪手,"When a professional thief sees his lifetime goal of being the best potentially realized in stealing a rare artifact, he finds himself entangled in a worldwide plot involving the Soviets, the Japanese and a band of outsiders.  It’s up to him and a special agent to save the world!",0.322763,/hB3unT9oePkRe05yzKsC7zltQxr.jpg,[],[],2016-07-15,0.0,115.0,"[{'iso_639_1': 'zh', 'name': '普通话'}]",Released,,For a Few Bullets,False,7.0,1.0
False,,6000000,"[{'id': 18, 'name': 'Drama'}, {'id': 10749, 'name': 'Romance'}]",http://www.thewrestlermovie.com/,12163,tt1125849,en,The Wrestler,"Aging wrestler Randy ""The Ram"" Robinson is long past his prime but still ready and rarin' to go on the pro-wrestling circuit. After a particularly brutal beating, however, Randy hangs up his tights, pursues a serious relationship with a long-in-the-tooth stripper, and tries to reconnect with his estranged daughter. But he can't resist the lure of the ring and readies himself for a comeback.",7.903956,/huooRmB7yksJyVVSkqOgitxlCec.jpg,"[{'name': 'Saturn Films', 'id': 831}, {'name': 'Wild Bunch', 'id': 856}, {'name': 'Protozoa Pictures', 'id': 7503}, {'name': 'Top Rope', 'id': 7504}]","[{'iso_3166_1': 'US', 'name': 'United States of America'}]",2008-09-07,44703995.0,109.0,"[{'iso_639_1': 'en', 'name': 'English'}]",Released,Love. Pain. Glory.,The Wrestler,False,7.3,1031.0
False,,57000000,"[{'id': 35, 'name': 'Comedy'}, {'id': 18, 'name': 'Drama'}, {'id': 10749, 'name': 'Romance'}]",,9621,tt0368709,en,Elizabethtown,"Drew Baylor is fired after causing his shoe company to lose hundreds of millions of dollars. To make matters worse, he's also dumped by his girlfriend. On the verge of ending it all, Drew gets a new lease on life when he returns to his family's small Kentucky hometown after his father dies. Along the way, he meets a flight attendant with whom he falls in love.",11.82081,/Asn50mIjDaeDKbaJkQ7lY6goV8p.jpg,"[{'name': 'Paramount Pictures', 'id': 4}, {'name': 'Cruise/Wagner Productions', 'id': 44}, {'name': 'Vinyl Films', 'id': 485}, {'name': 'KMP Film Invest', 'id': 20157}]","[{'iso_3166_1': 'US', 'name': 'United States of America'}]",2005-10-06,52034889.0,123.0,"[{'iso_639_1': 'en', 'name': 'English'}]",Released,It's a heck of a place to find yourself,Elizabethtown,False,6.1,335.0
False,,0,"[{'id': 10749, 'name': 'Romance'}, {'id': 35, 'name': 'Comedy'}]",http://www.magpictures.com/lifepartners/,260001,tt2870808,en,Life Partners,A 29-year-old lawyer  and her lesbian best friend experience a dramatic shift in their longtime bond after one enters a serious relationship,4.782116,/i0HIFCSIGB3RibSqwV9JojubOSS.jpg,"[{'name': 'Haven Entertainment', 'id': 19548}, {'name': 'Sandia Media', 'id': 25706}, {'name': 'Minerva Productions', 'id': 37578}]","[{'iso_3166_1': 'US', 'name': 'United States of America'}]",2014-12-05,8265.0,95.0,"[{'iso_639_1': 'en', 'name': 'English'}]",Released,One guy can ruin the perfect relationship.,Life Partners,False,6.1,108.0
False,,0,"[{'id': 18, 'name': 'Drama'}, {'id': 10749, 'name': 'Romance'}]",,17920,tt0300015,en,I Capture the Castle,"A love story set in 1930s England that follows 17-year-old Cassandra Mortmain, and the fortunes of her eccentric family, struggling to survive in a decaying English castle. Based on Dodie Smith's 1948 novel with the same name.",2.625315,/3gKrJldhv9c8oNsxmcbJXYldZUu.jpg,"[{'name': 'Isle of Man Film Commission', 'id': 8719}, {'name': 'British Broadcasting Corporation (BBC)', 'id': 15278}, {'name': 'Trademark Films', 'id': 22153}, {'name': 'Take 3 Partnership', 'id': 60283}]","[{'iso_3166_1': 'GB', 'name': 'United Kingdom'}]",2003-05-09,0.0,113.0,"[{'iso_639_1': 'en', 'name': 'English'}]",Released,You can't choose who you fall in love with,I Capture the Castle,False,7.1,26.0
False,,0,"[{'id': 35, 'name': 'Comedy'}, {'id': 10749, 'name': 'Romance'}]",,42581,tt0052141,en,Rock-a-Bye Baby,"A Movie star has triplets, but does not want her beloved public to find out. Has she made a mistake in hiring Jerry Lewis as the babysitter ?",1.048805,/vGCjXzVfhPRJO5NCU8bMGm8M9Ea.jpg,"[{'name': 'Paramount Pictures', 'id': 4}]","[{'iso_3166_1': 'US', 'name': 'United States of America'}]",1958-07-23,0.0,103.0,"[{'iso_639_1': 'en', 'name': 'English'}, {'iso_639_1': 'pt', 'name': 'Português'}, {'iso_639_1': 'es', 'name': 'Español'}]",Released,"He's The ""Mother"" of The Year!",Rock-a-Bye Baby,False,7.1,19.0
False,,0,"[{'id': 18, 'name': 'Drama'}, {'id': 10749, 'name': 'Romance'}]",,110540,tt0024819,en,The Age of Innocence,An engaged attorney and a divorcee fall for each other in 1870s Manhattan.,0.006418,/36Adp9yfSc7a8dIARiAcK7Z5dNt.jpg,"[{'name': 'RKO Radio Pictures', 'id': 6}]","[{'iso_3166_1': 'US', 'name': 'United States of America'}]",1934-09-14,0.0,81.0,"[{'iso_639_1': 'en', 'name': 'English'}]",Released,,The Age of Innocence,False,0.0,0.0
False,,0,"[{'id': 18, 'name': 'Drama'}, {'id': 10749, 'name': 'Romance'}]",,79236,tt0249261,en,Young Love,"Jukka, 13, is coached in photography by his openly gay art teacher. With his dead father's old camera, Jukka sees Johanna, a beautiful girl in her early twenties being physically abused by her stepfather. With the help of the local fire department, Jukka comes to her rescue. He quickly befriends the girl who works in a nearby supermarket, claims to become her manager and enters her in a beauty contest.",0.898698,/dn565GhPiwgTh38eAX9Ch3MYEL7.jpg,"[{'name': 'Mainstream Pictures Oy', 'id': 77633}, {'name': 'Filmberg', 'id': 77634}]","[{'iso_3166_1': 'FI', 'name': 'Finland'}]",2001-08-30,0.0,80.0,"[{'iso_639_1': 'fi', 'name': 'suomi'}]",Released,Coming of age story of the 13-year old boy who falls in love with an older girl who wants to become a model.,Young Love,False,5.3,4.0
False,,64000000,"[{'id': 18, 'name': 'Drama'}, {'id': 10749, 'name': 'Romance'}]",,12618,tt0156934,en,Random Hearts,After the death of their loved ones in a tragic plane crash 'Harrison Ford' and Kristin Scott Thomas find each others keys in each others loved ones posessions and realize that they were having an affair and must figure out all the details. Written by Andy HeitzThe wife of Police Sergeant Dutch Van Den Broek and the husband of politician Kay Chandler are killed in a plane crash. Now Dutch discovers some anomalies in what he told her before she left and discovers that she and Chandler's husband were travelling together. Dutch then goes to Chandler and tells her that he suspects that they were having an affair. He tells her that he wants to know the truth; she tells him that she doesn't but she later joins him and they grow close.,4.140398,/753JNSDgzCnOGd6qCzO0jEIHM4D.jpg,"[{'name': 'Columbia Pictures', 'id': 5}]","[{'iso_3166_1': 'US', 'name': 'United States of America'}]",1999-10-08,74608570.0,133.0,"[{'iso_639_1': 'en', 'name': 'English'}]",Released,In a perfect world...they never would have met.,Random Hearts,False,5.3,63.0
False,,0,"[{'id': 18, 'name': 'Drama'}, {'id': 10402, 'name': 'Music'}, {'id': 10749, 'name': 'Romance'}]",,43781,tt0035157,en,Orchestra Wives,"Connie Ward is in seventh heaven when Gene Morrison's band rolls into town. She is swept off her feet by trumpeter Bill Abbot. After marrying him, she joins the bands tour and learns about life as an orchestra wife, weathering the catty attacks of the other band wives.",0.737195,/nfpwJvGNfmELCMVkUb6hLD6nPy1.jpg,"[{'name': 'Twentieth Century Fox Film Corporation', 'id': 306}]","[{'iso_3166_1': 'US', 'name': 'United States of America'}]",1942-09-04,0.0,98.0,"[{'iso_639_1': 'en', 'name': 'English'}]",Released,It's Hep! It's Hot! It's Hilarious!,Orchestra Wives,False,5.1,4.0
False,,0,"[{'id': 35, 'name': 'Comedy'}, {'id': 18, 'name': 'Drama'}, {'id': 10749, 'name': 'Romance'}]",,413471,tt1588878,en,The Late Bloomer,A sex therapist goes through puberty after the successful removal of a benign tumor resting against his pituitary gland. He experiences all the changes and effects of puberty over a three-week period.,4.705178,/f31mIpTb4KWpjueeAcIx0CRewff.jpg,"[{'name': 'Millenium Films', 'id': 1020}, {'name': 'Eclectic Pictures', 'id': 71488}, {'name': 'Ineffable Pictures', 'id': 81167}]","[{'iso_3166_1': 'US', 'name': 'United States of America'}]",2016-10-07,0.0,90.0,"[{'iso_639_1': 'en', 'name': 'English'}]",Released,Based on the (Mostly) True Story of the 30-Year-old Who Just Hit Puberty.,The Late Bloomer,False,5.2,92.0
False,,0,"[{'id': 10749, 'name': 'Romance'}, {'id': 53, 'name': 'Thriller'}, {'id': 37, 'name': 'Western'}, {'id': 18, 'name': 'Drama'}]",,26761,tt0039737,en,Pursued,A hard-hitting western drama starring Mitchum as an orphan raised by a feuding family who wants to see him dead.,1.552655,/qaTKjmGJGQUixfjHiRBlTognST6.jpg,"[{'name': 'Warner Bros.', 'id': 6194}, {'name': 'United States Pictures', 'id': 11276}]","[{'iso_3166_1': 'US', 'name': 'United States of America'}]",1947-03-02,0.0,101.0,"[{'iso_639_1': 'en', 'name': 'English'}]",Released,Robert Mitchum fights for the love of three people who want to see him dead...his family.,Pursued,False,6.2,12.0
False,,0,"[{'id': 10749, 'name': 'Romance'}, {'id': 35, 'name': 'Comedy'}]",http://www.leather-movie.com/,272072,tt2473718,en,Leather,"Birch, a young man living in the Catskill Mountains, reunites with his childhood friend from the city, Andrew.",0.066398,/3D7uBoD04dnloJMpRUZbVF8J9JV.jpg,"[{'name': 'Willing Suspension Films', 'id': 18180}]","[{'iso_3166_1': 'US', 'name': 'United States of America'}]",2013-07-21,0.0,101.0,"[{'iso_639_1': 'en', 'name': 'English'}]",Released,It's Good To Have a Thick Skin...,Leather,False,5.0,1.0
False,,0,"[{'id': 18, 'name': 'Drama'}, {'id': 10749, 'name': 'Romance'}]",,289039,tt3182596,ar,فتاة المصنع,"Hiyam, a young factory worker, lives in a lower-middle-class neighbourhood, along with her co-workers. She is clearly under the spell of Salah, the factory's new supervisor. Believing that love can transcend their class differences, Hiyam relentlessly pursues a dream of the pair being together. However, when a pregnancy test is discovered in the factory premises, her immediate family and close friends accuse her of sinning. Hiyam decides not to defend herself and pays an enormous price in a society that fails to accept her.",0.477975,/l8btDsQCA29pBHeIglqTy2oboqZ.jpg,"[{'name': 'Dubai Media and Entertainment Organisation in association with Dubai Film Market (Enjaaz)', 'id': 31167}, {'name': 'DayDream Art Production', 'id': 31168}]","[{'iso_3166_1': 'EG', 'name': 'Egypt'}, {'iso_3166_1': 'AE', 'name': 'United Arab Emirates'}]",2013-12-08,0.0,92.0,"[{'iso_639_1': 'ar', 'name': 'العربية'}]",Released,,Factory Girl,False,6.5,2.0
False,,7500000,"[{'id': 18, 'name': 'Drama'}, {'id': 10749, 'name': 'Romance'}, {'id': 878, 'name': 'Science Fiction'}, {'id': 53, 'name': 'Thriller'}]",,2577,tt0345061,en,Code 46,"A futuristic 'Brief Encounter', a love story in which the romance is doomed by genetic incompatibility.",6.101401,/lOEo7iG0FV6mxpvl8IQoSvsGSC3.jpg,"[{'name': 'BBC Films', 'id': 288}]","[{'iso_3166_1': 'GB', 'name': 'United Kingdom'}]",2003-09-02,0.0,92.0,"[{'iso_639_1': 'en', 'name': 'English'}]",Released,How do you solve a crime when the last thing you want to know is the truth?,Code 46,False,6.2,116.0
False,,0,"[{'id': 10749, 'name': 'Romance'}, {'id': 9648, 'name': 'Mystery'}, {'id': 53, 'name': 'Thriller'}]",,53472,tt0109808,de,De Flat,,0.367507,/hs1uVeqpzWx1rBeq0cqk9QSMMsr.jpg,"[{'name': 'Meteor Film Productions', 'id': 6288}]","[{'iso_3166_1': 'NL', 'name': 'Netherlands'}]",1994-04-21,0.0,0.0,"[{'iso_639_1': 'nl', 'name': 'Nederlands'}, {'iso_639_1': 'en', 'name': 'English'}]",Released,,De Flat,False,7.0,2.0
