adult,belongs_to_collection,budget,genres,homepage,id,imdb_id,original_language,original_title,overview,popularity,poster_path,production_companies,production_countries,release_date,revenue,runtime,spoken_languages,status,tagline,title,video,vote_average,vote_count
False,,0,"[{'id': 18, 'name': 'Drama'}, {'id': 36, 'name': 'History'}, {'id': 80, 'name': 'Crime'}, {'id': 9648, 'name': 'Mystery'}, {'id': 53, 'name': 'Thriller'}]",,424782,tt6104058,pl,Jestem Mordercą,"Inspired by true events from the 1970s, the story revolves around a young detective who becomes the head of a police unit focused on catching a rampant serial killer of women, nicknamed 'The Silesian Vampire'.",1.602569,/gTahmz59BI4zx5cJKZe6sdXw1M1.jpg,"[{'name': 'RE STUDIO Renata Czarnkowska-Listos', 'id': 86093}]","[{'iso_3166_1': 'PL', 'name': 'Poland'}]",2016-11-04,0.0,117.0,"[{'iso_639_1': 'pl', 'name': 'Polski'}]",Released,,I'm a Killer,False,7.6,9.0
False,,0,"[{'id': 18, 'name': 'Drama'}, {'id': 80, 'name': 'Crime'}]",,78265,tt0045232,en,This Woman Is Dangerous,"Elizabeth is losing her sight, so while her lover go into hiding, she checks in to the hospital for extensive surgery to recover her eyesight. There she is treated by a handsome young doctor, Ben Hellack (Dennis Morgan). As expected not only the doctor successfully open her eyes, he also opened her heart for him.",0.968817,/xWjpSFsWIIIlfE4H1Gczurf33MP.jpg,"[{'name': 'Warner Bros.', 'id': 6194}]","[{'iso_3166_1': 'US', 'name': 'United States of America'}]",1952-02-09,0.0,100.0,"[{'iso_639_1': 'en', 'name': 'English'}]",Released,EVERY INCH A LADY...till you look at the record!,This Woman Is Dangerous,False,5.4,5.0
False,,0,"[{'id': 12, 'name': 'Adventure'}, {'id': 10749, 'name': 'Romance'}, {'id': 18, 'name': 'Drama'}]",http://www.copenhagenthemovie.com/,251232,tt2459156,en,Copenhagen,"After weeks of traveling through Europe, the immature William finds himself in Copenhagen, the place of his father’s birth. He befriends the youthful Effy, who works in William’s hotel as part of an internship program, and they set off to find William’s last living relative. Effy’s mix of youthful exuberance and wisdom challenges William unlike any  woman ever has. As the attraction builds, he must come to grips with destabilizing elements of his family’s sordid past.",4.304458,/iwXP0HauFYaEEY5w7T06Im0xSHw.jpg,"[{'name': 'Heretic Films', 'id': 18852}, {'name': 'Scorched Films', 'id': 40539}, {'name': 'Fidelio', 'id': 40540}]","[{'iso_3166_1': 'DK', 'name': 'Denmark'}, {'iso_3166_1': 'US', 'name': 'United States of America'}]",2014-10-03,0.0,98.0,"[{'iso_639_1': 'da', 'name': 'Dansk'}, {'iso_639_1': 'en', 'name': 'English'}]",Released,"When the girl of your dreams is half your age, it's time to grow up.",Copenhagen,False,6.6,68.0
False,"{'id': 150156, 'name': 'City Slickers Collection', 'poster_path': '/1xHwbqIfBQvxNCkdJwQ5vxFwI5H.jpg', 'backdrop_path': '/qv2Bcy963o42k65v0km97G1ceZ4.jpg'}",27000000,"[{'id': 28, 'name': 'Action'}, {'id': 12, 'name': 'Adventure'}, {'id': 35, 'name': 'Comedy'}, {'id': 18, 'name': 'Drama'}, {'id': 37, 'name': 'Western'}]",,1406,tt0101587,en,City Slickers,New York meets the west in this comedy starring Billy Crystal. Three New York business men decide to take a 'Wild West' vacation that turns out to not be the relaxing vacation they had envisioned.,7.334686,/9utnPWr4aaZma19owcEXBo3OLcu.jpg,"[{'name': 'Columbia Pictures', 'id': 5}, {'name': 'New Line Cinema', 'id': 12}, {'name': 'Castle Rock Entertainment', 'id': 97}]","[{'iso_3166_1': 'US', 'name': 'United States of America'}]",1991-06-07,179033791.0,112.0,"[{'iso_639_1': 'en', 'name': 'English'}, {'iso_639_1': 'de', 'name': 'Deutsch'}]",Released,Yesterday They Were Businessmen. Today They're Cowboys. Tomorrow They'll Be Walking Funny.,City Slickers,False,6.2,232.0
False,,0,"[{'id': 18, 'name': 'Drama'}, {'id': 53, 'name': 'Thriller'}, {'id': 80, 'name': 'Crime'}]",,47256,tt0043655,en,The Hoodlum,"Vincent Lubeck is a vicious ex-convict. His criminal activities are despised by his family, but he uses and abuses them in the course of his crimes. Eventually his own brother must stand up to him.",0.193396,/9LzXKB9mL5aAzIk7Cj7MTHiUjmj.jpg,"[{'name': 'Jack Schwarz Productions', 'id': 8481}]","[{'iso_3166_1': 'US', 'name': 'United States of America'}]",1951-07-05,0.0,61.0,"[{'iso_639_1': 'en', 'name': 'English'}]",Released,,The Hoodlum,False,6.9,4.0
False,,0,"[{'id': 28, 'name': 'Action'}, {'id': 12, 'name': 'Adventure'}, {'id': 18, 'name': 'Drama'}]",,252886,tt0043746,en,The Lion Hunters,"A lion trapper and his daughter rendezvous with their hardheaded partner in the African jungle. Bomba, with some assistance from the local natives and lions, runs them off.",0.065153,/wdIympli9V5Wtt3hjxjTBE4d8bB.jpg,"[{'name': 'Monogram Pictures', 'id': 4395}]","[{'iso_3166_1': 'US', 'name': 'United States of America'}]",1951-03-25,0.0,75.0,"[{'iso_639_1': 'en', 'name': 'English'}]",Released,,The Lion Hunters,False,0.0,0.0
False,,0,"[{'id': 80, 'name': 'Crime'}, {'id': 35, 'name': 'Comedy'}, {'id': 18, 'name': 'Drama'}, {'id': 12, 'name': 'Adventure'}]",,16433,tt0338075,en,Grand Theft Parsons,"There are times when it's right and proper to simply bury the dead. This is not one of those times... Gram Parsons was one of the most influential musicians of his time; a bitter, brilliant, genius who knew Elvis, tripped with the Stones and fatally overdosed on morphine and tequila in 1973. And from his dying came a story. A story from deep within folklore; a story of friendship, honour and adventure; a story so extraordinary that if it didn't really happen, no one would believe it. Two men, a hearse, a dead rock star, five gallons of petrol, and a promise. And the most extraordinary chase of modern times.",1.635064,/u1Xe7UmgRSaTqXS714ugg1SmJ88.jpg,[],[],2003-06-18,0.0,88.0,"[{'iso_639_1': 'en', 'name': 'English'}]",Released,It's better to burn out than to fade away.,Grand Theft Parsons,False,6.0,11.0
False,,0,"[{'id': 18, 'name': 'Drama'}]",http://www.musicboxfilms.com/any-day-now-movies-58.php,105526,tt2066176,en,Any Day Now,"In the late 1970s, when a mentally handicapped teenager is abandoned, a gay couple takes him in and becomes the family he's never had. But once the unconventional living arrangement is discovered by authorities, the men must fight the legal system to adopt the child.",10.559109,/vDE7BO4o6NQKcT8ZqGjPJohzWgN.jpg,"[{'name': 'PFM Pictures', 'id': 39061}]","[{'iso_3166_1': 'US', 'name': 'United States of America'}]",2012-12-14,0.0,97.0,"[{'iso_639_1': 'en', 'name': 'English'}]",Released,They made him a promise. He made them a family.,Any Day Now,False,6.6,22.0
False,,40000000,"[{'id': 35, 'name': 'Comedy'}, {'id': 18, 'name': 'Drama'}, {'id': 10749, 'name': 'Romance'}]",http://www.morningglorymovie.com/,38357,tt1126618,en,Morning Glory,"A young and devoted morning television producer is hired as an executive producer on a  long-running morning show at a once-prominent but currently failing station in New York City. Eager to keep the show on air, she recruits a former news journalist and anchor who disapproves of co-hosting a show that does not deal with real news stories.",10.771255,/bGBS0EUj2BMGcpoxdx190hUj4PY.jpg,"[{'name': 'Bad Robot', 'id': 11461}, {'name': 'Goldcrest Pictures', 'id': 11843}]","[{'iso_3166_1': 'US', 'name': 'United States of America'}]",2010-01-12,58785180.0,102.0,"[{'iso_639_1': 'en', 'name': 'English'}, {'iso_639_1': 'uk', 'name': 'Український'}]",Released,Breakfast TV just got interesting.,Morning Glory,False,6.1,420.0
False,,0,"[{'id': 10751, 'name': 'Family'}, {'id': 35, 'name': 'Comedy'}, {'id': 18, 'name': 'Drama'}]",,151431,tt0048250,en,A Kid for Two Farthings,"A London boy's goat works magic like a unicorn for people (Diana Dors, David Kossoff) on Petticoat Lane.",0.701604,/tu2phlbUKc17L0NcSHqMWhByOYe.jpg,"[{'name': 'London Film Productions', 'id': 659}]","[{'iso_3166_1': 'GB', 'name': 'United Kingdom'}]",1956-01-20,0.0,96.0,"[{'iso_639_1': 'en', 'name': 'English'}]",Released,,A Kid for Two Farthings,False,6.1,4.0
False,,0,"[{'id': 18, 'name': 'Drama'}]",,391778,tt4906984,hi,Azhar,"Indian biographical sports film directed by Tony D'Souza based on the life of the former Indian international cricketer, Mohammad Azharuddin. It will star emraan hashmi in the lead role alongside Prachi Desai , Nargis Fakhri and Huma Qureshi",0.71192,/2jn4HTYdOAiErTVVNRYH2SNxxOd.jpg,[],[],2016-05-13,0.0,130.0,"[{'iso_639_1': 'hi', 'name': 'हिन्दी'}]",Released,Love him. Hate him. Judge him.,Azhar,False,5.6,11.0
False,,0,"[{'id': 18, 'name': 'Drama'}, {'id': 35, 'name': 'Comedy'}, {'id': 80, 'name': 'Crime'}]",,428687,tt4144332,en,Deidra & Laney Rob a Train,"After their mother ends up in jail, two sisters turn to train robbery in order to support their family.",2.487073,/ai7K16kOjdISNUhdTvLQ3t0Qrzb.jpg,[],"[{'iso_3166_1': 'US', 'name': 'United States of America'}]",2017-01-23,0.0,92.0,"[{'iso_639_1': 'en', 'name': 'English'}]",Released,,Deidra & Laney Rob a Train,False,5.7,17.0
False,,0,"[{'id': 12, 'name': 'Adventure'}, {'id': 35, 'name': 'Comedy'}, {'id': 18, 'name': 'Drama'}]",,46813,tt0023956,en,Don Quixote,"In Spain, in the sixteenth century, an elderly gentleman named Don Quixote has gone mad from reading too many books on chivalry...",0.100463,/paGBPnnFpFWqAAZRNG9BCJRn7L7.jpg,[],"[{'iso_3166_1': 'FR', 'name': 'France'}, {'iso_3166_1': 'GB', 'name': 'United Kingdom'}]",1933-01-01,0.0,73.0,"[{'iso_639_1': 'en', 'name': 'English'}]",Released,,Don Quixote,False,2.5,2.0
False,,12000000,"[{'id': 80, 'name': 'Crime'}, {'id': 18, 'name': 'Drama'}, {'id': 10749, 'name': 'Romance'}, {'id': 53, 'name': 'Thriller'}]",,9281,tt0090329,en,Witness,"A sheltered Amish child is the sole witness of a brutal murder in a restroom at a Philadelphia train station, and he must be protected.  The assignment falls to a taciturn detective who goes undercover in a Pennsylvania Dutch community. On the farm, he slowly assimilates despite his urban grit and forges a romantic bond with the child's beautiful mother.",10.312017,/pQZa314NJP3ieMAj6CgPI1v7nUY.jpg,"[{'name': 'Paramount Pictures', 'id': 4}]","[{'iso_3166_1': 'US', 'name': 'United States of America'}]",1985-02-08,68706993.0,113.0,"[{'iso_639_1': 'de', 'name': 'Deutsch'}, {'iso_639_1': 'en', 'name': 'English'}]",Released,A big city cop. A small country boy. They have nothing in common... but a murder.,Witness,False,7.0,390.0
False,,60000000,"[{'id': 35, 'name': 'Comedy'}, {'id': 18, 'name': 'Drama'}, {'id': 10752, 'name': 'War'}]",https://www.netflix.com/title/80068327,354287,tt4758646,en,War Machine,A rock star general bent on winning the “impossible” war in Afghanistan takes us inside the complex machinery of modern war. Inspired by the true story of General Stanley McChrystal.,10.282732,/zGlzlzms2vN5vSFVMWuknu7XGXP.jpg,"[{'name': 'Plan B Entertainment', 'id': 45778}, {'name': 'Netflix', 'id': 59811}]","[{'iso_3166_1': 'US', 'name': 'United States of America'}]",2017-05-26,0.0,122.0,"[{'iso_639_1': 'ps', 'name': 'پښتو'}, {'iso_639_1': 'en', 'name': 'English'}]",Released,We're gonna liberate the sh** out of you.,War Machine,False,5.8,243.0
False,,0,"[{'id': 18, 'name': 'Drama'}]",,155953,tt0011979,en,The Blot,"Professor Griggs, teaching at the college, doesn't get paid a living wage; his next door neighbor, successful shoemaker Olsen, has money and plentiful food, while the Griggses have hardly any. When the professor's rich student Phil West falls for beautiful Griggs daughter Amelia and also befriends the poor Reverend Gates (a young man who is also in love with Amelia), he observes the difference in his life and theirs and tries to help make a difference.",0.661938,/2Gc7H1jmZM69TbGA8DSZx3WkQA8.jpg,"[{'name': 'Lois Weber Productions', 'id': 70274}]","[{'iso_3166_1': 'US', 'name': 'United States of America'}]",1921-09-04,0.0,90.0,[],Released,,The Blot,False,7.3,3.0
False,,0,"[{'id': 10749, 'name': 'Romance'}, {'id': 35, 'name': 'Comedy'}, {'id': 18, 'name': 'Drama'}]",,14086,tt0402755,it,Agata e la tempesta,"The story of a middle-aged bookshop owner, who becomes embroiled in a surreal swirl of romance and family secrets of infidelity, her energy levels registering in bursts of electrical interference - causing lightbulbs, traffic lights, toasters and computers to spontaneously spark and malfunction.",1.159325,/ivpRpHou6gpqFsSmlxZIThYaW0f.jpg,[],"[{'iso_3166_1': 'CH', 'name': 'Switzerland'}, {'iso_3166_1': 'FR', 'name': 'France'}, {'iso_3166_1': 'IT', 'name': 'Italy'}]",2004-04-27,0.0,125.0,"[{'iso_639_1': 'it', 'name': 'Italiano'}]",Released,,Agatha and the Storm,False,6.3,9.0
False,,0,"[{'id': 35, 'name': 'Comedy'}, {'id': 18, 'name': 'Drama'}]",,209350,tt2392326,en,Le Week-End,"Nick and Meg Burrows return to Paris, the city where they honeymooned, to celebrate their 30th wedding anniversary and rediscover some romance in their long-lived marriage. The film follows the couple as long-established tensions in their marriage break out in humorous and often painful ways.",3.74133,/prXVssvfnzAvKpdAfKunjdAouNa.jpg,"[{'name': 'Le Bureau', 'id': 2137}, {'name': 'Film4', 'id': 9349}, {'name': 'Free Range Films', 'id': 39509}]","[{'iso_3166_1': 'FR', 'name': 'France'}, {'iso_3166_1': 'GB', 'name': 'United Kingdom'}]",2013-10-04,2225098.0,93.0,"[{'iso_639_1': 'en', 'name': 'English'}]",Released,,Le Week-End,False,6.4,50.0
False,"{'id': 331475, 'name': 'Shiloh Collection', 'poster_path': None, 'backdrop_path': None}",0,"[{'id': 18, 'name': 'Drama'}, {'id': 10751, 'name': 'Family'}]",,33660,tt0120118,en,Shiloh,"An abused beagle runs away from his owner. On the road, he meets young Marty Preston and follows him home. The boy immediately forms a bond with the dog and names him Shiloh. His stern father won't let him keep the dog because it belongs to Judd Travers, a local hunter. After Shiloh is mistreated again, he runs away and returns to Marty. Knowing his father will once again make him bring Shiloh back to Judd, he makes a home for the dog in an old shed up the hill from the Prestons' house and hides him from his family. His secret is soon discovered when a stray attacks the dog one night and he must turn to his father for help.",2.89449,/jnhjXhqjH4MnGFGQOlYigZhVH6O.jpg,"[{'name': 'Bruin Grip Services', 'id': 5330}, {'name': 'Good Dog Productions LLC', 'id': 5331}, {'name': 'Utopia Pictures', 'id': 5332}, {'name': 'Zeta Entertainment', 'id': 5333}]","[{'iso_3166_1': 'US', 'name': 'United States of America'}]",1996-11-30,0.0,93.0,"[{'iso_639_1': 'en', 'name': 'English'}]",Released,The story of a boy who risks everything to save his best friend.,Shiloh,False,5.7,17.0
False,,0,"[{'id': 18, 'name': 'Drama'}, {'id': 35, 'name': 'Comedy'}]",,64116,tt0339149,en,Himmelfall,"Reidar is a resident at Solihøgda psychiatric institution. He is expecting the Earth to be hit by a huge meteor any time now, but until then he is busy trying to keep his fellow patient, Juni, from killing herself. And it doesn't happen often. But maybe one is allowed to hope. That when the quarks in the ball are correctly aligned with the quarks in the wall that you throw it at, there won't be a collision. But a moment of harmony when everything is balanced. And that moment could be now.",0.225225,/9rPcJjvM8PVOKzgHFEWuKCsAL8M.jpg,[],[],2002-10-18,0.0,83.0,"[{'iso_639_1': 'no', 'name': 'Norsk'}]",Released,,Falling Sky,False,5.5,2.0
False,,0,"[{'id': 18, 'name': 'Drama'}]",,8941,tt1132607,fr,Versailles,A young mother Nina and her son Enzo find themselves sleeping on the streets of Paris. Eventually there lifestyle leads them to Versailles.,0.705023,/dYViK2Ymxeh0VHggeHIXKdydoST.jpg,"[{'name': 'Angoa-Agicoa', 'id': 309}, {'name': 'Procirep', 'id': 311}, {'name': 'Canal+', 'id': 5358}, {'name': 'CinéCinéma', 'id': 6301}, {'name': 'Région Ile-de-France', 'id': 11246}, {'name': 'Cinémage 2', 'id': 12034}, {'name': 'Les Films Pelléas', 'id': 12389}, {'name': 'Centre National de la Cinématographie (CNC)', 'id': 18367}, {'name': 'Media Programme of the European Community', 'id': 21972}, {'name': 'La Banque postale Image', 'id': 65064}]","[{'iso_3166_1': 'FR', 'name': 'France'}]",2008-05-19,0.0,113.0,"[{'iso_639_1': 'fr', 'name': 'Français'}]",Released,,Versailles,False,6.0,4.0
False,,0,"[{'id': 35, 'name': 'Comedy'}, {'id': 18, 'name': 'Drama'}, {'id': 10749, 'name': 'Romance'}]",,122325,tt0023394,en,The Rich Are Always with Us,"The ten year marriage of of Caroline Van Dyke and Greg Grannard is falling apart. A young woman, Allison, plots to become his second wife. Caroline's friend, novelist Julian, has long loved her and now sees his chance, but she refuses him and goes to Paris to file for divorce. Julian follows but on hearing that Greg has fallen on financial hardship Caroline returns to help him. Greg tells Caroline that his now-wife Allison is pregnant and Caroline realizes that she loves Julian and to travel to China with him and be married. Allison and Greg have a bitter row in the car, which then smashes into a tree killing Allison and injuring Greg. Caroline tells Julian she will stay with Greg until he is well, but marries Julian in the hospital with a promise to join him as soon as she can.",0.154659,/h3UV4xI26uUOt9byPqz2o1vwQRm.jpg,"[{'name': 'First National Pictures', 'id': 3245}, {'name': 'Warner Bros.', 'id': 6194}, {'name': 'The Vitaphone Corporation', 'id': 9329}]","[{'iso_3166_1': 'US', 'name': 'United States of America'}]",1932-05-21,0.0,71.0,"[{'iso_639_1': 'en', 'name': 'English'}, {'iso_639_1': 'fr', 'name': 'Français'}]",Released,Sumptuous portrayal of sensuous society in the perfumed fragrance of Park Avenue and Paris boudoirs.,The Rich Are Always with Us,False,6.8,2.0
False,,0,"[{'id': 18, 'name': 'Drama'}]",,407575,tt3733098,es,Rosa Chumbe,"Rosa is a mature police officer with both a gambling and a drinking problem. She lives with her daughter Sheila, who has a little baby. One day, after a big fight between them, Sheila steals her mother's savings and storms out of the house leaving her baby behind. Rosa is forced to spend some time with her grandson. Something changes inside her heart of stone. However, everything takes a wrong turn one night. Only a miracle can save her.",0.025207,/whZf5IJyb5xIUdrPSafabpFOP3X.jpg,"[{'name': 'Yin Zhang Films', 'id': 95386}]","[{'iso_3166_1': 'PE', 'name': 'Peru'}]",2015-08-08,0.0,75.0,"[{'iso_639_1': 'es', 'name': 'Español'}]",Released,,Rosa Chumbe,False,0.0,0.0
False,,0,"[{'id': 18, 'name': 'Drama'}]",,121462,tt0311750,ko,사랑방 손님과 어머니,"A single mother takes on a boarder, with intriguing results.",0.076567,/ryAFL1770zmiDoHX6NXBvalPJYx.jpg,"[{'name': 'Shin Films', 'id': 43979}]","[{'iso_3166_1': 'KR', 'name': 'South Korea'}]",1961-08-26,0.0,103.0,"[{'iso_639_1': 'ko', 'name': '한국어/조선말'}]",Released,,My Mother and Her Guest,False,5.5,2.0
False,,0,"[{'id': 18, 'name': 'Drama'}, {'id': 53, 'name': 'Thriller'}]",,238458,tt0106680,en,Dead Before Dawn,"Based upon a true story. Wife with young family finds life becoming unbearable with her successful, but violent and abusive, husband. After filing for divorce, she quickly learns that her husband, through fear of his personal life embarrassing his clients, has commissioned an assassin to murder her before going to court. Unfortunately, for him, the hired assassin turns out to be an FBI agent. The FBI convince her that she must “pretend” to have been murdered in order to prove her husband’s involvement.",1.875793,/5XgtZr7zkq5qEyeeRn1NKuM42sX.jpg,[],[],1993-01-09,0.0,120.0,"[{'iso_639_1': 'en', 'name': 'English'}]",Released,,Dead Before Dawn,False,4.3,2.0
False,,46000,"[{'id': 18, 'name': 'Drama'}]",,14757,tt0368913,ps,Osama,Teenage girl Osama cuts her hair and dresses like a boy to get a job and support her widowed mother and grandmother. When Osama is called by the Taliban to join school and military training she embarks on a terrifying and confusing journey as she tries to keep the Taliban from finding out her true identity.,2.066368,/qcfz88UlPcy03pLaKkWz29CJtbA.jpg,"[{'name': 'Hubert Bals Fund', 'id': 13413}, {'name': 'NHK', 'id': 15505}, {'name': 'LeBrocquy Fraser Productions', 'id': 21605}, {'name': 'Barmak Film', 'id': 37854}]","[{'iso_3166_1': 'AF', 'name': 'Afghanistan'}, {'iso_3166_1': 'IE', 'name': 'Ireland'}, {'iso_3166_1': 'JP', 'name': 'Japan'}]",2003-05-20,0.0,83.0,"[{'iso_639_1': 'en', 'name': 'English'}, {'iso_639_1': 'fr', 'name': 'Français'}, {'iso_639_1': 'hu', 'name': 'Magyar'}, {'iso_639_1': 'ps', 'name': 'پښتو'}]",Released,To save her family a girl must become a boy,Osama,False,6.3,33.0
False,,5500000,"[{'id': 18, 'name': 'Drama'}, {'id': 35, 'name': 'Comedy'}]",,332835,tt3767372,hi,Piku,"A road trip to Kolkata brings Piku, an architect, closer to her ageing but nagging father Bhaskor Banerjee despite their disparate ideologies and fights over trivial issues.",2.942711,/3AiMCKSLxpYsjP3eQFg3FG3a9OW.jpg,"[{'name': 'Rising Sun Films', 'id': 19144}, {'name': 'MSM Motion Pictures', 'id': 49607}, {'name': 'Saraswati Entertainment Creations Limited', 'id': 53252}]","[{'iso_3166_1': 'IN', 'name': 'India'}]",2015-05-08,22159216.0,123.0,"[{'iso_639_1': 'hi', 'name': 'हिन्दी'}]",Released,Motion Se Hi Emotion,Piku,False,6.8,44.0
False,,0,"[{'id': 12, 'name': 'Adventure'}, {'id': 36, 'name': 'History'}, {'id': 18, 'name': 'Drama'}, {'id': 10751, 'name': 'Family'}]",,139405,tt0112286,en,Across the Sea of Time,"A young Russian boy, Thomas Minton, travels to New York as a passenger on a Russian freighter. Close to Ellis Island he gets off and thus starts his journey to America the same way as all immigrants in former times. Thomas is searching for the family of one of his ancestors, who had emigrated decades ago, but once sent a letter home together with a sample of his new profession: 3D-Photography. The boy follows his relative's traces by counter-checking the old 3D-Photographs of New York (using an antique viewer) with the same places and how they look today. This way, the audience gets to see the Big Apple in former times as well as today.",0.114469,/lKOAyy098yjoot8cutYsStVO1WS.jpg,"[{'name': 'Sony New Technologies', 'id': 53390}]","[{'iso_3166_1': 'US', 'name': 'United States of America'}]",1995-10-20,0.0,51.0,"[{'iso_639_1': 'ru', 'name': 'Pусский'}, {'iso_639_1': 'en', 'name': 'English'}]",Released,,Across the Sea of Time,False,3.5,2.0
False,,0,"[{'id': 27, 'name': 'Horror'}, {'id': 28, 'name': 'Action'}, {'id': 18, 'name': 'Drama'}]",,46658,tt0100273,fr,Night of the Sharks,"David must fight for his life against the gangsters who killed his brother for a CD filled with proof of their illegal activities. When David gets possession of the CD they go down to Mexico where David lives as a shark hunter. Who will get David first, the gangsters or the shark?",0.110781,/oYQcTvHTZld4DFWJ6q3gVShZqs8.jpg,[],[],1989-01-01,0.0,85.0,"[{'iso_639_1': 'en', 'name': 'English'}]",Released,"Still waters run deep, dark and deadly.",Night of the Sharks,False,3.0,1.0
False,,6800000,"[{'id': 18, 'name': 'Drama'}, {'id': 10752, 'name': 'War'}, {'id': 9648, 'name': 'Mystery'}]",http://www.sonyclassics.com/incendies/,46738,tt1255953,fr,Incendies,"A mother's last wishes send twins Jeanne and Simon on a journey to Middle East in search of their tangled roots. Adapted from Wajdi Mouawad's acclaimed play, Incendies tells the powerful and moving tale of two young adults' voyage to the core of deep-rooted hatred, never-ending wars and enduring love.",8.596012,/sEUG3qjxwHjxkzuO7plrRHhOZUH.jpg,"[{'name': 'TS Productions', 'id': 313}, {'name': 'Micro scope', 'id': 7272}, {'name': 'Phi Group', 'id': 7273}]","[{'iso_3166_1': 'CA', 'name': 'Canada'}, {'iso_3166_1': 'FR', 'name': 'France'}]",2010-09-04,7103838.0,130.0,"[{'iso_639_1': 'fr', 'name': 'Français'}, {'iso_639_1': 'ar', 'name': 'العربية'}, {'iso_639_1': 'en', 'name': 'English'}]",Released,The search began at the opening of their mother's will.,Incendies,False,7.9,496.0
False,,0,"[{'id': 18, 'name': 'Drama'}]",,8071,tt0069398,fr,Tout Va Bien,"Godard examines the structure of movies, relationships and revolutions through the life of a couple in Paris.",0.742592,/2AvaJ8NuWOzoRoblvP35QI6fKST.jpg,"[{'name': 'Anouchka Films', 'id': 14679}]","[{'iso_3166_1': 'FR', 'name': 'France'}]",1972-04-28,0.0,95.0,"[{'iso_639_1': 'en', 'name': 'English'}, {'iso_639_1': 'fr', 'name': 'Français'}]",Released,,Tout Va Bien,False,6.6,5.0
False,,0,"[{'id': 18, 'name': 'Drama'}]",,48847,tt0193716,en,The Amputee,A double leg amputated woman sits and writes a long meandering letter while her ineffective nurse attempts to attend to her stumps.,1.828178,/bmi9W8tITgAiCWt5UHWUlxU0KHW.jpg,"[{'name': 'Lynch Films', 'id': 22047}]","[{'iso_3166_1': 'US', 'name': 'United States of America'}]",1974-01-01,0.0,5.0,"[{'iso_639_1': 'en', 'name': 'English'}]",Released,,The Amputee,False,5.8,32.0
False,,22000000,"[{'id': 18, 'name': 'Drama'}, {'id': 35, 'name': 'Comedy'}, {'id': 80, 'name': 'Crime'}]",http://www.middlemenmovie.com/,38842,tt1251757,en,Middle Men,"Chronicles Jack Harris, one of the pioneers of internet commerce, as he wrestles with his morals and struggles not to drown in a sea of conmen, mobsters, drug addicts, and pornstars.",7.095445,/vFiSz5iJ8ipcUlb4ZmY7Pl7rXcI.jpg,"[{'name': 'Paramount Pictures', 'id': 4}, {'name': 'Oxymoron Entertainment', 'id': 12357}, {'name': 'Mallick Media', 'id': 12358}, {'name': 'Middle Pictures', 'id': 23410}]","[{'iso_3166_1': 'US', 'name': 'United States of America'}]",2009-05-17,0.0,105.0,"[{'iso_639_1': 'en', 'name': 'English'}]",Released,"Business is a lot like sex ... getting in is easy, pulling out is hard.",Middle Men,False,6.5,94.0
