adult,belongs_to_collection,budget,genres,homepage,id,imdb_id,original_language,original_title,overview,popularity,poster_path,production_companies,production_countries,release_date,revenue,runtime,spoken_languages,status,tagline,title,video,vote_average,vote_count
False,,25000000,"[{'id': 18, 'name': 'Drama'}, {'id': 878, 'name': 'Science Fiction'}]",http://thegiverfilm.com/,227156,tt0435651,en,The Giver,"In a seemingly perfect community, without war, pain, suffering, differences or choice, a young boy is chosen to learn from an elderly man about the true pain and pleasure of the ""real"" world.",12.472206,/4g19qQ4pfQz6nlVctA0q3y7Dieg.jpg,"[{'name': 'The Weinstein Company', 'id': 308}, {'name': 'Walden Media', 'id': 10221}, {'name': 'Tonik Productions', 'id': 17145}, {'name': 'Asis Productions', 'id': 53464}]","[{'iso_3166_1': 'US', 'name': 'United States of America'}]",2014-08-11,66980456.0,94.0,"[{'iso_639_1': 'en', 'name': 'English'}]",Released,Search for truth. Find freedom.,The Giver,False,6.4,1859.0
False,,0,"[{'id': 80, 'name': 'Crime'}, {'id': 18, 'name': 'Drama'}]",,91571,tt0068420,fr,La course du lièvre à travers les champs,"A crook on the run hooks up with a criminal gang to commit a kidnapping. However, things don't go quite as planned.",0.000844,/yuNT9Dw8x77gErEiTmwljp6o0Z2.jpg,"[{'name': 'Greenwich Film Productions', 'id': 1657}]","[{'iso_3166_1': 'FR', 'name': 'France'}, {'iso_3166_1': 'IT', 'name': 'Italy'}]",1972-09-15,0.0,122.0,"[{'iso_639_1': 'fr', 'name': 'Français'}]",Released,Wish Robert Ryan and Jean-Louis Trintignant luck!,And Hope to Die,False,6.5,1.0
False,,0,"[{'id': 35, 'name': 'Comedy'}, {'id': 18, 'name': 'Drama'}]",http://www.odettetoulemonde-lefilm.com/,4171,tt0486636,fr,Odette Toulemonde,"Objectively, Odette Toulemonde has nothing to be happy about, but is. Balthazar Balsan has everything to be happy about, but isn’t. Odette, awkwardly forty, with a delightful hairdresser son and a daughter bogged down in adolescence, spends her days behind the cosmetic’s counter in a department store and her nights sewing feathers on costumes for Parisian variety shows. She dreams of thanking Balthazar Balsan, her favorite author, to whom – she believes – she owes her optimism. The rich and charming Parisian writer then turns up in her life in an unexpected way.",2.156849,/fK1ho6wYHYvoifkh8OejEC4pQoP.jpg,"[{'name': 'Pathé Renn Productions', 'id': 866}, {'name': 'TF1 Films Production', 'id': 3823}, {'name': 'Bel Ombre Films', 'id': 4600}, {'name': 'Radio Télévision Belge Francophone (RTBF)', 'id': 7466}, {'name': 'Antigone Cinéma', 'id': 22377}, {'name': ""Les Films de l'Etang"", 'id': 22378}]","[{'iso_3166_1': 'BE', 'name': 'Belgium'}, {'iso_3166_1': 'FR', 'name': 'France'}]",2006-11-06,0.0,100.0,"[{'iso_639_1': 'fr', 'name': 'Français'}]",Released,,Odette Toulemonde,False,5.5,36.0
False,,0,"[{'id': 10749, 'name': 'Romance'}, {'id': 18, 'name': 'Drama'}]",,128412,tt0171343,ka,გიორგობისთვე,A young idealist takes a job at a local state run winery only to discover and become disillusioned by the corruption of the Soviet State.,0.318093,/wdlXYEKIvupxV9AUk5ORBs3n1cs.jpg,"[{'name': 'Qartuli Pilmi', 'id': 15406}]","[{'iso_3166_1': 'GE', 'name': 'Georgia'}]",1966-01-01,0.0,91.0,"[{'iso_639_1': 'ka', 'name': 'ქართული'}, {'iso_639_1': 'ru', 'name': 'Pусский'}]",Released,,Falling Leaves,False,4.0,5.0
False,,61000000,"[{'id': 18, 'name': 'Drama'}, {'id': 10402, 'name': 'Music'}, {'id': 10749, 'name': 'Romance'}]",http://www.lesmiserablesfilm.com,82695,tt1707386,en,Les Misérables,"An adaptation of the successful stage musical based on Victor Hugo's classic novel set in 19th-century France, in which a paroled prisoner named Jean Valjean seeks redemption.",13.52408,/qEsrAHoxj746FRb7OLGYjrx1AI3.jpg,"[{'name': 'Universal Pictures', 'id': 33}, {'name': 'Relativity Media', 'id': 7295}, {'name': 'CAMERON MACKINTOSH', 'id': 7923}, {'name': 'Working Title Films', 'id': 10163}]","[{'iso_3166_1': 'GB', 'name': 'United Kingdom'}, {'iso_3166_1': 'US', 'name': 'United States of America'}]",2012-12-18,441809770.0,157.0,"[{'iso_639_1': 'en', 'name': 'English'}]",Released,Fight. Dream. Hope. Love.,Les Misérables,False,7.2,1925.0
False,,3800000,"[{'id': 35, 'name': 'Comedy'}, {'id': 18, 'name': 'Drama'}]",,325346,tt3714720,en,The Hollars,"Aspiring New York City artist, John Hollar returns to his Middle America hometown on the eve of his mother’s brain surgery. Joined by his girlfriend, eight months pregnant with their first child, John is forced to navigate the crazy world he left behind.",5.723985,/csIv174a6GlCiiLQ9GkcwGPWtNN.jpg,"[{'name': 'Groundswell Productions', 'id': 4205}, {'name': 'Sycamore Pictures', 'id': 14319}, {'name': 'Sunday Night', 'id': 29312}]","[{'iso_3166_1': 'US', 'name': 'United States of America'}]",2016-08-25,1016985.0,105.0,"[{'iso_639_1': 'en', 'name': 'English'}]",Released,,The Hollars,False,6.4,81.0
False,,0,"[{'id': 18, 'name': 'Drama'}]",,200447,tt0035068,en,Miss Annie Rooney,"A poor girl falls for a wealthy young man. He invites her to his gala birthday party, but she doesn't have the right kind of dress to wear, so her family and friends band together to raise money to get her the proper dress.",0.116585,/ajJUSnEhxaDOuXccfSag8oSEWFz.jpg,"[{'name': 'United Artists', 'id': 60}, {'name': 'Edward Small Productions', 'id': 13479}]","[{'iso_3166_1': 'US', 'name': 'United States of America'}]",1942-05-29,0.0,82.0,"[{'iso_639_1': 'en', 'name': 'English'}]",Released,Glamor girls beware!,Miss Annie Rooney,False,3.3,2.0
False,,0,"[{'id': 18, 'name': 'Drama'}, {'id': 10769, 'name': 'Foreign'}, {'id': 10749, 'name': 'Romance'}]",http://www.thewaitingroomfilm.com/,24578,tt0902348,en,The Waiting Room,"Two complete strangers, ANNA and STEPHEN, are brought together by chance by an elderly man who waits for his wife on a station platform. Their fateful meeting acts as a catalyst for them to examine and challenge what's going on in their different relationships, and make hard but positive decisions for themselves. If they can change their lives maybe they can meet again.",1.244581,/12JyqU876gY89aPca1WWIkEiNU0.jpg,[],[],2007-08-18,0.0,110.0,[],Released,,The Waiting Room,False,6.3,3.0
False,,0,"[{'id': 35, 'name': 'Comedy'}, {'id': 18, 'name': 'Drama'}, {'id': 10749, 'name': 'Romance'}]",,97598,tt0033780,en,Kathleen,"Kathleen is a 12 year old who lives in a big house with a nanny, a butler, maids, no mother and a father who is working most of the time. She dreams of a family with a mother, father and her, and tells everyone that she has such a family. Because of this story, she cannot invite any friends over as they will see that it is not true.",0.20783,/aJ0i8K545nnBk1qZyxzWUCIJNhX.jpg,"[{'name': 'Metro-Goldwyn-Mayer (MGM)', 'id': 8411}]","[{'iso_3166_1': 'US', 'name': 'United States of America'}]",1941-12-18,0.0,88.0,"[{'iso_639_1': 'en', 'name': 'English'}]",Released,She's twelve and TERRIFIC now,Kathleen,False,6.0,1.0
False,,0,"[{'id': 18, 'name': 'Drama'}, {'id': 10751, 'name': 'Family'}, {'id': 10749, 'name': 'Romance'}]",,14859,tt0435679,en,Keith,"Natalie (Elisabeth Harnois) is high school royalty, but her queen bee status falls apart when she falls for the new guy at school. Although Keith (Jesse McCartney) ignores her at first, they soon become friends -- even though Natalie suspects that Keith has something to hide. As the free-spirited Keith shows Natalie how to embrace what life offers, they grow closer -- until a secret tests the bounds of their relationship",9.560911,/ar8ovH0r2qbwgXjjqpq2EiltElB.jpg,"[{'name': 'Image Entertainment', 'id': 3086}]","[{'iso_3166_1': 'US', 'name': 'United States of America'}]",2008-09-13,0.0,93.0,"[{'iso_639_1': 'en', 'name': 'English'}]",Released,Love is a force you can't control.,Keith,False,7.0,162.0
False,,32000000,"[{'id': 18, 'name': 'Drama'}, {'id': 14, 'name': 'Fantasy'}]",http://www.twowaysthroughlife.com/,8967,tt0478304,en,The Tree of Life,"The impressionistic story of a Texas family in the 1950s. The film follows the life journey of the eldest son, Jack, through the innocence of childhood to his disillusioned adult years as he tries to reconcile a complicated relationship with his father. Jack finds himself a lost soul in the modern world, seeking answers to the origins and meaning of life while questioning the existence of faith.",11.204539,/ptDOdfOg0srtk4TGdeYbLqxv2nd.jpg,"[{'name': 'Fox Searchlight Pictures', 'id': 43}, {'name': 'Plan B Entertainment', 'id': 81}, {'name': 'River Road Entertainment', 'id': 1246}]","[{'iso_3166_1': 'US', 'name': 'United States of America'}]",2011-05-18,54674226.0,139.0,"[{'iso_639_1': 'en', 'name': 'English'}]",Released,Nothing stands still.,The Tree of Life,False,6.5,1009.0
False,,0,"[{'id': 10770, 'name': 'TV Movie'}, {'id': 18, 'name': 'Drama'}]",,149206,tt2201034,en,Holiday Spin,"Blake and his mother Roxy live in Charlotte, NC. Roxy owns a dance studio and Blake is looking forward to a career as a fighter.",0.739783,/fArzgU7j7Nb1DM5iK1w1BTtEBzE.jpg,"[{'name': 'Lifetime', 'id': 3431}, {'name': 'Mystique Films Inc.', 'id': 4852}, {'name': 'Nantucket Productions', 'id': 52141}]","[{'iso_3166_1': 'US', 'name': 'United States of America'}]",2012-11-19,0.0,0.0,[],Released,,Holiday Spin,False,7.0,4.0
False,,0,"[{'id': 80, 'name': 'Crime'}, {'id': 18, 'name': 'Drama'}, {'id': 10749, 'name': 'Romance'}, {'id': 53, 'name': 'Thriller'}]",,48260,tt0112604,en,Butterfly Kiss,"Eunice is walking along the highways of northern England from one filling station to another. She is searching for Judith, the woman, she says to be in love with. It's bad luck for the women at the cash desk not to be Judith, because Eunice is eccentric, angry and extreme dangerous. One day she meets Miriam, hard of hearing and a little ingenuous, who feels sympathy for Eunice and takes her home. Miriam is very impressed by Eunice's fierceness and willfulness and follows her on the search for Judith. Shocked by Eunice's cruelty she tries to make her a better person, but she looses ground herself.",0.877853,/tIN2dXB01aKycVqhcQ2PKTuQIhV.jpg,"[{'name': 'Dan Films', 'id': 1854}, {'name': 'Merseyside Film Production Fund', 'id': 8095}, {'name': 'British Screen Productions', 'id': 12745}]","[{'iso_3166_1': 'GB', 'name': 'United Kingdom'}]",1995-08-18,0.0,88.0,"[{'iso_639_1': 'en', 'name': 'English'}]",Rumored,,Butterfly Kiss,False,7.4,5.0
False,,0,"[{'id': 28, 'name': 'Action'}, {'id': 99, 'name': 'Documentary'}, {'id': 18, 'name': 'Drama'}, {'id': 10769, 'name': 'Foreign'}]",,57394,tt0325165,ko,챔피언,"This biopic tells the true story of Korean boxer Kim Deuk-gu (played by Oh-seong Yu). Born into poverty, Kim used boxing to free himself from his bleak surroundings, eventually becoming the world's top lightweight. Tragically, Kim's life was cut short when he died from a blood clot in his brain during a championship fight with Ray ""Boom Boom"" Mancini. Directed by Kyung-Taek Kwak, this film co-stars Min-seo Chae, Seung-won Yun and Byeong-seo Kim.",0.469409,/bTl1W9nVelQnkdr3t4KLKs73ikn.jpg,"[{'name': 'Cowell', 'id': 947}, {'name': 'Sidus Pictures', 'id': 4983}, {'name': 'Zininsa Film Production', 'id': 7653}]","[{'iso_3166_1': 'KR', 'name': 'South Korea'}]",2002-06-28,0.0,115.0,"[{'iso_639_1': 'ko', 'name': '한국어/조선말'}]",Released,The heart of a Warrior.  The Fight of his Life,Champion,False,3.9,4.0
False,,0,"[{'id': 53, 'name': 'Thriller'}, {'id': 18, 'name': 'Drama'}]",,144229,tt0078105,en,Power Play,"A  thriller, released 1st November 1978, based on the non-fiction book Coup d'État: A Practical Handbook by Edward N. Luttwak.",0.947815,/iTZ8kZAkCSFZXKrKwG8utomr0l6.jpg,"[{'name': 'The Rank Organisation', 'id': 364}, {'name': 'Magnum Films', 'id': 19463}, {'name': 'Cowry', 'id': 40751}]","[{'iso_3166_1': 'CA', 'name': 'Canada'}, {'iso_3166_1': 'GB', 'name': 'United Kingdom'}]",1978-11-01,0.0,102.0,"[{'iso_639_1': 'en', 'name': 'English'}]",Released,,Power Play,False,8.0,2.0
False,,0,"[{'id': 18, 'name': 'Drama'}, {'id': 10751, 'name': 'Family'}, {'id': 10749, 'name': 'Romance'}]",,73628,tt1731230,tr,Turquaze,,1.201392,/l8cn2iwK95pxR2BwMtb77tmuedl.jpg,[],[],2010-09-29,0.0,0.0,[],Released,,Turquaze,False,6.8,4.0
False,,4000000,"[{'id': 14, 'name': 'Fantasy'}, {'id': 18, 'name': 'Drama'}, {'id': 27, 'name': 'Horror'}, {'id': 35, 'name': 'Comedy'}]",,21588,tt0109592,it,Dellamorte Dellamore,"A cemetery man has the unusual problem of the dead rising from the grave. Himself and his assistant must end these creatures' lives again after they are reborn. Everything is going well until ""She"" comes along and stirs things up a bit.",6.247819,/v9yBEb4NU5P3LWm4kcJfq4qjUKg.jpg,"[{'name': 'Canal+', 'id': 5358}, {'name': 'Silvio Berlusconi Communications', 'id': 8694}, {'name': ""Fonds Eurimages du Conseil de l'Europe"", 'id': 11011}, {'name': 'Urania Film', 'id': 12242}, {'name': 'K.G Productions', 'id': 13837}, {'name': 'Audifilm', 'id': 20849}, {'name': 'Bibo Productions', 'id': 86308}]","[{'iso_3166_1': 'FR', 'name': 'France'}, {'iso_3166_1': 'DE', 'name': 'Germany'}, {'iso_3166_1': 'IT', 'name': 'Italy'}]",1994-03-25,0.0,105.0,"[{'iso_639_1': 'en', 'name': 'English'}, {'iso_639_1': 'it', 'name': 'Italiano'}]",Released,"Zombies, guns, and sex, OH MY!!!",Cemetery Man,False,7.0,105.0
False,,0,"[{'id': 80, 'name': 'Crime'}, {'id': 18, 'name': 'Drama'}]",,262945,tt0052553,de,"Am Tag, als der Regen kam",Motorcylce driving kids in pre-war Germany commit crime at night.,0.660252,/w6R1gW69AOmdDZz10T1YAazT4K6.jpg,[],[],1959-11-24,0.0,88.0,"[{'iso_639_1': 'de', 'name': 'Deutsch'}]",Released,,"Am Tag, als der Regen kam",False,5.0,1.0
False,,0,"[{'id': 9648, 'name': 'Mystery'}, {'id': 18, 'name': 'Drama'}, {'id': 27, 'name': 'Horror'}, {'id': 53, 'name': 'Thriller'}]",,10842,tt0492784,ja,奇妙なサーカス,"The erotic novelist Taeko is writing a morbid story of a family destroyed by incest, murder and abuse. Her assistant, Yuji, sets on a mission to uncover the reality of this story, but the reality might be too much to bear.",3.171093,/2LakCwX199vRvvggN3fFe4eYq1u.jpg,"[{'name': 'TLA Releasing', 'id': 328}, {'name': 'Sedic', 'id': 4649}]","[{'iso_3166_1': 'JP', 'name': 'Japan'}]",2005-12-24,0.0,108.0,"[{'iso_639_1': 'ja', 'name': '日本語'}]",Released,,Strange Circus,False,7.1,47.0
False,,0,"[{'id': 18, 'name': 'Drama'}]",,70734,tt0014605,en,The White Sister,"Angela Chiaromonte (Lillian Gish) is the daughter of a wealthy Italian prince who is killed in a fall from his horse. Though Angela stands to inherit half of a large estate, her older half-sister burns the will and thus inherits everything herself, throwing Angela into poverty. Fortunately, Angela is engaged to marry dashing Captain Giovanni Severi (Ronald Colman) - but he soon is captured by Arabs while on an expedition to Africa. Believing him dead, Angela, dedicating her life to his memory, becomes a nun, unaware that her lover has escaped his captors and is returning to Italy! The dramatic climax takes place against a backdrop of the eruption of Mount Vesuvius.",0.158491,/n13a1bR4zYGRFhjYoiMvJBQV1VL.jpg,"[{'name': 'Inspiration Pictures', 'id': 19599}]","[{'iso_3166_1': 'US', 'name': 'United States of America'}]",1923-09-05,0.0,135.0,[],Released,,The White Sister,False,7.8,3.0
False,,2500000,"[{'id': 18, 'name': 'Drama'}, {'id': 36, 'name': 'History'}]",,49633,tt0018054,en,The King of Kings,"The King of Kings is the Greatest Story Ever Told as only Cecil B. DeMille could tell it. In 1927, working with one of the biggest budgets in Hollywood history, DeMille spun the life and Passion of Christ into a silent-era blockbuster. Featuring text drawn directly from the Bible, a cast of thousands, and the great showman’s singular cinematic bag of tricks, The King of Kings is at once spectacular and deeply reverent—part Gospel, part Technicolor epic.",1.487999,/k5w3u0prQXmRpj4ocVYoUthLypR.jpg,"[{'name': 'DeMille Pictures Corporation', 'id': 28230}]","[{'iso_3166_1': 'US', 'name': 'United States of America'}]",1927-01-01,0.0,155.0,"[{'iso_639_1': 'en', 'name': 'English'}]",Released,Supreme in Theme! Gigantic in Execution!,The King of Kings,False,5.6,8.0
False,,0,"[{'id': 18, 'name': 'Drama'}, {'id': 10749, 'name': 'Romance'}, {'id': 35, 'name': 'Comedy'}]",,196802,tt0025731,en,Romance in Manhattan,"Ginger Rogers and Francis Lederer share equal billing -- and near-equal screen time -- in this amiable RKO programmer.
 Lederer plays Karel Novak, an incredibly naïve Czech immigrant who is taken under the wing of streetwise New York chorus girl Sylvia Dennis (Rogers).
 With the help of lovable cop-on-the-beat Murphy (J. Farrel McDonald), Sylvia hides Karel from the immigration authorities and ultimately falls in love with him.
 In addition to Karel's illegal-alien status, the plot is complicated by a crooked lawyer (Arthur Hohl) and a group of well-meaning welfare workers who endeavor to place Sylvia's kid brother Frank (Jimmy Butler) in a foster home.",0.118509,/jZQkWSFajlLWJAQ6yiRXod7TYQo.jpg,"[{'name': 'RKO Radio Pictures', 'id': 6}]","[{'iso_3166_1': 'US', 'name': 'United States of America'}]",1935-01-11,0.0,73.0,"[{'iso_639_1': 'cs', 'name': 'Český'}, {'iso_639_1': 'en', 'name': 'English'}, {'iso_639_1': 'es', 'name': 'Español'}]",Released,,Romance in Manhattan,False,3.3,2.0
False,,0,"[{'id': 18, 'name': 'Drama'}, {'id': 53, 'name': 'Thriller'}, {'id': 80, 'name': 'Crime'}]",http://www.magpictures.com/compliance/,84188,tt1971352,en,Compliance,"Sandra is the manager at a fast-food restaurant, and Becky is her teenaged counter girl who really needs the job. One stressful day, a police officer telephones and accuses Becky of stealing money from a customer’s purse, which Becky vehemently denies. Sandra, overwhelmed by her managerial responsibilities, complies with the officer’s orders to detain Becky, beginning a nightmare that tragically blurs the lines between expedience, prudence, legality and reason.",7.563444,/1kW3cUREVpmlVUiOmZmNUOYTtSi.jpg,"[{'name': 'Muskat Filmed Properties', 'id': 10989}, {'name': 'Bad Cop Bad Cop Film Productions', 'id': 12649}, {'name': 'Dogfish Pictures', 'id': 12650}]","[{'iso_3166_1': 'US', 'name': 'United States of America'}]",2012-08-23,319285.0,90.0,"[{'iso_639_1': 'en', 'name': 'English'}, {'iso_639_1': 'fr', 'name': 'Français'}, {'iso_639_1': 'de', 'name': 'Deutsch'}]",Released,Power. Manipulation. Obedience.,Compliance,False,6.3,225.0
False,,60000000,"[{'id': 80, 'name': 'Crime'}, {'id': 18, 'name': 'Drama'}, {'id': 28, 'name': 'Action'}, {'id': 53, 'name': 'Thriller'}]",http://gangstersquad.warnerbros.com/,82682,tt1321870,en,Gangster Squad,"Los Angeles, 1949. Ruthless, Brooklyn-born mob king Mickey Cohen runs the show in this town, reaping the ill-gotten gains from the drugs, the guns, the prostitutes and — if he has his way — every wire bet placed west of Chicago. And he does it all with the protection of not only his own paid goons, but also the police and the politicians who are under his control. It’s enough to intimidate even the bravest, street-hardened cop… except, perhaps, for the small, secret crew of LAPD outsiders led by Sgt. John O’Mara and Jerry Wooters who come together to try to tear Cohen’s world apart.",8.581558,/qutxlK5ggpFZ2Cq0a4sOUsUNvKB.jpg,"[{'name': 'Village Roadshow Pictures', 'id': 79}, {'name': 'Lin Pictures', 'id': 2723}, {'name': 'Warner Bros.', 'id': 6194}, {'name': 'Langley Park Production', 'id': 8057}]","[{'iso_3166_1': 'US', 'name': 'United States of America'}]",2013-01-10,105200903.0,113.0,"[{'iso_639_1': 'en', 'name': 'English'}]",Released,No Names. No Badges. No Mercy.,Gangster Squad,False,6.2,1805.0
False,,0,"[{'id': 18, 'name': 'Drama'}]",,87060,tt0031828,en,The Proud Valley,"In a Welsh coal mining valley, a young man with a beautiful singing voice is called upon to make the ultimate sacrifice when a pit disaster threatens.",0.691801,/9e8L3FOdYL59MTvqxucAwuKC0NJ.jpg,"[{'name': 'Ealing Studios', 'id': 2650}]","[{'iso_3166_1': 'GB', 'name': 'United Kingdom'}]",1940-04-06,0.0,76.0,"[{'iso_639_1': 'en', 'name': 'English'}]",Released,,The Proud Valley,False,6.2,3.0
False,,3000000,"[{'id': 18, 'name': 'Drama'}]",,95466,tt0279037,en,Heart of America,"Starring Jurgen Prochnow ('The Replacement Killers' 'Air Force One' and Patrick Muldoon 'Stigmata' 'Starship Troopers'), 'Heart of America' is a powerhouse of a contemporary drama and essential viewing for anyone who was captivated by Michael Moore's 'Bowling For Columbine'.  It is the last day of high school and the unthinkable is about to happen.  Distraught at the constant abuse and bullying they have been subjected to, two students have made a suicide pact. But before they take their own lives, they are determined to cause chaos and murder amongst their fellow students.",0.290726,/kkiK7rGEml2EZZH39UI8FOtmfZs.jpg,[],[],2002-09-05,0.0,87.0,"[{'iso_639_1': 'en', 'name': 'English'}]",Released,When pushed too far the VICTIMS of violence seek REVENGE!,Heart of America,False,4.7,7.0
False,,0,"[{'id': 18, 'name': 'Drama'}, {'id': 10751, 'name': 'Family'}]",,48259,tt0090886,en,Crimes of the Heart,"Three sisters with quite different personalities and lives reunite when the youngest of them, Babe, has just shot her husband. The oldest sister, Lenny, takes care of their grandfather and is turning into an old maid, while Meg, who tries to make it in Hollywood as a singer/actress, has had a wild life filled with many men. Their reunion causes much joy, but also many tensions.",2.524937,/fSUFUAFsTiQJy5tDjEdYUM4Aqa1.jpg,"[{'name': 'De Laurentiis Entertainment Group (DEG)', 'id': 484}, {'name': 'De Laurentiis', 'id': 544}, {'name': 'Crimes of the Heart S.A', 'id': 62343}]","[{'iso_3166_1': 'US', 'name': 'United States of America'}]",1986-12-12,22905522.0,105.0,"[{'iso_639_1': 'en', 'name': 'English'}]",Post Production,Meg just left one. Lenny never had one. Babe just shot one. The MaGrath sisters sure have a way with men,Crimes of the Heart,False,6.0,17.0
False,,0,"[{'id': 18, 'name': 'Drama'}, {'id': 80, 'name': 'Crime'}]",,84352,tt0063781,en,The Violent Enemy,During the troubles in Ireland an IRA bomb plot is hatched to blow up a British power station. Sean Rogan (Tom Bell) is an IRA bomb expert and escapes from prison to try and stop the destruction.,0.022183,/zdMgT1mu131I4VBpgIOryShAzHc.jpg,"[{'name': 'Group W', 'id': 8412}]","[{'iso_3166_1': 'GB', 'name': 'United Kingdom'}]",1967-05-01,0.0,94.0,"[{'iso_639_1': 'en', 'name': 'English'}]",Released,,The Violent Enemy,False,0.0,0.0
False,,14000000,"[{'id': 18, 'name': 'Drama'}, {'id': 10749, 'name': 'Romance'}]",,1713,tt0102175,en,Jungle Fever,A successful and married black man contemplates having an affair with a white girl from work. He's quite rightly worried that the racial difference would make an already taboo relationship even worse.,7.701918,/eSWv0PSnBqQbSBzce6iaDFkf6T9.jpg,"[{'name': 'Universal Pictures', 'id': 33}, {'name': '40 Acres & A Mule Filmworks', 'id': 4319}]","[{'iso_3166_1': 'US', 'name': 'United States of America'}]",1991-06-07,32482682.0,132.0,"[{'iso_639_1': 'en', 'name': 'English'}]",Released,,Jungle Fever,False,6.0,71.0
False,,0,"[{'id': 18, 'name': 'Drama'}]",,42713,tt0062425,en,Up the Down Staircase,"Sylvia Barrett is a rookie teacher at New York's inner-city Calvin Coolidge High: her lit classes are overcrowded, a window is broken, there's no chalk, books arrive late. The administration is concerned mainly with forms and rules (there's an up and and a down staircase); bells ring at the wrong time. Nevertheless, she tries. How she handles the chaos and her despair in her first semester makes up the film: a promising student drops out, another sleeps through class, a girl with a crush on a male teacher gets suicidal, and a bright but troublesome student misunderstands Sylvia's reaching out. A discussion of Dickens, parents' night, and a mock trial highlight the term. Can she make it?",0.604325,/bSPKwS3JaGaNL6EAuLVb46y32Im.jpg,"[{'name': 'Park Place Production', 'id': 27756}]","[{'iso_3166_1': 'US', 'name': 'United States of America'}]",1967-01-19,0.0,124.0,"[{'iso_639_1': 'en', 'name': 'English'}]",Released,"Simple words that start a war: ""Good morning. My name is Miss Barrett. I am your Home Room teacher...""",Up the Down Staircase,False,6.2,5.0
False,,55000000,"[{'id': 36, 'name': 'History'}, {'id': 18, 'name': 'Drama'}, {'id': 10402, 'name': 'Music'}]",http://en.wikipedia.org/wiki/Evita_(film),8818,tt0116250,en,Evita,"The hit musical based on the life of Evita Duarte, a B-movie Argentinian actress who eventually became the wife of Argentinian president and dictator Juan Perón, and the most beloved and hated woman in Argentina.",6.709803,/7uYGJTxaeCtek6afNLPCuYCyiV4.jpg,"[{'name': 'Hollywood Pictures', 'id': 915}, {'name': 'Cinergi Pictures Entertainment', 'id': 1504}]","[{'iso_3166_1': 'US', 'name': 'United States of America'}, {'iso_3166_1': 'HU', 'name': 'Hungary'}]",1996-12-14,141047179.0,134.0,"[{'iso_639_1': 'en', 'name': 'English'}, {'iso_639_1': 'es', 'name': 'Español'}]",Released,The Most Anticipated Motion Picture Event of The Year,Evita,False,5.9,122.0
False,,0,"[{'id': 35, 'name': 'Comedy'}, {'id': 18, 'name': 'Drama'}, {'id': 10751, 'name': 'Family'}]",,43901,tt0024831,en,Anne of Green Gables,"Anne Shirley, an orphan, is adopted by farmer Matthew Cuthbert and his sister Marilla, who were expecting a boy to help with their farm work. However, they accept Anne, who quickly endears herself to them and to the local villagers",0.246075,/jROFvjHGqEBQfNQaC5awWL2oPsd.jpg,"[{'name': 'RKO Radio Pictures', 'id': 6}]","[{'iso_3166_1': 'US', 'name': 'United States of America'}]",1934-11-23,0.0,78.0,"[{'iso_639_1': 'en', 'name': 'English'}]",Released,"A PICTURE MADE FOR THE MILLIONS WHO LOVED ""LITTLE WOMEN""",Anne of Green Gables,False,5.2,5.0
