adult,belongs_to_collection,budget,genres,homepage,id,imdb_id,original_language,original_title,overview,popularity,poster_path,production_companies,production_countries,release_date,revenue,runtime,spoken_languages,status,tagline,title,video,vote_average,vote_count
False,,200000,"[{'id': 12, 'name': 'Adventure'}, {'id': 18, 'name': 'Drama'}, {'id': 878, 'name': 'Science Fiction'}]",,322614,tt4362764,en,Crumbs,Our figurine sized supermen hero embarks on an epic surreal journey that will take him across the Ethiopian post apocalyptic landscape in search of a way to get on the hovering spacecraft that for years has become a landmark in the skies.,0.230976,/Avq4lIpZpx3KhP8SOR1d1VLjvc8.jpg,"[{'name': 'Lanzadera Films', 'id': 45436}, {'name': 'BiraBiro Films', 'id': 45437}]","[{'iso_3166_1': 'FI', 'name': 'Finland'}, {'iso_3166_1': 'ET', 'name': 'Ethiopia'}, {'iso_3166_1': 'ES', 'name': 'Spain'}]",2015-01-27,0.0,68.0,"[{'iso_639_1': 'am', 'name': ''}]",Released,,Crumbs,False,6.4,4.0
False,,0,"[{'id': 12, 'name': 'Adventure'}]",,282266,tt0012881,en,The Adventures of Robinson Crusoe,An 18-part silent American adventure film serial now considered to be lost.  Chapter Titles: 1. The Sea Raiders 2. Shipwrecked 3. The Cannibals' Captives 4. Hidden Gold 5. The Ship of Despair 6. Friday's Faith 7. The Swamp of Terror 8. Marooned 9. The Jaguar Trap 10. A Prisoner of the Sun 11. No Greater Love 12. The Island of Happiness 13. The Sword of Courage 14. The Buccaneers 15. The Jolly Roger 16. The Idol's Bride 17. When the Heart Calls 18. Back to the Primitive,0.008978,,"[{'name': 'Universal Film Manufacturing Company', 'id': 13133}]","[{'iso_3166_1': 'US', 'name': 'United States of America'}]",1922-03-27,0.0,0.0,[],Released,,The Adventures of Robinson Crusoe,False,0.0,0.0
False,,4200000,"[{'id': 12, 'name': 'Adventure'}]",,73501,tt0834941,en,A Plumm Summer,"Based on a true-story - A Plumm Summer tells the remarkable tale of two young brothers, Elliott and Rocky Plumm, who go head-to-head with the FBI in order to crack the ""frog-napping"" case and get their beloved TV puppet, Froggy Doo back on the air, all the while become local heroes and best friends.",0.163851,/cgytoqWLj62xASqLTQWZXipYTD3.jpg,"[{'name': 'Fairplay Pictures', 'id': 63967}, {'name': 'Home Team Productions', 'id': 63968}]","[{'iso_3166_1': 'US', 'name': 'United States of America'}]",2007-01-01,0.0,99.0,[],Released,,A Plumm Summer,False,5.7,3.0
False,,15000000,"[{'id': 28, 'name': 'Action'}, {'id': 12, 'name': 'Adventure'}, {'id': 18, 'name': 'Drama'}, {'id': 27, 'name': 'Horror'}, {'id': 878, 'name': 'Science Fiction'}]",,315011,tt4262980,ja,シン・ゴジラ,"From the mind behind Evangelion comes a hit larger than life.  When a massive, gilled monster emerges from the deep and tears through the city, the government scrambles to save its citizens.  A rag-tag team of volunteers cuts through a web of red tape to uncover the monster's weakness and its mysterious ties to a foreign superpower.  But time is not on their side - the greatest catastrophe to ever befall the world is about to evolve right before their very eyes.",9.285519,/8YWirGQidtZeSEmhqvQM5FrI6N1.jpg,"[{'name': 'Cine Bazar', 'id': 5896}, {'name': 'Toho Pictures', 'id': 49301}]","[{'iso_3166_1': 'JP', 'name': 'Japan'}]",2016-07-29,77000000.0,120.0,"[{'iso_639_1': 'it', 'name': 'Italiano'}, {'iso_639_1': 'de', 'name': 'Deutsch'}, {'iso_639_1': 'en', 'name': 'English'}, {'iso_639_1': 'ja', 'name': '日本語'}]",Released,A god incarnate. A city doomed.,Shin Godzilla,False,6.6,152.0
False,"{'id': 131295, 'name': 'Captain America Collection', 'poster_path': '/2tOgiY533JSFp7OrVlkeRJvsZpI.jpg', 'backdrop_path': '/nZSYqitBkAvmoq5IrsGsSWuhSC8.jpg'}",170000000,"[{'id': 28, 'name': 'Action'}, {'id': 12, 'name': 'Adventure'}, {'id': 878, 'name': 'Science Fiction'}]",http://www.captainamericathewintersoldiermovie.com,100402,tt1843866,en,Captain America: The Winter Soldier,"After the cataclysmic events in New York with The Avengers, Steve Rogers, aka Captain America is living quietly in Washington, D.C. and trying to adjust to the modern world. But when a S.H.I.E.L.D. colleague comes under attack, Steve becomes embroiled in a web of intrigue that threatens to put the world at risk. Joining forces with the Black Widow, Captain America struggles to expose the ever-widening conspiracy while fighting off professional assassins sent to silence him at every turn. When the full scope of the villainous plot is revealed, Captain America and the Black Widow enlist the help of a new ally, the Falcon. However, they soon find themselves up against an unexpected and formidable enemy—the Winter Soldier.",18.717704,/5TQ6YDmymBpnF005OyoB7ohZps9.jpg,"[{'name': 'Marvel Studios', 'id': 420}]","[{'iso_3166_1': 'US', 'name': 'United States of America'}]",2014-03-20,714766572.0,136.0,"[{'iso_639_1': 'en', 'name': 'English'}]",Released,In heroes we trust.,Captain America: The Winter Soldier,False,7.6,5881.0
False,"{'id': 232844, 'name': ""Nim's Island Collection"", 'poster_path': '/rRPq295zZflnjp9Y8uhJppJBayQ.jpg', 'backdrop_path': '/iRh0E4dR2m7ZiJQ9u58r8jPV0WU.jpg'}",0,"[{'id': 10751, 'name': 'Family'}, {'id': 12, 'name': 'Adventure'}]",,172386,tt2221648,en,Return to Nim's Island,"Fourteen year old Nim, more determined than ever to protect her island and all the wildlife that call it home, faces off against resort developers and animal poachers. Soon she realizes she can’t depend on her animal cohorts alone and must make her first human friend – Edmund, who’s run away to the island from the mainland – to save her home.",3.098933,/4qvNFKT0fBkNxj0ABd7dlKDfbB5.jpg,"[{'name': 'Universal Pictures Germany GmbH', 'id': 66178}]","[{'iso_3166_1': 'AU', 'name': 'Australia'}, {'iso_3166_1': 'US', 'name': 'United States of America'}]",2013-03-15,0.0,90.0,"[{'iso_639_1': 'en', 'name': 'English'}]",Released,"Adventure runs wild, again.",Return to Nim's Island,False,4.8,37.0
False,,0,"[{'id': 12, 'name': 'Adventure'}, {'id': 10751, 'name': 'Family'}, {'id': 14, 'name': 'Fantasy'}]",,20891,tt0145033,ru,Korolevstvo Krivykh Zerkal,"Kingdom of Crooked Mirrors is a 1964 Soviet fairy tale film directed by Aleksandr Rou based on a story with the same name by Vitali Gubarev. Both the surreal story by Vladimir Gubarev, together with the 1964 film, written in a Through The Looking Glass style. Alice-type Soviet girl, named Olya meets her counterpart Yalo, while looking into the mirror. Yalo is an absolute antipode to Olya, for example where Olya is precise and neat, Yalo is absent-minded, careless, etc. The explicit plot relates to Olya learning to see herself differently, but this occurs through an experience in the Kingdom of Crooked Mirrors which serves as a mechanism for commenting on the ability of a society to manufacture a false reality.",1.22313,/5noVt8y6OAHUBJX43z7vz3RAgr5.jpg,"[{'name': 'Gorky Film Studios', 'id': 21978}]","[{'iso_3166_1': 'RU', 'name': 'Russia'}]",1963-05-05,0.0,80.0,"[{'iso_639_1': 'ru', 'name': 'Pусский'}]",Released,,Kingdom of Crooked Mirrors,False,6.0,9.0
False,,0,"[{'id': 18, 'name': 'Drama'}, {'id': 28, 'name': 'Action'}, {'id': 12, 'name': 'Adventure'}]",,413235,tt0046497,en,The Veils of Bagdad,"Antar is sent by Suleiman, head of the Ottoman Empire, to Bagdad to prevent Hammam, Pasha of Bagdad, from purchasing the services of local leader Mustapha to unite the hill tribes and overthrow the emperor. The intrigue mounts as Antar falls in love with dancer Selima, who tries to avenge her father's death against Hammam's right-hand-man Kasseim, whose wife Rosanna has fallen in love with Antar!",0.059093,/oSBK0sO3RZvAGzAw4LdZoRFBf4T.jpg,"[{'name': 'Universal International Pictures (UI)', 'id': 10330}]","[{'iso_3166_1': 'US', 'name': 'United States of America'}]",1953-10-06,0.0,82.0,[],Released,For gold ! For glory ! For wild pagan lips !,The Veils of Bagdad,False,0.0,0.0
False,"{'id': 383632, 'name': 'A Man Called Horse Collection', 'poster_path': None, 'backdrop_path': None}",0,"[{'id': 28, 'name': 'Action'}, {'id': 12, 'name': 'Adventure'}, {'id': 18, 'name': 'Drama'}, {'id': 37, 'name': 'Western'}]",,14676,tt0066049,en,A Man Called Horse,In 1825 an English aristocrat is captured by Indians. He lives with them and begins to understand/accept their lifestyles. Eventually he is accepted as part of the tribe and becomes their leader.,14.35552,/8IReudOtlGuE6Z4GCPlTgDOlRO0.jpg,"[{'name': 'Cinema Center Films', 'id': 3070}, {'name': 'Sandy Howard Productions', 'id': 5538}]","[{'iso_3166_1': 'US', 'name': 'United States of America'}]",1970-05-01,0.0,114.0,"[{'iso_639_1': 'en', 'name': 'English'}, {'iso_639_1': 'fr', 'name': 'Français'}]",Released,A man called,A Man Called Horse,False,6.6,58.0
False,,0,"[{'id': 18, 'name': 'Drama'}, {'id': 28, 'name': 'Action'}, {'id': 12, 'name': 'Adventure'}, {'id': 80, 'name': 'Crime'}, {'id': 53, 'name': 'Thriller'}]",,22213,tt0106455,en,Boiling Point,"Red is an aging scam-artist who's just been released from prison together with Ronnie, a young and not-so-bright hoodlum who is easily manipulated. Their new business is to organize fake-money sales and then kill the buyer to take his money; but when Ronnie kills an undercover secret service agent, his partner Jimmy Mercer vows revenge and is given one week to catch the killers before being transferred. Written by Giancarlo Cairella",2.124785,/okpmrzlVDdXNhQms2I41Yek6Wyv.jpg,"[{'name': 'StudioCanal', 'id': 694}, {'name': 'Warner Bros.', 'id': 6194}]","[{'iso_3166_1': 'US', 'name': 'United States of America'}]",1993-04-16,0.0,92.0,"[{'iso_639_1': 'en', 'name': 'English'}]",Released,He's a cop who reached the Boiling Point,Boiling Point,False,4.6,26.0
