adult,belongs_to_collection,budget,genres,homepage,id,imdb_id,original_language,original_title,overview,popularity,poster_path,production_companies,production_countries,release_date,revenue,runtime,spoken_languages,status,tagline,title,video,vote_average,vote_count
False,,6000000,"[{'id': 36, 'name': 'History'}, {'id': 18, 'name': 'Drama'}, {'id': 37, 'name': 'Western'}, {'id': 80, 'name': 'Crime'}]",,642,tt0064115,en,Butch Cassidy and the Sundance Kid,"In late 1890s Wyoming, Butch Cassidy is the affable, clever and talkative leader of the outlaw Hole in the Wall Gang. His closest companion is the laconic dead-shot 'Sundance Kid'. As the west rapidly becomes civilized, the law finally catches up to Butch, Sundance and their gang.  Chased doggedly by a special posse, the two decide to make their way to South America in hopes of evading their pursuers once and for all.",6.714577,/jQH0mTzQ1gQ56H8a0z52WreiEok.jpg,"[{'name': 'Twentieth Century Fox Film Corporation', 'id': 306}, {'name': 'Campanile Productions', 'id': 381}, {'name': 'Newman-Foreman Productions', 'id': 382}]","[{'iso_3166_1': 'US', 'name': 'United States of America'}]",1969-09-23,102308889.0,110.0,"[{'iso_639_1': 'en', 'name': 'English'}, {'iso_639_1': 'es', 'name': 'Español'}]",Released,"Not that it matters, but most of it is true.",Butch Cassidy and the Sundance Kid,False,7.4,659.0
False,,8500000,"[{'id': 28, 'name': 'Action'}, {'id': 80, 'name': 'Crime'}, {'id': 53, 'name': 'Thriller'}]",,2099,tt0091828,en,Raw Deal,"Mark Kaminsky is kicked out of the FBI for his rough treatment of a suspect. He winds up as the sheriff of a small town in North Carolina. FBI Chief Harry Shannon, whose son has been killed by a mobster named Patrovina, enlists Kaminsky in a personal vendetta with a promise of reinstatement into the FBI if Patrovina is taken down. To accomplish this, he must go undercover and join Patrovina's gang.",9.292099,/a6A3h6rAnQ4hTfZ80AQGZtGAVfj.jpg,"[{'name': 'De Laurentiis Entertainment Group (DEG)', 'id': 484}, {'name': 'Famous Films (II)', 'id': 3418}, {'name': 'International Film Corporation', 'id': 22847}]","[{'iso_3166_1': 'US', 'name': 'United States of America'}]",1986-06-06,16209459.0,106.0,"[{'iso_639_1': 'en', 'name': 'English'}]",Released,Nobody gives him a Raw Deal,Raw Deal,False,5.5,159.0
False,"{'id': 402380, 'name': 'Pitbull - Kolekcja', 'poster_path': '/4SB9F6P9K9445EJZoYfNZ8a56RL.jpg', 'backdrop_path': None}",0,"[{'id': 28, 'name': 'Action'}, {'id': 80, 'name': 'Crime'}, {'id': 18, 'name': 'Drama'}]",,425961,tt6212346,pl,Pitbull. Niebezpieczne kobiety,Two new female police officers struggle to survive a force filled with corrupt superiors and the brutal world of the criminal mafia.,1.480751,/hsK9VuKFm3CG84UxWLyiHXw7L6T.jpg,[],"[{'iso_3166_1': 'PL', 'name': 'Poland'}]",2016-11-11,0.0,135.0,"[{'iso_639_1': 'pl', 'name': 'Polski'}]",Released,,Pitbull Tough Women,False,6.3,16.0
False,,0,"[{'id': 80, 'name': 'Crime'}]",,160907,tt2364659,en,The Fall of the Essex Boys,"The rise and fall of the Essex Boys gang - the drugs, the violence and, of course, the murders. The real story is the most shocking of all.",0.778634,/qLAcBbqL0ive4aj0jirLuXbXBca.jpg,"[{'name': 'Chata Pictures', 'id': 13212}]","[{'iso_3166_1': 'GB', 'name': 'United Kingdom'}]",2012-02-07,0.0,87.0,"[{'iso_639_1': 'en', 'name': 'English'}]",Released,You think you know about the Range Rover murders...Think again.,The Fall of the Essex Boys,False,4.5,13.0
False,,0,"[{'id': 80, 'name': 'Crime'}, {'id': 18, 'name': 'Drama'}]",,26829,tt0049340,en,The Houston Story,A Texas oil driller schemes to steal millions of dollars in oil.,0.608893,/5fgckfyDPdeDDOtcxcWRdZwLyBV.jpg,"[{'name': 'Clover Productions', 'id': 3458}]","[{'iso_3166_1': 'US', 'name': 'United States of America'}]",1956-02-01,0.0,79.0,"[{'iso_639_1': 'en', 'name': 'English'}]",Released,Terror Over Texas!,The Houston Story,False,5.0,1.0
False,,0,"[{'id': 18, 'name': 'Drama'}, {'id': 53, 'name': 'Thriller'}, {'id': 80, 'name': 'Crime'}, {'id': 10749, 'name': 'Romance'}]",,14864,tt0099797,en,The Hot Spot,"A loner moves in to a small Texas town, finds himself a job, and sets about plotting to rob the local bank.",3.985689,/fMY8wTX1xYxWDuXEOPkfNwAzguo.jpg,"[{'name': 'Orion Pictures', 'id': 41}]","[{'iso_3166_1': 'US', 'name': 'United States of America'}]",1990-10-12,1293976.0,130.0,"[{'iso_639_1': 'en', 'name': 'English'}]",Released,,The Hot Spot,False,6.4,48.0
False,"{'id': 289531, 'name': 'Gator Collection', 'poster_path': '/rjtfKD9PBHgQN44F6OSYQ6T6NBY.jpg', 'backdrop_path': None}",0,"[{'id': 18, 'name': 'Drama'}, {'id': 80, 'name': 'Crime'}, {'id': 28, 'name': 'Action'}]",,21882,tt0074564,en,Gator,"After his release from prison, notorious ex-con and moonshine distiller Gator McKlusky moves in with his father in a cabin in the Okefenokee Swamp. His bootlegging plans are cut short, however, when a federal agent tells McKlusky that he will lose custody of his 9-year-old daughter unless he helps bring down local crime lord Bama McCall. McKlusky enlists the help of reporter Aggie Maybank and a few local eccentrics to bring down McCall's empire.",3.078583,/w5CLk9kKlEHCS7RqP7QAQ7qSqvI.jpg,"[{'name': 'United Artists', 'id': 60}, {'name': 'Levy-Gardner-Laven', 'id': 36248}]","[{'iso_3166_1': 'US', 'name': 'United States of America'}]",1976-08-25,0.0,115.0,"[{'iso_639_1': 'en', 'name': 'English'}]",Released,Come and get him.,Gator,False,4.9,16.0
False,,0,"[{'id': 80, 'name': 'Crime'}, {'id': 18, 'name': 'Drama'}, {'id': 9648, 'name': 'Mystery'}]",,339527,tt1291570,en,Solace,"A psychic doctor, John Clancy, works with an FBI special agent in search of a serial killer. After having lived in isolation for two years, since the death of his daughter, Clancy is asked by his friend Joe, an FBI special agent to help him solve several murders committed by a serial killer.",12.642675,/4MkNIKVZxYkga4208RXdRZ76zjf.jpg,"[{'name': 'New Line Cinema', 'id': 12}, {'name': 'Eden Rock Media', 'id': 2273}, {'name': 'Grindstone Entertainment Group', 'id': 3604}, {'name': 'FilmNation Entertainment', 'id': 7493}, {'name': 'Silver Reel', 'id': 12075}, {'name': 'Venture Forth', 'id': 20313}, {'name': 'Flynn Picture Company', 'id': 34081}, {'name': 'Lionsgate Premiere', 'id': 85885}, {'name': 'Supersensory', 'id': 88460}]","[{'iso_3166_1': 'US', 'name': 'United States of America'}]",2015-09-03,22586863.0,101.0,"[{'iso_639_1': 'en', 'name': 'English'}]",Released,"A serial killer who can see your future, a psychic who can save it",Solace,False,6.2,740.0
False,,0,"[{'id': 80, 'name': 'Crime'}, {'id': 18, 'name': 'Drama'}, {'id': 53, 'name': 'Thriller'}]",,8422,tt0054248,it,Rocco e i suoi fratelli,"The widow Rosaria moves to Milano from Lucania with her 4 sons, one of whom is Rocco. The fifth son, Vincenzo, already lives in Milano. In the beginning, the family has a lot of problems, but everyone manages to find something to do. Simone is boxing, Rocco works in a dry cleaners, and Ciro studies. Simone meets Nadia, a prostitute, and they have a stormy affair. Then Rocco, after finishing his military service, begins a relationship with her. A bitter feud ensues between the two brothers, which will lead as far as murder...",4.21602,/7EbZaKYAX97pVbyRDZfTp8sTYbQ.jpg,"[{'name': 'Titanus', 'id': 641}, {'name': 'Les Films Marceau', 'id': 2260}]","[{'iso_3166_1': 'IT', 'name': 'Italy'}, {'iso_3166_1': 'FR', 'name': 'France'}]",1960-10-06,0.0,178.0,"[{'iso_639_1': 'it', 'name': 'Italiano'}]",Released,DARING in its realism. STUNNING in its impact. BREATHTAKING in its scope.,Rocco and His Brothers,False,7.7,65.0
False,,83000000,"[{'id': 80, 'name': 'Crime'}, {'id': 53, 'name': 'Thriller'}]",,165739,tt1551630,en,Pawn,A petty robbery spirals into a tense hostage situation after three gunmen hold up a diner that's a front for the mob.,4.525671,/yGYFuvUOCtC5ED298WcOIkDev7K.jpg,"[{'name': 'Imprint Entertainment', 'id': 5218}, {'name': 'Most Films', 'id': 22506}, {'name': 'Extravaganza Entertainment', 'id': 22507}, {'name': '42 Films', 'id': 22508}]","[{'iso_3166_1': 'US', 'name': 'United States of America'}]",2013-04-23,0.0,88.0,"[{'iso_639_1': 'en', 'name': 'English'}]",Released,Every move is a game changer,Pawn,False,5.4,54.0
