adult,belongs_to_collection,budget,genres,homepage,id,imdb_id,original_language,original_title,overview,popularity,poster_path,production_companies,production_countries,release_date,revenue,runtime,spoken_languages,status,tagline,title,video,vote_average,vote_count
False,"{'id': 9735, 'name': 'Friday the 13th Collection', 'poster_path': '/uobgqpLQff9WvxGKE2OSvXv1RHm.jpg', 'backdrop_path': '/c7pMKwv5NzIN6N3KM4L8fYMTtPw.jpg'}",3000000,"[{'id': 27, 'name': 'Horror'}, {'id': 9648, 'name': 'Mystery'}, {'id': 53, 'name': 'Thriller'}]",,10225,tt0091080,en,Friday the 13th Part VI: Jason Lives,"As a child, Tommy killed mass-murderer Jason. But now, years later, he is tormented by the fear that maybe Jason isn’t really dead. Determined to finish off the infamous killer once and for all, Tommy and a friend dig up Jason’s corpse in order to cremate him. Unfortunately, things go seriously awry, and Jason is instead resurrected, sparking a new chain of ruthlessly brutal murders. Now it’s up to Tommy to stop the dark, devious and demented deaths that he unwittingly brought about.",8.122042,/le636yjPeWkC74nPDIZiQBH1CVt.jpg,"[{'name': 'Paramount Pictures', 'id': 4}]","[{'iso_3166_1': 'US', 'name': 'United States of America'}]",1986-08-01,19472057.0,86.0,"[{'iso_639_1': 'en', 'name': 'English'}]",Released,Kill or be killed!,Friday the 13th Part VI: Jason Lives,False,5.7,219.0
False,,0,"[{'id': 27, 'name': 'Horror'}, {'id': 9648, 'name': 'Mystery'}, {'id': 10769, 'name': 'Foreign'}]",,54117,tt0324242,ko,쓰리,"Memories: A woman wakes up on a street without memory. A husband cannot remember why his wife left him. The woman wanders the streets trying to contact the only phone number she has on her. The husband see's her ghost in his apartment and discovers her mutilated body in a large bag in his home (Korea). The Wheel: Extravagant cursed puppets cause fires, deaths, physical pain and a little girl to be possessed (Thailand). Going Home: A father goes in search of his missing son and is abducted by a strange man. The strangers wife has died of cancer three years prior but he keeps her in his apartment under the impression she will 'wake up' (Hong Kong)",0.938167,/pRFPubcJDOxBQIEMmPZ2rAWLzIX.jpg,"[{'name': 'B.O.M. Film Productions Co.', 'id': 3616}, {'name': 'Applause Pictures', 'id': 5346}, {'name': 'Cinemasia', 'id': 7064}]","[{'iso_3166_1': 'HK', 'name': 'Hong Kong'}, {'iso_3166_1': 'TH', 'name': 'Thailand'}, {'iso_3166_1': 'KR', 'name': 'South Korea'}]",2002-07-09,2425000.0,140.0,"[{'iso_639_1': 'cn', 'name': '广州话 / 廣州話'}, {'iso_639_1': 'en', 'name': 'English'}, {'iso_639_1': 'ko', 'name': '한국어/조선말'}, {'iso_639_1': 'zh', 'name': '普通话'}, {'iso_639_1': 'th', 'name': 'ภาษาไทย'}]",Released,When two just ain't enough!,Three,False,5.9,18.0
False,"{'id': 422193, 'name': 'The Blob Collection', 'poster_path': None, 'backdrop_path': None}",240000,"[{'id': 27, 'name': 'Horror'}, {'id': 878, 'name': 'Science Fiction'}]",,8851,tt0051418,en,The Blob,"A mysterious creature from another planet, resembling a giant blob of jelly, lands on earth. The people of a nearby small town refuse to listen to some teenagers who have witnessed the blob's destructive power. In the meantime, the blob just keeps on getting bigger.",7.079055,/zVkexIhS9zhazR5EP0e79G8IswT.jpg,"[{'name': 'Paramount Pictures', 'id': 4}, {'name': 'Tonylyn Productions', 'id': 2548}]","[{'iso_3166_1': 'US', 'name': 'United States of America'}]",1958-09-12,0.0,86.0,"[{'iso_639_1': 'en', 'name': 'English'}]",Released,It crawls. It creeps. It eats you alive!,The Blob,False,6.2,147.0
False,,0,"[{'id': 9648, 'name': 'Mystery'}, {'id': 27, 'name': 'Horror'}]",,42499,tt0067487,it,La notte che Evelyn uscì dalla tomba,"A wealthy English lord is suffering a mental breakdown following the death of his red-headed wife, Evelyn, whom he feared was cheating on him. He tours local bars and dives, scouring for lovely red-heads willing to come back to his decaying castle in the country, where he seduces them, then tortures and kills them. His friend the doctor talks him into marrying again to help heal his slowly-rotting mind, which he does--but are the doctor's orders really what he needs?",0.801941,/pNl4t1S6Rxp5IBziWlqnKd7ii43.jpg,"[{'name': 'Phoenix Cinematografica', 'id': 9244}]","[{'iso_3166_1': 'IT', 'name': 'Italy'}]",1971-08-18,0.0,103.0,"[{'iso_639_1': 'it', 'name': 'Italiano'}]",Released,The worms are waiting.,The Night Evelyn Came out of the Grave,False,6.4,12.0
False,,0,"[{'id': 18, 'name': 'Drama'}, {'id': 27, 'name': 'Horror'}, {'id': 878, 'name': 'Science Fiction'}]",,52318,tt0092530,en,Alien Predators,"3 young friends are on vacation in Spain, until weird things begin to occur and then a man from NASA tells them what's really going on: Dangerous Alien Organisms from the Apollo 14 Moon Mission, which was tested on animals on SkyLab. But then the organisms fell to earth with SkyLab and they are now starting to infect people by brutally killing them off. And these 3 friends and NASA scientist must get an antidote from a NASA Lab nearby and save themselves and the rest of the world.",0.679484,/hCnerFAqhTqgH9sKvZlthKo2z5o.jpg,"[{'name': 'Continental Motion Pictures', 'id': 18054}, {'name': 'M&C Films', 'id': 18055}, {'name': 'Royal Films', 'id': 18056}]","[{'iso_3166_1': 'US', 'name': 'United States of America'}, {'iso_3166_1': 'ES', 'name': 'Spain'}]",1985-01-01,0.0,90.0,"[{'iso_639_1': 'en', 'name': 'English'}]",Released,There Is No Place To Hide,Alien Predators,False,4.9,8.0
False,"{'id': 374509, 'name': 'Godzilla (Showa) Collection', 'poster_path': '/scvwS6k8gIW8w24UcmePQqVL10l.jpg', 'backdrop_path': '/dx9YSup5zEOjxYwG4UkYBVAZIXo.jpg'}",1000000,"[{'id': 53, 'name': 'Thriller'}, {'id': 27, 'name': 'Horror'}, {'id': 878, 'name': 'Science Fiction'}]",,1678,tt0047034,ja,ゴジラ,"Japan is thrown into a panic after several ships explode and are sunk near Odo Island. An expedition to the island led by paleontologist Professor Kyohei Yemani soon discover something more devastating than imagined in the form of a 164 foot tall monster whom the natives call Gojira. Now the monster begins a rampage that threatens to destroy not only Japan, but the rest of the world as well.",13.153272,/1MJcpTpeSh2RtRHI7EMHStvWDEt.jpg,"[{'name': 'Toho Film (Eiga) Co. Ltd.', 'id': 622}]","[{'iso_3166_1': 'JP', 'name': 'Japan'}]",1954-11-03,0.0,96.0,"[{'iso_639_1': 'ja', 'name': '日本語'}]",Released,It's Alive!,Godzilla,False,6.9,194.0
False,,0,"[{'id': 53, 'name': 'Thriller'}, {'id': 18, 'name': 'Drama'}, {'id': 27, 'name': 'Horror'}, {'id': 9648, 'name': 'Mystery'}]",http://www.bbc.co.uk/programmes/b00pk76h,63517,tt1577883,en,The Turn of the Screw,"A young governess, Ann, is sent to a country house to take care of two orphans, Miles and Flora. Soon after her arrival, Miles is expelled from boarding school. Although charmed by her young charge, she secretly fears there are ominous reasons behind his expulsion. With Miles back at home, the governess starts noticing ethereal figures roaming the estate's grounds. Desperate to learn more about these sinister sightings she discovers that the suspicious circumstances surrounding the death of her predecessor hold grim implications for herself. As she becomes increasingly fearful that malevolent forces are stalking the children the governess is determined to save them, risking herself and her sanity in the process.",0.946251,/qIkU5XcY1BLfICuo35eHLBzg27r.jpg,"[{'name': 'British Broadcasting Corporation (BBC)', 'id': 3324}]","[{'iso_3166_1': 'GB', 'name': 'United Kingdom'}]",2009-12-30,0.0,89.0,"[{'iso_639_1': 'en', 'name': 'English'}]",Released,,The Turn of the Screw,False,5.1,10.0
False,,0,"[{'id': 27, 'name': 'Horror'}, {'id': 878, 'name': 'Science Fiction'}, {'id': 53, 'name': 'Thriller'}]",,26925,tt0031614,en,The Man They Could Not Hang,"Dr. Henryk Savaard is a scientist working on experiments to restore life to the dead. When he is unjustly hanged for murder, he is brought back to life by his trusted assistant. Re-animated he turns decidedly nasty and sets about murdering the jury that convicted him.",0.665719,/beUO1wmMxoDOb9SyLphekjwnb1l.jpg,"[{'name': 'Columbia Pictures Corporation', 'id': 441}]","[{'iso_3166_1': 'US', 'name': 'United States of America'}]",1939-08-17,0.0,64.0,"[{'iso_639_1': 'en', 'name': 'English'}]",Released,"TRANSFORMED BY THE HANGMAN'S NOOSE... from a doctor serving humanity, into a demon filled with hate and terrorizing blood-lust!",The Man They Could Not Hang,False,6.2,8.0
False,,0,"[{'id': 27, 'name': 'Horror'}]",,25241,tt0075261,en,Squirm,"At the beginning of the film, we learn from one of the characters that earthworms can be called to the surface with electricity, but somehow it turns them into vicious flesh-eaters. Sure enough, a storm that night causes some power lines to break and touch the ground, drawing millions of man-eating worms out of the earth, and into town where they quickly start munching on the locals.",3.192931,/e3liD2X2cLi3q6PjzpYVt5Xdw4V.jpg,"[{'name': 'American International Pictures (AIP)', 'id': 9266}, {'name': 'Squirm Company', 'id': 13099}]","[{'iso_3166_1': 'US', 'name': 'United States of America'}]",1976-07-30,0.0,92.0,"[{'iso_639_1': 'en', 'name': 'English'}, {'iso_639_1': 'it', 'name': 'Italiano'}]",Released,This was the night of the CRAWLING TERROR!,Squirm,False,5.2,29.0
