adult,belongs_to_collection,budget,genres,homepage,id,imdb_id,original_language,original_title,overview,popularity,poster_path,production_companies,production_countries,release_date,revenue,runtime,spoken_languages,status,tagline,title,video,vote_average,vote_count
False,,0,"[{'id': 18, 'name': 'Drama'}, {'id': 10751, 'name': 'Family'}]",,65158,tt0111271,en,Squanto: A Warrior's Tale,"Squanto is a high-born Indian warrior from a tribe on the Atlantic coast of North America which devotes its life to hunting and rivalry with a neighboring tribe. Everything changes forever after a ship arrives from England, prospecting the region's commercial potential for the rich Sir George, who uses all his wealth and influence only for ever greater profit. When it returns, several Indians find themselves captives on board, including Squanto. The arrogant Christians consider themselves utterly superior to the 'heathen savages' and treat them as brutally as they do beasts. Squanto fights a bear in a circus, not understanding how men can be so cruel to that creature either, and manages a spectacular escape, but where must he go? He finds shelter and help in a rural monastery, where it takes his protector some effort to prevent the others considering the unknown as diabolical. In time sir George's men come looking for him most brutally...",1.935006,/iJZcrFnp3QVlLefWJ2FY9R6lZtU.jpg,"[{'name': 'Walt Disney Pictures', 'id': 2}]","[{'iso_3166_1': 'US', 'name': 'United States of America'}]",1994-10-28,3337685.0,102.0,"[{'iso_639_1': 'en', 'name': 'English'}]",Released,,Squanto: A Warrior's Tale,False,6.1,7.0
False,,0,"[{'id': 28, 'name': 'Action'}, {'id': 18, 'name': 'Drama'}]",,11765,tt0079808,en,The Riddle of the Sands,"In the early years of the 20th Century, two British yachtsmen (Michael York and Simon MacCorkindale) stumble upon a German plot to invade the east coast of England in a flotilla of specially designed barges. They set out to thwart this terrible scheme, but must outwit not only the cream of the German Navy, but the feared Kaiser Wilhelm himself.",1.20008,/5vLW0OHdeHSEBC7wt6PewiBmX5m.jpg,[],"[{'iso_3166_1': 'GB', 'name': 'United Kingdom'}]",1979-10-02,0.0,103.0,"[{'iso_639_1': 'en', 'name': 'English'}]",Released,"In these shifting sands, men can disappear without a trace . . . and their secrets with them.",The Riddle of the Sands,False,6.6,10.0
False,,0,"[{'id': 18, 'name': 'Drama'}]",,96966,tt0082969,en,Raggedy Man,"Nita, a divorced mother of two boys, is stuck working as a telephone operator in a small Texas town in World War II. Her friendship with a sailor on leave causes tongues to wag in town.",0.725026,/5OKfo5ax4ZrI4q5RY1MaXuXHzdl.jpg,[],[],1981-09-18,0.0,94.0,"[{'iso_639_1': 'en', 'name': 'English'}]",Released,,Raggedy Man,False,4.8,6.0
False,,52000000,"[{'id': 18, 'name': 'Drama'}]",http://www.brockovich.com/movie.html,462,tt0195685,en,Erin Brockovich,"A twice-divorced mother of three who sees an injustice, takes on the bad guy and wins -- with a little help from her push-up bra. Erin goes to work for an attorney and comes across medical records describing illnesses clustered in one nearby town. She starts investigating and soon exposes a monumental cover-up.",10.135446,/if90sXZkI4aaxdlhxKejpniT9ff.jpg,"[{'name': 'Jersey Films', 'id': 216}]","[{'iso_3166_1': 'US', 'name': 'United States of America'}]",2000-03-17,256271286.0,131.0,"[{'iso_639_1': 'en', 'name': 'English'}, {'iso_639_1': 'fr', 'name': 'Français'}]",Released,She brought a small town to its feet and a huge corporation to its knees.,Erin Brockovich,False,7.1,730.0
False,,0,"[{'id': 35, 'name': 'Comedy'}, {'id': 18, 'name': 'Drama'}, {'id': 10749, 'name': 'Romance'}]",,43049,tt0054469,en,Where the Boys Are,"Good girls Merritt, Melanie, Tuggle and Angie - all students at mid-western Penmore University - are planning on going to Fort Lauderdale, Florida for spring break to get away from the mid-western snow despite not having much money to spend once there. On the drive down, they admit their real purpose is to go where the boys are.",0.804731,/1fkp0AawlhFBeWU81JxTFqKWQq2.jpg,"[{'name': 'Euterpe', 'id': 4402}, {'name': 'Metro-Goldwyn-Mayer (MGM)', 'id': 8411}]","[{'iso_3166_1': 'US', 'name': 'United States of America'}]",1960-12-28,0.0,99.0,"[{'iso_639_1': 'en', 'name': 'English'}]",Released,The hilarious inside story of those rip-roaring spring vacations!,Where the Boys Are,False,6.0,6.0
False,,0,"[{'id': 18, 'name': 'Drama'}]",,43444,tt0040092,it,L'amore,"An Italian anthology film directed by Roberto Rossellini starring Anna Magnani and Federico Fellini. The film has two parts: ""Una Voce Umana"" (""The Human Voice"") and ""Il Miracolo"" (""The Miracle"").",0.341956,/h3UUpE3vu45fkVSg3pgwd0cL6dJ.jpg,"[{'name': 'Tevere Film', 'id': 2312}, {'name': 'Finecine', 'id': 63225}]","[{'iso_3166_1': 'IT', 'name': 'Italy'}]",1948-10-30,0.0,80.0,"[{'iso_639_1': 'it', 'name': 'Italiano'}]",Released,,Amore,False,7.3,7.0
False,,7000000,"[{'id': 18, 'name': 'Drama'}, {'id': 28, 'name': 'Action'}]",http://www.kandagarfilm.ru/,34586,tt1272018,en,Kandagar,A docudrama about the escape of Russian pilots after being taken hostage by the Taliban in 1996.,1.011029,/qoYrVPifGeN4zOFj7XmSE1Nwr4j.jpg,"[{'name': 'Fawzi Vision', 'id': 18062}, {'name': 'Magic Picture', 'id': 18063}, {'name': 'Rekun Cinema', 'id': 18064}]","[{'iso_3166_1': 'RU', 'name': 'Russia'}]",2010-02-04,15172408.0,103.0,"[{'iso_639_1': 'pl', 'name': 'Polski'}, {'iso_639_1': 'ru', 'name': 'Pусский'}]",Released,,Kandahar,False,6.4,12.0
False,,0,"[{'id': 18, 'name': 'Drama'}, {'id': 10749, 'name': 'Romance'}, {'id': 10752, 'name': 'War'}]",,99318,tt0030744,en,The Shopworn Angel,"During WWI Bill Pettigrew, a naive young Texan soldier is sent to New York for basic training. He meets worldly wise actress Daisy Heath when her car nearly runs him over.",0.550873,/bWql2xuG0uRu8XEw09DxKKOMTqU.jpg,"[{'name': 'Metro-Goldwyn-Mayer (MGM)', 'id': 8411}]","[{'iso_3166_1': 'US', 'name': 'United States of America'}]",1938-07-15,0.0,85.0,"[{'iso_639_1': 'en', 'name': 'English'}]",Released,,The Shopworn Angel,False,6.5,6.0
False,,0,"[{'id': 18, 'name': 'Drama'}, {'id': 10749, 'name': 'Romance'}]",,31052,tt0094606,en,The Accidental Tourist,"After the death of his son, Macon Leary, a travel writer, seems to be sleep walking through life. Macon's wife, seems to be having trouble too, and thinks it would be best if the two would just split up. After the break up, Macon meets a strange outgoing woman, who seems to bring him back down to earth. After starting a relationship with the outgoing woman, Macon's wife seems to think that their marriage is still worth a try. Macon is then forced to deal many decisions",4.771107,/dyk2BqPajLRBpVQ6jsSJJdgfuXe.jpg,"[{'name': 'Warner Bros.', 'id': 6194}]","[{'iso_3166_1': 'US', 'name': 'United States of America'}]",1988-12-23,0.0,121.0,"[{'iso_639_1': 'en', 'name': 'English'}]",Released,,The Accidental Tourist,False,5.9,55.0
False,,0,"[{'id': 878, 'name': 'Science Fiction'}, {'id': 18, 'name': 'Drama'}, {'id': 14, 'name': 'Fantasy'}]",,167410,tt0479926,en,Hibernation,1985. A secret tree house. Two children dressed in animal costumes experiment to revive a bee. But they are searching for a way to bring back something much bigger.,0.073275,/cVaHifbl9t7g0l76cSdjl3Maplm.jpg,[],[],2005-02-10,0.0,15.0,[],Released,,Hibernation,False,9.0,2.0
False,"{'id': 413661, 'name': 'Charlie Chan (Sidney Toler) Collection', 'poster_path': '/y0xWQpLRattvypZXF5ZiuipsD2U.jpg', 'backdrop_path': None}",0,"[{'id': 80, 'name': 'Crime'}, {'id': 9648, 'name': 'Mystery'}, {'id': 18, 'name': 'Drama'}, {'id': 53, 'name': 'Thriller'}, {'id': 35, 'name': 'Comedy'}]",,38457,tt0032324,en,Charlie Chan at the Wax Museum,"A wax museum run by a demented doctor contains statues of such crime figures as Jack the Ripper and Bluebeard. In addition to making wax statues the doctor performs plastic surgery. It is here that an arch fiend takes refuge. The museum also houses a statue of Charlie. Frustrated number-two son kicks statue in rear; oops, number-two son wrong in his assumption",0.514756,/9KE4EDhheNnol4woN8JIEV9Idhy.jpg,"[{'name': 'Twentieth Century Fox Film Corporation', 'id': 306}]","[{'iso_3166_1': 'US', 'name': 'United States of America'}]",1940-09-06,0.0,63.0,"[{'iso_639_1': 'en', 'name': 'English'}]",Released,FOUR TIMES IN 18 EERIE MINUTES CHARLIE CHAN FACES DEATH! -- Death from a poison dart! -- Death from a streaking bullet! -- Death from a gleaming dagger!,Charlie Chan at the Wax Museum,False,8.4,5.0
False,,0,"[{'id': 16, 'name': 'Animation'}, {'id': 36, 'name': 'History'}, {'id': 18, 'name': 'Drama'}, {'id': 10752, 'name': 'War'}]",,128396,tt0112862,ja,アンネの日記,"This is the true story of Anne Frank, a Jewish girl living in Amsterdam during WW2. Anne's father realizes on time the danger the Jews face and hides his family (his wife Edith and his two daughters Margo (16) and Anne (13), along with four more people, in ""the house behind"". For two years the 8 people live in darkness and whispers, in fear of being discovered and sent to the German crematories. During that time young Anne writes a diary, describing her daily life in the cellar, her complicated relationship with her mother and the story of her first love - Peter, the young boy in the hiding place. Anne writes down her wishes to run out free and breath the air and flowers, her dreams to be free at last. But humanity is often a cruel mistress...",0.66202,/r4PTr4uzFcQUWmYaRn1aW51hAT5.jpg,"[{'name': 'Madhouse', 'id': 4288}]","[{'iso_3166_1': 'JP', 'name': 'Japan'}]",1995-08-19,0.0,102.0,"[{'iso_639_1': 'ja', 'name': '日本語'}]",Released,,The Diary of Anne Frank,False,7.0,3.0
False,,0,"[{'id': 18, 'name': 'Drama'}, {'id': 10749, 'name': 'Romance'}]",,120657,tt0024620,en,The Stranger's Return,"""Miriam Hopkins plays Louise Starr, who gets divorced from her husband and returns to the home she left on a farm where she reunites with her grandfather. He introduces her to Guy Crane with whom she falls in love; however, he is married.""",0.001747,/8uNESfGHlqelDJfaCB54B4F7h5I.jpg,"[{'name': 'Metro-Goldwyn-Mayer (MGM)', 'id': 8411}]","[{'iso_3166_1': 'US', 'name': 'United States of America'}]",1933-07-28,0.0,89.0,"[{'iso_639_1': 'en', 'name': 'English'}]",Released,A story of real people,The Stranger's Return,False,0.0,0.0
False,,0,"[{'id': 10749, 'name': 'Romance'}, {'id': 35, 'name': 'Comedy'}, {'id': 18, 'name': 'Drama'}]",,18683,tt0098319,en,Shirley Valentine,"Wondering what has happened to herself, now feeling stagnant and in a rut, Shirley Valentine finds herself regularly talking to the wall while preparing her husband's chips and egg. When her best friend wins a trip-for-two to Greece Shirley begins to see the world, and herself, in a different light.",1.714899,/A4D7UKNpDrQ4I2JFTxd2nVHDBYO.jpg,[],"[{'iso_3166_1': 'GB', 'name': 'United Kingdom'}, {'iso_3166_1': 'US', 'name': 'United States of America'}]",1989-10-27,0.0,108.0,"[{'iso_639_1': 'en', 'name': 'English'}]",Released,"No one thought she had the courage, the nerve, or the lingerie.",Shirley Valentine,False,6.5,21.0
False,,5000000,"[{'id': 18, 'name': 'Drama'}, {'id': 36, 'name': 'History'}]",,152532,tt0790636,en,Dallas Buyers Club,"Loosely based on the true-life tale of Ron Woodroof, a drug-taking, women-loving, homophobic man who in 1986 was diagnosed with HIV/AIDS and given thirty days to live.",14.785719,/nxJFUxDRP9qQCiyD5sH24N5SCSu.jpg,"[{'name': 'Universal Studios', 'id': 13}, {'name': 'Universal Pictures', 'id': 33}, {'name': 'Voltage Pictures', 'id': 10255}, {'name': 'Truth Entertainment', 'id': 19631}]","[{'iso_3166_1': 'US', 'name': 'United States of America'}]",2013-09-07,55198285.0,117.0,"[{'iso_639_1': 'en', 'name': 'English'}, {'iso_639_1': 'ja', 'name': '日本語'}]",Released,Sometimes it takes a hustler to change the world,Dallas Buyers Club,False,7.9,2973.0
False,,0,"[{'id': 18, 'name': 'Drama'}, {'id': 35, 'name': 'Comedy'}, {'id': 10769, 'name': 'Foreign'}]",,115616,tt0097487,en,Hawks,"Two terminally ill patients in a hospital yearn for relief from their predicament. With little or no friends, they form an uneasy alliance and plot an escape for one last wild time.",1.060228,/cxG5yDvCJ1BcPIr6Jb9mXJiilvZ.jpg,"[{'name': 'Producers Representative Organization', 'id': 10740}]",[],1988-08-05,0.0,110.0,"[{'iso_639_1': 'en', 'name': 'English'}]",Released,They soared above the ordinary.,Hawks,False,5.1,4.0
False,,0,"[{'id': 35, 'name': 'Comedy'}, {'id': 10749, 'name': 'Romance'}, {'id': 18, 'name': 'Drama'}]",http://www.orangesthemovie.com/,89008,tt1313139,en,The Oranges,A man's (Hugh Laurie) affair with his friend's much-younger daughter (Leighton Meester) throws two neighboring families into turmoil.,13.869345,/9Fid6G5aMB3lRmzZrDXb14Xepap.jpg,"[{'name': 'Likely Story', 'id': 1785}, {'name': 'ATO Pictures', 'id': 1962}, {'name': 'Olympus Pictures', 'id': 7400}]","[{'iso_3166_1': 'US', 'name': 'United States of America'}]",2011-09-09,366377.0,90.0,"[{'iso_639_1': 'en', 'name': 'English'}]",Released,It's about to get juicy.,The Oranges,False,5.3,149.0
False,,0,"[{'id': 18, 'name': 'Drama'}, {'id': 27, 'name': 'Horror'}, {'id': 9648, 'name': 'Mystery'}, {'id': 53, 'name': 'Thriller'}]",,50392,tt0460808,en,Ghost Son,"""Ghost Son"" takes place in South Africa. A married couple Stacey and Mark live on the farm with their black teenage maid. Mark and Stacey love each other deeply. Unfortunately Mark dies in a tragic truck accident.Stacey returns to the farm and decides to remain there since she feels close to Mark.She is also carrying Mark's baby. After delivering the baby Stacey quickly becomes sure that her infant son is possessed by Mark's spirit. The evil force tries to kill Stacey to bring her to Mark.",0.783219,/pe3xmqsC5pgUAzfu7sbloIwx0CC.jpg,"[{'name': 'Moviworld', 'id': 44948}, {'name': 'Star Edizioni Cinematografiche', 'id': 68721}, {'name': 'Camarote Films', 'id': 68723}, {'name': 'A.E. Media Corporation', 'id': 68724}]","[{'iso_3166_1': 'IT', 'name': 'Italy'}, {'iso_3166_1': 'ZA', 'name': 'South Africa'}, {'iso_3166_1': 'ES', 'name': 'Spain'}, {'iso_3166_1': 'GB', 'name': 'United Kingdom'}]",2007-04-05,0.0,78.0,"[{'iso_639_1': 'en', 'name': 'English'}, {'iso_639_1': 'ru', 'name': 'Pусский'}]",Released,,Ghost Son,False,3.5,6.0
False,,0,"[{'id': 37, 'name': 'Western'}, {'id': 18, 'name': 'Drama'}]",http://www.alamedafilms.com/Tiempo_Morir.html,246749,tt0059803,es,Tiempo de morir,"A man comes home after serving 18 years in jail for murder in this routine western. Although the man killed in self defense, rumors in town circulated that he murdered the victim in cold blood. The ex-con wants to get his life together, but the two sons of the slain man are gunning for the man who killed their father.",0.941923,/yV8AJNCYCbwfFY8qcNM5Wp11XQr.jpg,"[{'name': 'Alameda Films', 'id': 300}]","[{'iso_3166_1': 'MX', 'name': 'Mexico'}]",1966-08-11,0.0,90.0,"[{'iso_639_1': 'es', 'name': 'Español'}]",Released,,Time to Die,False,6.7,3.0
False,,0,"[{'id': 18, 'name': 'Drama'}, {'id': 10769, 'name': 'Foreign'}]",,29272,tt0905329,en,El Greco,"The story of the uncompromising artist and fighter for freedom, Domenicos Theotokopoulos, known to the world as ""El Greco"".",0.660036,/4hJ6UBGujzWTMHlo99jwq6zAGYJ.jpg,"[{'name': 'Greek Film Center', 'id': 7254}, {'name': 'Hellenic Radio & Television (ERT)', 'id': 7255}, {'name': 'Graal', 'id': 8943}, {'name': 'Ministerio de Cultura', 'id': 11408}, {'name': 'Instituto de Crédito Oficial (ICO)', 'id': 11427}, {'name': 'Generalitat de Catalunya - Institut Català de les Indústries Culturals (ICIC)', 'id': 16055}, {'name': 'Hellenic Culture Organization', 'id': 18585}, {'name': 'Le Spot', 'id': 18586}, {'name': 'Max Productions', 'id': 18587}, {'name': 'Motion Picture Public Foundation of Hungary', 'id': 18588}]","[{'iso_3166_1': 'GR', 'name': 'Greece'}, {'iso_3166_1': 'ES', 'name': 'Spain'}, {'iso_3166_1': 'HU', 'name': 'Hungary'}]",2007-01-01,0.0,119.0,"[{'iso_639_1': 'en', 'name': 'English'}, {'iso_639_1': 'el', 'name': 'ελληνικά'}, {'iso_639_1': 'it', 'name': 'Italiano'}, {'iso_639_1': 'es', 'name': 'Español'}]",Released,Can Darkness Win Light?,El Greco,False,5.2,10.0
False,,0,"[{'id': 18, 'name': 'Drama'}]",,4175,tt0042004,en,Under Capricorn,"In 1831, Irishman Charles Adare travels to Australia to start a new life with the help of his cousin who has just been appointed governor. When he arrives he meets powerful landowner and ex-convict Sam Flusky, who wants to do a business deal with him. Whilst attending a dinner party at Flusky's house, Charles meets Flusky's wife Henrietta who he had known as a child back in Ireland. Henrietta is an alcoholic and seems to be on the verge of madness.",2.972892,/gBRR6vYZNyXij4Cdf6khIQPS68q.jpg,"[{'name': 'Transatlantic Pictures', 'id': 1554}, {'name': 'Warner Bros.', 'id': 6194}]","[{'iso_3166_1': 'GB', 'name': 'United Kingdom'}]",1949-09-08,0.0,108.0,"[{'iso_639_1': 'en', 'name': 'English'}]",Released,"Mystery, murder and passion from the master of suspense!",Under Capricorn,False,6.1,27.0
False,,0,"[{'id': 18, 'name': 'Drama'}, {'id': 36, 'name': 'History'}, {'id': 10752, 'name': 'War'}]",,777,tt0028950,fr,La Grande Illusion,"A group of French soldiers, including the patrician Captain de Boeldieu and the working-class Lieutenant Maréchal, grapple with their own class differences after being captured and held in a World War I German prison camp. When the men are transferred to a high-security fortress, they must concoct a plan to escape beneath the watchful eye of aristocratic German officer von Rauffenstein, who has formed an unexpected bond with de Boeldieu.",6.02384,/lWg41zE0FVixkNsFgxnlRyvDYv9.jpg,"[{'name': ""Réalisation d'Art Cinématographique"", 'id': 1234}]","[{'iso_3166_1': 'FR', 'name': 'France'}]",1937-06-04,0.0,114.0,"[{'iso_639_1': 'ru', 'name': 'Pусский'}, {'iso_639_1': 'de', 'name': 'Deutsch'}, {'iso_639_1': 'fr', 'name': 'Français'}, {'iso_639_1': 'en', 'name': 'English'}]",Released,A Great Drama of Human Emotions,Grand Illusion,False,7.5,126.0
False,,0,"[{'id': 10749, 'name': 'Romance'}, {'id': 18, 'name': 'Drama'}]",,162383,tt0191610,fr,Un pont entre deux rives,"Actor Gerard Depardieu co-directed this drama about a married woman who falls in love with another man. Mina is a movie buff with a husband, Georges, who's out of work, and a 15-year-old son, Tommy. While Mina works part-time as a domestic for Claire Daboval, the family is terribly short on money, so when Georges is offered construction work on a massive bridge project, he immediately accepts, even though the job site is far enough away that he'll only be able to come home on weekends. One day, while taking in a matinee screening of West Side Story, Mina meets a man named Matthias, an engineer associated with the bridge project. It's love at first sight for the both of them, and while Mina has no desire to hurt Georges, who is a good and decent man, she has found another good and decent man whom she loves even more. Tommy, on the other hand, has to deal with this crisis in his parents' marriage while he's sorting out his own infatuation with Ms. Daboval's daughter, Lisbeth.",0.639626,/hMnGedtnxav4sd2wQTPDx5Dh7Bu.jpg,[],"[{'iso_3166_1': 'FR', 'name': 'France'}]",1999-04-06,0.0,0.0,"[{'iso_639_1': 'fr', 'name': 'Français'}]",Released,,The Bridge,False,5.0,2.0
False,,0,"[{'id': 18, 'name': 'Drama'}]",,103198,tt0100848,en,Unspeakable Acts,Two psychologist try to demonstrate that a man is a pedophile and has abused many children.,0.000603,/piaZWBRp67BSZR108ZztmTGorsk.jpg,[],[],1990-01-15,0.0,100.0,"[{'iso_639_1': 'en', 'name': 'English'}]",Released,,Unspeakable Acts,False,3.5,4.0
False,,0,"[{'id': 80, 'name': 'Crime'}, {'id': 18, 'name': 'Drama'}]",,23957,tt0079688,en,Over the Edge,"The music of Cheap Trick, The Cars, and The Ramones highlights this realistic tale of alienated suburban youth on the rampage. Dillon makes his screen debut in this updated, well-done ""Rebel Without a Cause."" Shelved for several years, the movie was finally released after Dillon made it big. Sleeper with excellent direction and dialogue.",1.861082,/wIR7EODZUyZmlcF0bSJ0ffuUdsU.jpg,"[{'name': 'Orion Pictures', 'id': 41}]","[{'iso_3166_1': 'US', 'name': 'United States of America'}]",1979-11-02,0.0,95.0,"[{'iso_639_1': 'en', 'name': 'English'}]",Released,"Nobody listened. Nobody cared. Until the night they went ""Over the Edge""",Over the Edge,False,7.7,36.0
False,,0,"[{'id': 18, 'name': 'Drama'}, {'id': 14, 'name': 'Fantasy'}]",,157820,tt2027140,fr,L'écume des jours,A woman suffers from an unusual illness caused by a flower growing in her lungs.,8.23984,/68he4OAqUDH18CDb9jlnt6MQPCs.jpg,"[{'name': 'SCOPE Invest', 'id': 2250}, {'name': 'Brio Films', 'id': 11107}, {'name': 'Scope Pictures', 'id': 11199}]","[{'iso_3166_1': 'FR', 'name': 'France'}]",2013-04-24,0.0,131.0,"[{'iso_639_1': 'fr', 'name': 'Français'}, {'iso_639_1': 'en', 'name': 'English'}]",Released,,Mood Indigo,False,6.0,199.0
False,,0,"[{'id': 18, 'name': 'Drama'}, {'id': 27, 'name': 'Horror'}, {'id': 878, 'name': 'Science Fiction'}, {'id': 53, 'name': 'Thriller'}]",http://www.herealonefilm.com/,390582,tt4814760,en,Here Alone,"After a terrible virus ravages human civilization, Ann finds herself living alone in a forest, foraging for supplies, and accompanied only by a radio that broadcasts a single transmission in French. Few animals even remain; the only survivors seem to be the roving hordes of infected creatures with a taste for human flesh. One fateful day, Ann crosses paths with two more survivors, Chris and Olivia. But after surviving on her own for so long, she struggles to relate to them and and their desire to settle down and start a new community.",3.010304,/m20e69ihKdVtP6nW2nPzQAN6VXr.jpg,[],"[{'iso_3166_1': 'US', 'name': 'United States of America'}]",2016-04-15,0.0,97.0,"[{'iso_639_1': 'en', 'name': 'English'}, {'iso_639_1': 'fr', 'name': 'Français'}]",Released,Those who stay die,Here Alone,False,5.7,38.0
False,,0,"[{'id': 18, 'name': 'Drama'}]",,150093,tt1855236,en,Just Like a Woman,"Two women get on the highway heading to Santa Fe. Marilyn dreams of winning a contest held by a famous belly dancing company, while her friend, Mona, has a secret: she's a fugitive from justice - accused of her mother-in-law's death.",1.551414,/pPZCG97yrMzdNcrQkzBQwHXvpXz.jpg,"[{'name': 'The 7th Floor', 'id': 5708}, {'name': 'ARTE', 'id': 5766}, {'name': '3B Productions', 'id': 7184}, {'name': 'Doha Film Institute', 'id': 8152}, {'name': 'Cohen Media Group', 'id': 9122}, {'name': 'The Bureau', 'id': 10441}, {'name': 'Minerva Pictures', 'id': 12377}, {'name': 'Taghit Ilc', 'id': 12378}]","[{'iso_3166_1': 'US', 'name': 'United States of America'}, {'iso_3166_1': 'GB', 'name': 'United Kingdom'}, {'iso_3166_1': 'FR', 'name': 'France'}]",2012-12-14,0.0,105.0,"[{'iso_639_1': 'en', 'name': 'English'}]",Released,two friends - one journey - no limits,Just Like a Woman,False,5.9,16.0
False,,0,"[{'id': 80, 'name': 'Crime'}, {'id': 18, 'name': 'Drama'}, {'id': 10752, 'name': 'War'}]",,124963,tt0084351,fr,Monsignor,"The vows of an ambitious young American priest are tested during World War II. Not only does Father John Flaherty get involved with the black market to raise money for the Vatican, he also falls in love with a young French nun.",0.744858,/cZo4nPw6nJDcaFu0inyR0lv1meU.jpg,"[{'name': 'Frank Yablans Presentations', 'id': 4988}]","[{'iso_3166_1': 'US', 'name': 'United States of America'}]",1982-10-22,0.0,121.0,"[{'iso_639_1': 'en', 'name': 'English'}]",Released,"Forgive me, Father for I have sinned. I have killed for my Country, I have stolen for my Church, I have loved a Woman, and I am a Priest.",Monsignor,False,4.8,4.0
False,,0,"[{'id': 80, 'name': 'Crime'}, {'id': 18, 'name': 'Drama'}]",,41090,tt0092225,en,Wisdom,"Unable to find work after a past felony, graduate John Wisdom and his girlfriend embark on a cross-country bank-robbing spree in order to aid American farmers.",1.710851,/6Srtr5FffISxMcrc2y8TN5Wclcv.jpg,"[{'name': 'Gladden Entertainment', 'id': 1648}]","[{'iso_3166_1': 'US', 'name': 'United States of America'}]",1986-12-31,0.0,109.0,"[{'iso_639_1': 'en', 'name': 'English'}]",Released,They're on the wrong side of the law for all the right reasons.,Wisdom,False,5.9,15.0
False,,0,"[{'id': 18, 'name': 'Drama'}, {'id': 35, 'name': 'Comedy'}, {'id': 10749, 'name': 'Romance'}]",http://www.thepuffychairmovie.com,24055,tt0436689,en,The Puffy Chair,"Josh's life is pretty much in the toilet. He's a failed NYC indie rocker, and a failing booking agent. But he finds the potential of a small victory in a really bad idea. He decides to purchase a 1985 Lazy Boy on eBay, just like the one his dad had when Josh was a kid. He'll drive cross-country for the chair, staying with Emily at his brother's house on the way, and deliver it to his father as a surprise birthday gift. But when Rhett ends up coming along for the ride, it's three people and a giant purple puffy chair in a too-small van... and one of them has to go before the trip's end.",0.709745,/A8OdrYsEHhJDXWo8TC1EB0OmPkE.jpg,[],[],2005-01-17,0.0,85.0,[],Released,,The Puffy Chair,False,6.2,15.0
False,,0,"[{'id': 35, 'name': 'Comedy'}, {'id': 18, 'name': 'Drama'}, {'id': 10749, 'name': 'Romance'}]",,20643,tt0032617,en,I Love You Again,Boring businessman Larry Wilson recovers from amnesia and discovers he's really a con man...and loves his soon-to-be-ex wife.,1.46809,/h9HL2QLEXieYCRP5SzEXsz4ZcQ7.jpg,"[{'name': 'Metro-Goldwyn-Mayer (MGM)', 'id': 8411}]","[{'iso_3166_1': 'US', 'name': 'United States of America'}]",1940-08-09,0.0,99.0,"[{'iso_639_1': 'en', 'name': 'English'}]",Released,"It's one, long, loud l-a-u-g-h!",I Love You Again,False,6.8,11.0
