adult,belongs_to_collection,budget,genres,homepage,id,imdb_id,original_language,original_title,overview,popularity,poster_path,production_companies,production_countries,release_date,revenue,runtime,spoken_languages,status,tagline,title,video,vote_average,vote_count
False,,50,"[{'id': 37, 'name': 'Western'}, {'id': 18, 'name': 'Drama'}, {'id': 10752, 'name': 'War'}]",,87190,tt0114122,en,Pharaoh's  Army,"Union soldiers in search of food descend on the farm of a Confederate family and decide to stay until one in their ranks' wounds have healed. While the war weary Union captain (Chris Cooper) falls for the mother of the family (Patricia Clarkson) - whose husband is off fighting for the rebels - her son plots revenge on the dirty, double-dealing Yankees. Co-stars Kris Kristofferson.",0.837911,/g0OKf2qetnEJ9vuvLLHnD6skfbn.jpg,"[{'name': 'Independent Television Service', 'id': 1152}, {'name': 'Cicada Films', 'id': 21072}, {'name': 'Kentucky Educational Television', 'id': 21073}, {'name': 'NEA', 'id': 21074}, {'name': 'Sinkhole Productions Inc.', 'id': 21075}, {'name': 'TMF Metro', 'id': 21076}]","[{'iso_3166_1': 'US', 'name': 'United States of America'}]",1995-01-01,0.0,90.0,"[{'iso_639_1': 'en', 'name': 'English'}]",Released,,Pharaoh's  Army,False,6.3,5.0
False,,0,"[{'id': 18, 'name': 'Drama'}, {'id': 27, 'name': 'Horror'}]",,153102,tt0373653,en,12 Days of Terror,"July of 1916 was a time of record heat, a polio epidemic, and a World War in Europe. But beachgoers in New Jersey are threatened by a even greater terror: a shark that has suddenly developed a taste for human flesh. Starting July 1st and lasting over a period of 12 days, the unidentified shark kills four people and seriously injures a fifth before the attacks stop, and threatens New Jersey's thriving tourist industry. Based on true events, and one of the inspirations behind Peter Benchley's Jaws.",1.523441,/fQ9BlupRLy7WTzgOjXrbmuW80zf.jpg,"[{'name': 'Fox Television Studios', 'id': 6529}, {'name': 'Discovery Channel', 'id': 6790}]",[],2005-07-05,0.0,86.0,"[{'iso_639_1': 'en', 'name': 'English'}]",Released,,12 Days of Terror,False,5.2,10.0
False,,0,"[{'id': 18, 'name': 'Drama'}, {'id': 35, 'name': 'Comedy'}]",http://www.breakfastonpluto.co.uk/,1420,tt0411195,en,Breakfast on Pluto,"In the 1970s, a foundling lad, Patrick ""Kitten"" Braden, comes of age by leaving his Irish town for London, in part to look for his mother and in part because his trans-gender nature is beyond the town's understanding.",4.984987,/14tmdb1PiLNDZf3VD29S2nUKVV0.jpg,[],"[{'iso_3166_1': 'GB', 'name': 'United Kingdom'}, {'iso_3166_1': 'IE', 'name': 'Ireland'}]",2005-09-03,0.0,128.0,"[{'iso_639_1': 'en', 'name': 'English'}]",Released,Same world. Different planet.,Breakfast on Pluto,False,7.0,77.0
False,,25000000,"[{'id': 28, 'name': 'Action'}, {'id': 80, 'name': 'Crime'}, {'id': 18, 'name': 'Drama'}]",,10623,tt0306685,en,Cradle 2 the Grave,"Gang leader Tony pulls off a major diamond heist with his crew, but cop-turned-criminal Ling knows who has the loot and responds by kidnapping Tony's daughter and holding her for ransom. Unfortunately, Tony's lost the diamonds as well. As he frantically searches for his daughter and the jewels, Tony pairs with a high-kicking government agent who once worked with Ling and seeks revenge on him.",8.364587,/v8iPcn54TNsSPabD9ZYQVQUWbXk.jpg,"[{'name': 'Silver Pictures', 'id': 1885}, {'name': 'Warner Bros.', 'id': 6194}]","[{'iso_3166_1': 'US', 'name': 'United States of America'}]",2003-02-28,56489558.0,101.0,"[{'iso_639_1': 'en', 'name': 'English'}, {'iso_639_1': 'ko', 'name': '한국어/조선말'}, {'iso_639_1': 'ru', 'name': 'Pусский'}]",Released,Mortal enemies make dangerous friends.,Cradle 2 the Grave,False,5.8,242.0
False,"{'id': 96887, 'name': 'Zatôichi: The Blind Swordsman', 'poster_path': '/8Q31DAtmFJjhFTwQGXghBUCgWK2.jpg', 'backdrop_path': '/bY8gLImMR5Pr9PaG3ZpobfaAQ8N.jpg'}",0,"[{'id': 28, 'name': 'Action'}, {'id': 12, 'name': 'Adventure'}, {'id': 18, 'name': 'Drama'}]",,18624,tt0057714,ja,座頭市喧嘩旅,Zatoichi is sworn to protect the life of a young girl and without any real allies finds himself in the middle of a bloody turf war.,0.73057,/oof3KmcmsNwVi4mfWe91CrQAqTi.jpg,"[{'name': 'Daiei Studios', 'id': 881}]","[{'iso_3166_1': 'JP', 'name': 'Japan'}]",1963-11-30,0.0,85.0,"[{'iso_639_1': 'ja', 'name': '日本語'}]",Released,,Zatôichi on the Road,False,7.5,11.0
False,,0,"[{'id': 80, 'name': 'Crime'}, {'id': 18, 'name': 'Drama'}, {'id': 10749, 'name': 'Romance'}]",,99627,tt0041327,en,"East Side, West Side",A New Yorker's (James Mason) mistress (Ava Gardner) drives his wife (Barbara Stanwyck) to a war hero; then someone kills the mistress.,0.308694,/Ft93GCMRTdZjMUmm5OZCYHV3Sq.jpg,"[{'name': 'Metro-Goldwyn-Mayer (MGM)', 'id': 8411}]","[{'iso_3166_1': 'US', 'name': 'United States of America'}]",1949-12-22,0.0,108.0,"[{'iso_639_1': 'en', 'name': 'English'}]",Released,I was married to a man other women pursued!,"East Side, West Side",False,7.8,2.0
False,,0,"[{'id': 18, 'name': 'Drama'}]",http://www.facebook.com/TheLastFallMovie?ref=ts,79781,tt1986161,en,The Last Fall,An NFL journeyman struggles to deal with life's complexities after his professional career is over.,0.561833,/exsT01qlBH8P1ewzwmZLviz6pfo.jpg,[],"[{'iso_3166_1': 'US', 'name': 'United States of America'}]",2012-03-09,0.0,98.0,"[{'iso_639_1': 'en', 'name': 'English'}]",Released,,The Last Fall,False,5.8,5.0
False,,0,"[{'id': 99, 'name': 'Documentary'}, {'id': 12, 'name': 'Adventure'}, {'id': 18, 'name': 'Drama'}]",http://www.italyloveitorleave.it/en/,84904,tt2049474,it,"Italy: Love It, or Leave it","After their award winning documentary, 'Suddenly, Last Winter', Luca and Gustav are back. This time they have to decide: should they stay in Italy, or leave it, like so many of their friends have done already. Looking at some defining Italian icons, they go on a emotional trip on a old Fiat 500 through Italy, to look behind the cliches and to discover, what's left of the famous Italian way of life, confronting a glorious pas, a shaky present and an uncertain future.",0.128687,/41VCR11zHrMWOT4VjmCL0y4gW2g.jpg,"[{'name': 'RAI', 'id': 1583}, {'name': 'ARTE', 'id': 5766}, {'name': 'Westdeutscher Rundfunk (WDR)', 'id': 7025}, {'name': 'Norddeutscher Rundfunk (NDR)', 'id': 7201}, {'name': 'hiq productions', 'id': 42755}]","[{'iso_3166_1': 'DE', 'name': 'Germany'}, {'iso_3166_1': 'IT', 'name': 'Italy'}]",2011-09-14,0.0,75.0,"[{'iso_639_1': 'de', 'name': 'Deutsch'}, {'iso_639_1': 'it', 'name': 'Italiano'}]",Released,,"Italy: Love It, or Leave it",False,6.3,3.0
False,"{'id': 380822, 'name': 'Penitenciaría - Colección', 'poster_path': None, 'backdrop_path': None}",0,"[{'id': 28, 'name': 'Action'}, {'id': 18, 'name': 'Drama'}]",,65448,tt0079709,en,Penitentiary,"A hitchhiker named Martel Gordone gets in a fight with two bikers over a prostitute, and one of the bikers is killed. Gordone is arrested and sent to prison, where he joins the prison's boxing team in an effort to secure an early parole and to establish his dominance over the prison's toughest gang.",0.232477,/29jkT9PKJFJPRJSNn1o6u82Vwey.jpg,[],[],1979-12-01,0.0,99.0,"[{'iso_639_1': 'en', 'name': 'English'}]",Released,"There's only one way out, and 100 fools stand in the way!",Penitentiary,False,4.9,8.0
False,,0,"[{'id': 18, 'name': 'Drama'}, {'id': 10402, 'name': 'Music'}, {'id': 10752, 'name': 'War'}]",,73420,tt0021800,en,Dishonored,The Austrian Secret Service sends its most seductive agent to spy on the Russians.,0.760767,/tbKswp5A8aw74VVN8PATNBR7Yo1.jpg,"[{'name': 'Paramount Network Television', 'id': 1446}]","[{'iso_3166_1': 'US', 'name': 'United States of America'}]",1931-04-04,0.0,91.0,"[{'iso_639_1': 'en', 'name': 'English'}]",Released,Can a Woman Kill a Man With Who She Has Known a Night of Love ?,Dishonored,False,6.8,12.0
False,,0,"[{'id': 18, 'name': 'Drama'}]",,123665,tt0036777,en,Dragon Seed,"Directed by Jack Conway and Harold S. Bucquet, this 1944 film adaptation of Pearl Buck's novel, about a Chinese village invaded by Japanese soldiers, stars Katharine Hepburn, Walter Huston, Aline MacMahon (an Oscar nominee for Best Supporting Actress for her role), Agnes Moorehead, Turhan Bey, J. Carrol Naish, Hurd Hatfield, Frances Rafferty, Henry Travers and Akim Tamiroff.",0.602598,/4OGX38NoTpWgL4LefJ1v8aayxKq.jpg,"[{'name': 'Metro-Goldwyn-Mayer (MGM)', 'id': 8411}]","[{'iso_3166_1': 'US', 'name': 'United States of America'}]",1944-07-20,0.0,145.0,"[{'iso_639_1': 'en', 'name': 'English'}]",Released,,Dragon Seed,False,3.3,3.0
False,,0,"[{'id': 18, 'name': 'Drama'}]",,86234,tt0071137,pt,O Amuleto de Ogum,"This story is narrated by an ubiquitous folk singer and tells of a young boy whose mother arranges for him to have an amulet bearing Ogum's blessings which would make him immune to gunfire. The amulet apparently works, for the boy becomes a member of a mobster's hit-team and then joins with a group of people who resist his original employers.",0.207397,/jqnJpVMmNQfinBCY6yB10WdSQBU.jpg,"[{'name': 'Embrafilme', 'id': 13930}, {'name': 'Regina Filmes', 'id': 76566}]","[{'iso_3166_1': 'BR', 'name': 'Brazil'}]",1974-05-21,0.0,112.0,"[{'iso_639_1': 'pt', 'name': 'Português'}]",Released,,The Amulet of Ogum,False,4.0,2.0
False,,0,"[{'id': 9648, 'name': 'Mystery'}, {'id': 18, 'name': 'Drama'}, {'id': 27, 'name': 'Horror'}]",,105156,tt0072710,it,Un fiocco nero per Deborah,"A young woman with psychic powers is obsessed with having a child. Even though she is unable to conceive, her desire to do so creates a supernatural force determined to fulfill her wishes",0.000354,/betePxrHJSrrloJcSE4FbyVvPqG.jpg,"[{'name': 'Paola Film S.r.l.', 'id': 76643}]","[{'iso_3166_1': 'IT', 'name': 'Italy'}]",1974-09-01,0.0,110.0,"[{'iso_639_1': 'en', 'name': 'English'}, {'iso_639_1': 'it', 'name': 'Italiano'}]",Released,,A Black Ribbon for Deborah,False,0.0,0.0
False,,0,"[{'id': 18, 'name': 'Drama'}, {'id': 53, 'name': 'Thriller'}]",,24005,tt0044557,en,Don't Bother to Knock,"Jed, an airline pilot, (Widmark) is resting in a hotel when he notices Nell (Monroe), a young woman babysitting for a wealthy couple. As Jed gets to know Nell better he realises that the woman is not as stable as perhaps she should be. A unique thriller featuring a rare dramatic performance from Monroe, illustrating a broader range than most people might expect..",2.38281,/eVDzLdDmJ9TTexLzkWfyokcADrD.jpg,"[{'name': 'Twentieth Century Fox Film Corporation', 'id': 306}]","[{'iso_3166_1': 'US', 'name': 'United States of America'}]",1952-07-18,0.0,76.0,"[{'iso_639_1': 'en', 'name': 'English'}]",Released,...a wicked sensation as the lonely girl in room 809!,Don't Bother to Knock,False,6.3,20.0
False,,0,"[{'id': 18, 'name': 'Drama'}, {'id': 53, 'name': 'Thriller'}]",,215373,tt0118727,en,Love Walked In,Two romantically involved down-and-out lounge singers get involved in a caper.,0.376985,/iXNyOes3pq7deWdQkkG3rkmVCdt.jpg,[],[],1997-01-18,0.0,95.0,"[{'iso_639_1': 'en', 'name': 'English'}]",Released,,Love Walked In,False,6.0,1.0
False,,0,"[{'id': 18, 'name': 'Drama'}, {'id': 10749, 'name': 'Romance'}]",,162874,tt0020891,en,The Florodora Girl,A chorus girl gets bad advice from her fellow chorines in handling a rich suitor who assumes she is a gold-digger.,0.489142,/tystHAwZVLvNb63qpAu9qziYhF5.jpg,"[{'name': 'Cosmopolitan Productions', 'id': 1442}, {'name': 'Metro-Goldwyn-Mayer (MGM)', 'id': 8411}]","[{'iso_3166_1': 'US', 'name': 'United States of America'}]",1930-05-31,0.0,79.0,"[{'iso_639_1': 'en', 'name': 'English'}]",Released,,The Florodora Girl,False,0.0,1.0
False,,0,"[{'id': 18, 'name': 'Drama'}, {'id': 9648, 'name': 'Mystery'}, {'id': 53, 'name': 'Thriller'}]",,10990,tt0117107,en,Mulholland Falls,"In 1950s Los Angeles, a special crime squad of the LAPD investigates the murder of a young woman.",5.79463,/hZRbWIPqVlp1fslaAmC2WOWNjBU.jpg,"[{'name': 'Metro-Goldwyn-Mayer (MGM)', 'id': 8411}]","[{'iso_3166_1': 'US', 'name': 'United States of America'}]",1996-04-26,0.0,107.0,"[{'iso_639_1': 'en', 'name': 'English'}]",Released,"This isn't America, this is Los Angeles.",Mulholland Falls,False,6.2,73.0
False,,2100000,"[{'id': 18, 'name': 'Drama'}]",,374465,tt4120176,fr,L'avenir,"Nathalie teaches philosophy at a high school in Paris. She is passionate about her job and particularly enjoys passing on the pleasure of thinking. Married with two children, she divides her time between her family, former students and her very possessive mother. One day, Nathalie’s husband announces he is leaving her for another woman. With freedom thrust upon her, Nathalie must reinvent her life.",5.858112,/qTl0KoiLx80VPvqIBLYUCTLVlsO.jpg,"[{'name': 'ARTE France Cinéma', 'id': 94}, {'name': 'Procirep', 'id': 311}, {'name': 'Rhône-Alpes Cinéma', 'id': 1666}, {'name': 'Filmförderungsanstalt (FFA)', 'id': 4247}, {'name': 'Canal+', 'id': 5358}, {'name': 'Centre National de la Cinématographie (CNC)', 'id': 18367}, {'name': 'Detailfilm', 'id': 48663}, {'name': 'CG Cinéma', 'id': 51696}, {'name': 'Cofinova 12', 'id': 78935}, {'name': 'Cinémage 10', 'id': 78936}, {'name': 'Soficinéma 11 Développement', 'id': 85253}]","[{'iso_3166_1': 'FR', 'name': 'France'}, {'iso_3166_1': 'DE', 'name': 'Germany'}]",2016-03-16,282382.0,102.0,"[{'iso_639_1': 'fr', 'name': 'Français'}]",Released,,Things to Come,False,6.5,70.0
False,,4500000,"[{'id': 18, 'name': 'Drama'}]",,11159,tt0117589,en,Secrets & Lies,"A middle-aged London factory worker is shocked when the mixed-race daughter she gave up at birth decides to track her down. At first she denies she is her mother. All family members become emotional, as everyone's secrets are exposed.",11.223572,/8yRTeiJX4ckalsXO8DrTGSKoZym.jpg,"[{'name': 'Channel Four Films', 'id': 181}, {'name': 'October Films', 'id': 236}, {'name': 'CiBy 2000', 'id': 7832}, {'name': 'Thin Man Films', 'id': 10100}]","[{'iso_3166_1': 'GB', 'name': 'United Kingdom'}, {'iso_3166_1': 'FR', 'name': 'France'}]",1996-05-24,13417292.0,142.0,"[{'iso_639_1': 'en', 'name': 'English'}]",Released,,Secrets & Lies,False,7.1,127.0
False,,0,"[{'id': 18, 'name': 'Drama'}]",,73339,tt0118763,en,The Boys Club,"Three teenage boys in small-town Southern Ontario are thrilled when Luke Cooper, a mysterious American fugitive with a gunshot wound in his leg, decides to crash their secret hideout. Luke tells them that he's a cop on the run from corrupt colleagues, and swears them to silence. As he recuperates, he becomes their buddy and confidante. By the time the boys realize Luke is not who he pretends to be, they're in way over their heads",0.25047,/mxVWA7iEhsl2xlL1zYOhw2wbWZr.jpg,[],[],1997-02-28,0.0,91.0,[],Released,,The Boys Club,False,5.5,4.0
False,"{'id': 308465, 'name': 'The Emigrants Collection', 'poster_path': '/ldXliPzDLI3GlhResXJDQAVhRAm.jpg', 'backdrop_path': '/zex97M5saIzmXU218QlzA5vE5TC.jpg'}",0,"[{'id': 12, 'name': 'Adventure'}, {'id': 18, 'name': 'Drama'}]",,40732,tt0067919,sv,Utvandrarna,"In the middle of the 19th century, Kristina and Karl-Oskar live in a small rural village in Smaaland (southern Sweden). They get married and try to make a living on a small spot of land. However, the small size of their land, the infertile soil, and some bad harvests makes it tough. One of their children even starve to death. Thus, they decide to emigrate to the U.S. They meet a group of farmers with their families planing the emigration under the leadership of a banned priest. They sell everything and embark for the U.S. The journey on the sailing ship is long and tedious. Some of the emigrants will never reach the New World.",2.392021,/qzRbryq6swsFgN3cKnmshjno2GO.jpg,"[{'name': 'Svensk Filmindustri (SF)', 'id': 6181}]","[{'iso_3166_1': 'SE', 'name': 'Sweden'}]",1971-03-08,0.0,191.0,"[{'iso_639_1': 'sv', 'name': 'svenska'}]",Released,a new land...a new hope...a new dream,The Emigrants,False,6.8,25.0
False,,0,"[{'id': 35, 'name': 'Comedy'}, {'id': 18, 'name': 'Drama'}, {'id': 10749, 'name': 'Romance'}]",,19361,tt0111218,en,Sleep with Me,"Six different writers wrote a scene each of this romantic comedy featuring the marriage and turbulent relationship of Joseph and Sarah, with Joseph's best friend Frank trying hard to cope with letting the love of his life marry his best friend. Featuring Quentin Tarantino in a cameo as Sid, a movie-bore party goer",6.398905,/qJeShgsOf7uG35L0mkGQ2jHFvnd.jpg,"[{'name': 'Revolution Films', 'id': 163}, {'name': 'August Entertainment', 'id': 3322}, {'name': 'Castleberg Productions', 'id': 5841}, {'name': 'Paribas Film Corparation', 'id': 17225}]","[{'iso_3166_1': 'US', 'name': 'United States of America'}]",1994-01-01,161410.0,86.0,"[{'iso_639_1': 'en', 'name': 'English'}, {'iso_639_1': 'ru', 'name': 'Pусский'}]",Released,An Unconventional Romance,Sleep with Me,False,5.3,11.0
False,,15000000,"[{'id': 18, 'name': 'Drama'}, {'id': 10749, 'name': 'Romance'}]",http://www.foxsearchlight.com/NOAS/,1259,tt0465551,en,Notes on a Scandal,"A veteran high school teacher befriends a younger art teacher, who is having an affair with one of her 15-year-old students. However, her intentions with this new ""friend"" also go well beyond platonic friendship.",8.593087,/auGdbhh2LklmZV1LLLwQ5uvHiX4.jpg,"[{'name': 'Fox Searchlight Pictures', 'id': 43}, {'name': 'Scott Rudin Productions', 'id': 258}, {'name': 'DNA Films', 'id': 284}, {'name': 'BBC Films', 'id': 288}, {'name': 'Ingenious Film Partners', 'id': 289}, {'name': 'UK Film Council', 'id': 2452}]","[{'iso_3166_1': 'GB', 'name': 'United Kingdom'}]",2006-12-25,49469904.0,92.0,"[{'iso_639_1': 'en', 'name': 'English'}, {'iso_639_1': 'fr', 'name': 'Français'}]",Released,One woman's secret is another woman's power. One woman's fear is another woman's weapon. One woman's life is in another woman's hands....,Notes on a Scandal,False,6.9,239.0
False,,0,"[{'id': 10749, 'name': 'Romance'}, {'id': 18, 'name': 'Drama'}, {'id': 10402, 'name': 'Music'}]",,80324,tt0054119,pl,Niewinni czarodzieje,A young doctor is tired of being sought by women. One night he meets a young girl who all but forces herself into his room where they talk of morals and love. But he loses her when he goes out to see some friends and then rushes madly around the city after her.,0.407564,/7knvxVaTKwwabQ2Gyu5EW4U47U6.jpg,"[{'name': 'P.P. Film Polski', 'id': 1587}]","[{'iso_3166_1': 'PL', 'name': 'Poland'}]",1960-12-17,0.0,87.0,"[{'iso_639_1': 'pl', 'name': 'Polski'}]",Released,,Innocent Sorcerers,False,7.7,3.0
False,,0,"[{'id': 18, 'name': 'Drama'}, {'id': 10749, 'name': 'Romance'}, {'id': 10769, 'name': 'Foreign'}]",,46375,tt0112459,hi,Barsaat,"Badal (Bobby Deol) is a naive but intelligent young man who comes from a small village to the big city. He is introduced to city life by Damru (Harish Patel) who now calls himself Danny. When Badal attends college, he meets with pretty and percocious, Tina Oberoi (Twinkle Khanna), and after a few misunderstanding and misadventures...",0.195461,/4LptbrkgqQ0exBxhbzHKCkleY9u.jpg,[],[],1995-09-29,0.0,0.0,"[{'iso_639_1': 'hi', 'name': 'हिन्दी'}]",Released,,Barsaat,False,5.1,5.0
False,,0,"[{'id': 28, 'name': 'Action'}, {'id': 35, 'name': 'Comedy'}, {'id': 18, 'name': 'Drama'}]",,11614,tt0083675,it,Bomber,"Bomber is an unemployed boat captain. One day he meets Jerry, a manager of boxers who are struck by the force of his fists. That is when they see the chance to win big money.",3.366866,/2BNrr3ivgkGeDjPRcXnk29qpRn5.jpg,"[{'name': 'Leone Film (Roma)', 'id': 80261}]","[{'iso_3166_1': 'IT', 'name': 'Italy'}]",1982-08-05,0.0,101.0,"[{'iso_639_1': 'en', 'name': 'English'}, {'iso_639_1': 'it', 'name': 'Italiano'}]",Released,,Bomber,False,6.3,53.0
False,,0,"[{'id': 36, 'name': 'History'}, {'id': 18, 'name': 'Drama'}]",,20431,tt0794338,ja,さくらん,"A young girl is sold into the red-light district Yoshiwara and is put under the care of the oiran (lead prostitute) of the Tamakiku house. The girl is rebellious, but the more experienced people in the household begin to think that she will be one day a great oiran, since an oiran needs not only beauty and talent, but she should also have the tenacity to maintain the position.",1.349005,/d7iNHCht84axTtQXqZcCD0FQj6s.jpg,"[{'name': 'Fellah Pictures', 'id': 4710}]","[{'iso_3166_1': 'JP', 'name': 'Japan'}]",2007-02-24,0.0,111.0,"[{'iso_639_1': 'ja', 'name': '日本語'}]",Released,,Sakuran,False,6.4,11.0
False,,0,"[{'id': 35, 'name': 'Comedy'}, {'id': 18, 'name': 'Drama'}, {'id': 14, 'name': 'Fantasy'}]",,29451,tt0033532,en,All That Money Can Buy,"A down-on-his-luck farmer makes a deal with the devil for seven years of prosperity. When Mr. Scratch comes to collect, orator and hero of the common man Daniel Webster comes to the rescue.",6.735297,/A37s5ozYzi2aWeTYK9d9BVuN0aR.jpg,"[{'name': 'RKO Radio Pictures', 'id': 6}]","[{'iso_3166_1': 'US', 'name': 'United States of America'}]",1941-10-29,0.0,107.0,"[{'iso_639_1': 'en', 'name': 'English'}]",Released,A GREAT MOTION PICTURE DARES TO BE DIFFERENT!,The Devil and Daniel Webster,False,7.7,20.0
False,,0,"[{'id': 35, 'name': 'Comedy'}, {'id': 18, 'name': 'Drama'}]",,77261,tt1877740,en,Five,An anthology of five short films exploring the impact of breast cancer on people's lives.,1.627043,/nkWGPbftSv6lRtphDLHfpjyzN6c.jpg,[],[],2011-10-10,0.0,87.0,"[{'iso_639_1': 'en', 'name': 'English'}]",Released,Direct Your Power,Five,False,7.4,11.0
False,,0,"[{'id': 10749, 'name': 'Romance'}, {'id': 35, 'name': 'Comedy'}, {'id': 18, 'name': 'Drama'}]",,415137,tt5892354,fr,Mon Ange,"Once upon a time there was Louise and her friend, the magician. But his last trick left a bitter taste in her mouth. He disappeared in a curtain of smoke… never to appear again. This is too much for the young woman. Devastated by endless grief, Louise is sent to a psychiatric asylum, resigned to the idea that she will swallow pills till the end of her days. Yet nine months later she gives birth to a child who is likely to have a big problem for his future class pictures, since he’s invisible. But Louise doesn’t care. He’s her angel and, wanting to protect him from this cruel world, she decides to keep his existence a secret. Years later, Louise’s angel has grown up. He even managed to find a girlfriend; Madeleine. The two become inseparable, for Madeleine never judges him. And for good reason: she’s blind.",1.064848,/kxiVAqDVmbUAZXEukQGYpFyzDvD.jpg,"[{'name': 'Climax Films', 'id': 9066}]","[{'iso_3166_1': 'BE', 'name': 'Belgium'}]",2016-09-11,0.0,80.0,"[{'iso_639_1': 'fr', 'name': 'Français'}]",Released,"He's invisisible, she's blind, they love each other...",Angel,False,5.0,4.0
False,,0,"[{'id': 53, 'name': 'Thriller'}, {'id': 18, 'name': 'Drama'}, {'id': 35, 'name': 'Comedy'}]",,65502,tt0067109,en,Fools' Parade,"Homer Grindstaff is a big named banker in Glory and Doc Council is a prison official and they team up to plot to kill Appleyard and his ex-convict friends who were attempting to open up a general store in Stone Coal, West Virginia and then to take the money.",0.772388,/fA30RhCqUckSuKqqidSX9pIFKZb.jpg,"[{'name': 'Columbia Pictures', 'id': 5}]","[{'iso_3166_1': 'US', 'name': 'United States of America'}]",1971-08-18,0.0,98.0,"[{'iso_639_1': 'en', 'name': 'English'}, {'iso_639_1': 'de', 'name': 'Deutsch'}]",Released,"Glory, W.Va., 1935. It wasn't exactly a parade. It wasn't a time for celebration. It was a time to run for your life.",Fools' Parade,False,7.1,4.0
False,"{'id': 143766, 'name': 'The Substitute Collection', 'poster_path': '/hImw5aICI3kqEFARKVBzHkehVWb.jpg', 'backdrop_path': None}",0,"[{'id': 28, 'name': 'Action'}, {'id': 18, 'name': 'Drama'}]",,54782,tt0240944,en,The Substitute 4: Failure Is Not an Option,"A former mercenary joins a military academy as a teacher. He soon discovers a neo-Nazi group, code-named Werewolves, formed among the cadets. He also quickly finds that they have military leadership among the officers at the Academy.",1.514248,/xOtK574puxFlz2mBlPLJKDpqpb8.jpg,[],"[{'iso_3166_1': 'US', 'name': 'United States of America'}]",2001-04-24,0.0,91.0,"[{'iso_639_1': 'en', 'name': 'English'}]",Released,,The Substitute 4: Failure Is Not an Option,False,6.4,5.0
False,,0,"[{'id': 18, 'name': 'Drama'}, {'id': 35, 'name': 'Comedy'}]",,3520,tt0059015,it,Casanova '70,"The amorous adventures of Andrea Rossi-Colombotti, an army officer who finds pleasure with beautiful women in life-threatening situations.",1.807802,/uhqhRIYaY5HPb2xMPmibc8x51Kt.jpg,"[{'name': 'Les Films Concordia', 'id': 1714}, {'name': 'Euro International Film (EIA)', 'id': 8930}, {'name': 'Compagnia Cinematografica Champion', 'id': 10000}]","[{'iso_3166_1': 'FR', 'name': 'France'}, {'iso_3166_1': 'IT', 'name': 'Italy'}]",1965-06-15,0.0,125.0,"[{'iso_639_1': 'it', 'name': 'Italiano'}]",Released,,Casanova '70,False,6.6,10.0
False,,0,"[{'id': 28, 'name': 'Action'}, {'id': 12, 'name': 'Adventure'}, {'id': 18, 'name': 'Drama'}, {'id': 14, 'name': 'Fantasy'}, {'id': 10769, 'name': 'Foreign'}, {'id': 10749, 'name': 'Romance'}, {'id': 878, 'name': 'Science Fiction'}]",,50936,tt0108650,cn,戰神傳說,"A kind-hearted fisherman, content with simple life, is reluctantly drawn into helping a noble emperor regain his throne from his evil brother.",1.17823,/jhCEvHARyntwOcEDs0QMYlElsfy.jpg,"[{'name': 'Team Work Motion Pictures Ltd.', 'id': 35085}]","[{'iso_3166_1': 'HK', 'name': 'Hong Kong'}]",1992-12-19,0.0,83.0,"[{'iso_639_1': 'cn', 'name': '广州话 / 廣州話'}]",Released,,Moon Warriors,False,6.0,7.0
