adult,belongs_to_collection,budget,genres,homepage,id,imdb_id,original_language,original_title,overview,popularity,poster_path,production_companies,production_countries,release_date,revenue,runtime,spoken_languages,status,tagline,title,video,vote_average,vote_count
False,"{'id': 259401, 'name': 'The Invisible Man (Universal Series)', 'poster_path': '/fK4kwiFZ7fGzYMkUa826KGSPriF.jpg', 'backdrop_path': '/k5xCUEzPzNkiMmd7gkIGCo4VB8W.jpg'}",0,"[{'id': 10749, 'name': 'Romance'}, {'id': 878, 'name': 'Science Fiction'}, {'id': 35, 'name': 'Comedy'}]",,28423,tt0032637,en,The Invisible Woman,A sexy model volunteers to be a test subject for a new invisibility machine. But does she have ulterior motives?,1.294231,/pLWo1ToEqJy0a3lpyxvwHNMIPcm.jpg,"[{'name': 'Universal Pictures', 'id': 33}]","[{'iso_3166_1': 'US', 'name': 'United States of America'}]",1940-12-27,0.0,72.0,"[{'iso_639_1': 'en', 'name': 'English'}]",Released,IT'S A Ghost-to-Ghost HOOK-UP!,The Invisible Woman,False,6.0,5.0
False,,0,"[{'id': 10749, 'name': 'Romance'}, {'id': 35, 'name': 'Comedy'}]",,333287,tt2537390,en,Slow Learners,"High school guidance counselor Jeff, and his platonic friend and co-worker Anne are responsible, well intentioned, kind… and boring. They frustratingly watch on as their peers find love and companionship, while they continue to fail in spectacular fashion when it comes to romance. As they reach their loneliness breaking point they make a pact to forgo their familiar, vanilla personas in exchange for their unexplored, confident alter egos. They wave goodbye to Jeff’s awkward all-male book club and Anne’s flailing attempts to catch the eye of Jeff’s sexy neighbor Max, and say hello to raucous summer nights filled with booze, dancing, and sex. Naturally things don’t exactly go according to plan.",1.452617,/8TOkvnUg1RaUIUqOCuQrAen0cSh.jpg,[],[],2015-08-19,0.0,96.0,"[{'iso_639_1': 'en', 'name': 'English'}]",Released,,Slow Learners,False,5.8,25.0
False,,0,"[{'id': 35, 'name': 'Comedy'}, {'id': 10749, 'name': 'Romance'}]",,38720,tt0061170,en,Walk Don't Run,"British industrialist Sir William Rutland - ""Bill"" to his friends - is in Tokyo on a business trip during the time of the Summer Olympic Games there in 1964. Having actually arrived in Tokyo two days before his original planned arrival, he has problems finding a hotel room because of the Olympics. Spotting an ad posted on a British Embassy message board of a room available to sublet, Bill is able to wrangle his way into the apartment of Christine Easton, who is renting out the sitting room of her one-bedroom apartment as a bedroom for the duration of the Olympics. Bill's short-term living situation in Christine's sitting room is despite her solely wanting a female roommate.",1.900797,/c036LpsBxUekflUoIFo8wKfwtMY.jpg,"[{'name': 'Columbia Pictures Corporation', 'id': 441}]","[{'iso_3166_1': 'US', 'name': 'United States of America'}]",1966-01-01,0.0,114.0,"[{'iso_639_1': 'en', 'name': 'English'}, {'iso_639_1': 'ja', 'name': '日本語'}]",Released,"Run, don't walk to see Walk, Don't Run.",Walk Don't Run,False,6.3,18.0
False,,0,"[{'id': 10749, 'name': 'Romance'}, {'id': 18, 'name': 'Drama'}]",,330007,tt4097612,es,En la Gama de los Grises,"Bruno is an architect who has a perfect life: A nice family and a good job. Anyway, Bruno has a deep sense of unease. He decides to leave his wife to be alone and have time to find him self. A business man offers him to build an iconic landmark in Santiago city. Motivated by this professional challenge, Bruno feels he can find a twist in his life by a vocational route. He start working with a young history teacher named Fer (29) who is agile, energetic, captivating and gay. Starts between them an unexpected and intense romance. At this point he must decide his path. The biggest learning: simplicity is the best way to get up again.",1.275006,/66DyhgynaxbiCo57lnVab6EdpMl.jpg,"[{'name': 'Tantan Films', 'id': 55284}]","[{'iso_3166_1': 'CL', 'name': 'Chile'}]",2015-03-06,0.0,101.0,"[{'iso_639_1': 'es', 'name': 'Español'}]",Released,,In the Grayscale,False,6.8,19.0
False,,0,"[{'id': 28, 'name': 'Action'}, {'id': 12, 'name': 'Adventure'}, {'id': 18, 'name': 'Drama'}, {'id': 10749, 'name': 'Romance'}]",,47808,tt0086232,en,Sahara,"After her father dies, young Dale takes his place in a trans-African auto race, but ends up being abducted by a desert sheik.",1.634923,/1apXsY0YfoBvHKkl7VrKuyGN0lB.jpg,"[{'name': 'Cannon Group', 'id': 1444}, {'name': 'Cabal Film', 'id': 6230}, {'name': 'London-Cannon Films', 'id': 6231}, {'name': 'Metro-Goldwyn-Mayer (MGM)', 'id': 8411}]","[{'iso_3166_1': 'GB', 'name': 'United Kingdom'}, {'iso_3166_1': 'US', 'name': 'United States of America'}]",1983-12-01,0.0,111.0,"[{'iso_639_1': 'en', 'name': 'English'}]",Released,"She challenged the desert, its men, their passions and ignited a bold adventure.",Sahara,False,6.0,6.0
False,,0,"[{'id': 14, 'name': 'Fantasy'}, {'id': 35, 'name': 'Comedy'}, {'id': 878, 'name': 'Science Fiction'}, {'id': 10749, 'name': 'Romance'}]",,3064,tt0097044,en,Chances Are,"Louie Jeffries is happily married to Corinne. On their first anniversary, Louie is killed crossing the road. Louie is reincarnated as Alex Finch, and twenty years later, fate brings Alex and Louie's daughter, Miranda, together. It's not until Alex is invited to Louie's home that he begins to remember his former life, wife and best friend. Of course, there's also the problem that he's attracted to Louie's/his own daughter.",4.901036,/eB3IRnKtjVsKHDUYpKLWWRrGM4Z.jpg,"[{'name': 'TriStar Pictures', 'id': 559}]","[{'iso_3166_1': 'US', 'name': 'United States of America'}]",1989-03-10,0.0,108.0,"[{'iso_639_1': 'en', 'name': 'English'}]",Released,,Chances Are,False,6.5,66.0
False,,0,"[{'id': 35, 'name': 'Comedy'}, {'id': 10749, 'name': 'Romance'}]",,116760,tt0078238,en,Sextette,"Marlo Manners is enjoying her honeymoon with Sir Michael Barrington, husband number 6. As luck would have it, an international conference is taking place in the same hotel and the Russian delegate (one of Marlo's former husbands) is threatening to derail the negotiations unless he can have one more fling with his ex. Adding to the complications is a tape Marlo has made detailing all of her affairs and scandals, which her manager is desperately trying (and failing) to destroy.",0.156508,/92FeY3AhmOZJ3X2rd98nigVphWw.jpg,"[{'name': 'Crown International Pictures', 'id': 1009}]","[{'iso_3166_1': 'US', 'name': 'United States of America'}]",1978-03-03,0.0,91.0,"[{'iso_639_1': 'en', 'name': 'English'}]",Rumored,The sin-sational Mae West,Sextette,False,1.5,2.0
False,,0,"[{'id': 18, 'name': 'Drama'}, {'id': 10749, 'name': 'Romance'}]",,1394,tt0086022,ru,Nostalghia,"The Russian poet Andrei Gorchakov, accompanied by guide and translator Eugenia, is traveling through Italy researching the life of an 18th-century Russian composer. In an ancient spa town, he meets the lunatic Domenico, who years earlier had imprisoned his own family in his house for seven years to save them from the evils of the world. Seeing some deep truth in Domenico's act, Andrei becomes drawn to him. In a series of dreams, the poet's nostalgia for his homeland and his longing for his wife, his ambivalent feelings for Eugenia and Italy, and his sense of kinship with Domenico become intertwined.",4.235709,/mSrfyFGeSZ58sfDvtVz8TvTQyfX.jpg,"[{'name': 'Rai 2', 'id': 23119}, {'name': 'Sovinfilm', 'id': 32054}]","[{'iso_3166_1': 'SU', 'name': 'Soviet Union'}, {'iso_3166_1': 'IT', 'name': 'Italy'}]",1983-05-01,0.0,120.0,"[{'iso_639_1': 'it', 'name': 'Italiano'}, {'iso_639_1': 'ru', 'name': 'Pусский'}]",Released,,Nostalgia,False,7.5,77.0
False,,0,"[{'id': 35, 'name': 'Comedy'}, {'id': 10749, 'name': 'Romance'}]",,69483,tt0040498,en,Julia Misbehaves,"Julia and William were married and soon separated by his snobbish family. They meet again many years later, when their daughter he has raised invites her mother to her wedding, with the disapproval of William's mother.",0.419679,/aCADpnzne3ByjAXhwmqDfgkANve.jpg,"[{'name': 'Metro-Goldwyn-Mayer (MGM)', 'id': 8411}]","[{'iso_3166_1': 'US', 'name': 'United States of America'}]",1948-08-08,0.0,99.0,"[{'iso_639_1': 'en', 'name': 'English'}]",Released,It's daring! It's delicious! It's the gayest comedy-romance of the year!,Julia Misbehaves,False,6.8,3.0
False,,0,"[{'id': 35, 'name': 'Comedy'}, {'id': 10402, 'name': 'Music'}, {'id': 10749, 'name': 'Romance'}]",,51759,tt0020112,en,The Love Parade,"The queen of mythical Sylvania marries a courtier, who finds his new life unsatisfying.",0.579705,/s94JJxn8z8SZAT8nfFqNSJUqBIi.jpg,"[{'name': 'Paramount Pictures', 'id': 4}]","[{'iso_3166_1': 'US', 'name': 'United States of America'}]",1929-11-19,0.0,107.0,"[{'iso_639_1': 'en', 'name': 'English'}, {'iso_639_1': 'fr', 'name': 'Français'}]",Released,,The Love Parade,False,4.6,7.0
False,,0,"[{'id': 18, 'name': 'Drama'}, {'id': 10749, 'name': 'Romance'}]",,77985,tt0087682,en,Maria's Lovers,"Ivan Bibic returns to his Pittsburgh PA suburb after surviving a Japanse POW camp, causing regular nightmares. All the time he remained faithfully devoted to his childhood love, fellow ethnic Yugoslavian virgin Maria Bosic. She dates him again, thus ruining a virtual engagement to captain Al Griselli. Against Ivan's dad's advice, they get married. But Ivan became psychologically impotent, feels unworthy of her and starts wondering, even looking for another girl. Meanwhile slick guitar-and-song-busker Clarence Butts moves in to South-Western PA, and seduces Maria.",1.631723,/3RgIU0bV26c5gZMTnCQyj8XVk6L.jpg,"[{'name': 'Cannon Group', 'id': 1444}]","[{'iso_3166_1': 'US', 'name': 'United States of America'}]",1984-01-27,0.0,109.0,"[{'iso_639_1': 'en', 'name': 'English'}]",Released,,Maria's Lovers,False,5.3,5.0
False,,0,"[{'id': 35, 'name': 'Comedy'}, {'id': 10749, 'name': 'Romance'}]",,39214,tt0060186,en,"Boy, Did I Get a Wrong Number!","The divine Didi, a European actress known more for her bubble bath scenes than for her acting, decides she has had enough with bubble baths and wants to be taken seriously as an actress. So much so that she runs away during the middle of a scene while filming in Hollywood and winds up in Oregon. While she is staying in a hotel, the operator accidentally connects her with a real estate agent named Tom Meade. She asks Tom to bring her some food and when he does he suggests that she go to his cabin in the woods. She also asks him not to tell anyone where she is because she doesn't want to go back to Hollywood. Now Tom must keep the secret, especially from his wife and from his suspicious housekeeper Lily.",0.320794,/5UDwwyRXz5nJh6U7Yso0J4tM3Jd.jpg,"[{'name': 'Edward Small Productions', 'id': 13479}]","[{'iso_3166_1': 'US', 'name': 'United States of America'}]",1966-06-08,0.0,99.0,"[{'iso_639_1': 'en', 'name': 'English'}]",Released,38-22-36 Boy - she has some area code!,"Boy, Did I Get a Wrong Number!",False,5.4,7.0
False,,0,"[{'id': 10749, 'name': 'Romance'}, {'id': 80, 'name': 'Crime'}, {'id': 18, 'name': 'Drama'}]",http://www.yashrajfilms.com/microsites/new_york/nywebsite.html,19616,tt1328634,hi,New York,New York is a contemporary story of friendship set against the larger than life backdrop of a city often described as the centre of the world. Omar has gone abroad for the first time in his life and soon enough he begins to see and love America through the eyes of his American friends - Sam and Maya. It is the story of these three friends discovering a new world together.,2.431428,/avopqhBKNHpJQhv8dg353IJbUNn.jpg,"[{'name': 'Yash Raj Films', 'id': 1569}, {'name': 'Sri & Company', 'id': 3648}]","[{'iso_3166_1': 'US', 'name': 'United States of America'}, {'iso_3166_1': 'IN', 'name': 'India'}]",2009-06-26,0.0,153.0,"[{'iso_639_1': 'en', 'name': 'English'}, {'iso_639_1': 'hi', 'name': 'हिन्दी'}]",Released,Three friends ready to face the world... and then the world changed.,New York,False,6.3,29.0
False,,0,"[{'id': 18, 'name': 'Drama'}, {'id': 10749, 'name': 'Romance'}, {'id': 36, 'name': 'History'}]",,59820,tt0099291,en,Come See the Paradise,"Come See The Paradise is a deeply touching love story set against the backdrop of a dramatic and controversial period in American history, It follows the romance and eventual marriage of Jack McGurn (Dennis Quad), a hot blooded Irish American, and a beautiful Japanese American Lily Dawanura (Tamlyn Tomita), at the outset of World War II. The clash of cultures, at once painful for the two lovers, becomes insurmountable after the Japanese bomb Pearl Harbor. Lily and the Kawamuras are relocated To a bleak, outdoor internment camp in California, Jack is drafted into the Army, powerless to help the woman he loves abandoning all hope of ever winning her family's approval.",6.408322,/xuZQbo67enGmL3CbyrUAorTjAVu.jpg,"[{'name': 'Twentieth Century Fox Film Corporation', 'id': 306}]","[{'iso_3166_1': 'US', 'name': 'United States of America'}]",1990-08-17,0.0,133.0,"[{'iso_639_1': 'en', 'name': 'English'}, {'iso_639_1': 'fr', 'name': 'Français'}]",Released,,Come See the Paradise,False,6.1,14.0
False,,0,"[{'id': 35, 'name': 'Comedy'}, {'id': 10749, 'name': 'Romance'}, {'id': 18, 'name': 'Drama'}, {'id': 14, 'name': 'Fantasy'}, {'id': 10770, 'name': 'TV Movie'}]",,48281,tt1318522,en,Before You Say 'I Do',"George Murray's fiancée Jane Gardner gets cold feet after accepting his ring, terrorized by her first wedding with Doug, who cheated that very day with their wedding coordinator. After a car crash, George finds himself 10 years in the past, just days before Doug's day.",0.820594,/nIj6Lx2xdCe8bwiNdcT39dNQdLR.jpg,"[{'name': 'Marvista Entertainment', 'id': 6679}, {'name': 'Braun Entertainment Group', 'id': 11114}]","[{'iso_3166_1': 'US', 'name': 'United States of America'}]",2009-02-14,0.0,87.0,"[{'iso_639_1': 'en', 'name': 'English'}]",Released,"To have a future, he must undo her past...",Before You Say 'I Do',False,5.2,13.0
False,,0,"[{'id': 35, 'name': 'Comedy'}, {'id': 10749, 'name': 'Romance'}]",,299828,tt3313908,zh,撒娇女人最好命,"When Zhang Hui is told by long-time best friend Xiao Gong that he has a new girlfriend, she is determined to learn new tricks to gain him back. Based on the novel written by Luo Fuman, ""Everyone Loves Tender Women"".",0.612352,/tVt4afTMp0x37klhemVjL0vdTTO.jpg,"[{'name': 'Huayi Brothers', 'id': 3393}]","[{'iso_3166_1': 'CN', 'name': 'China'}]",2014-11-28,0.0,97.0,"[{'iso_639_1': 'zh', 'name': '普通话'}]",Released,,Women Who Flirt,False,5.5,13.0
False,,0,"[{'id': 18, 'name': 'Drama'}, {'id': 10749, 'name': 'Romance'}]",,43802,tt0033836,en,The Little Foxes,"The ruthless, moneyed Hubbard clan lives in, and poisons, their part of the deep South at the turn of the 20th century. Regina Giddons née Hubbard has her daughter under her thumb. Mrs. Giddons is estranged from her husband, who is convalescing in Baltimore and suffers from a terminal illness. But she needs him home, and will manipulate her daughter to help bring him back. She has a sneaky business deal that she's cooking up with her two elder brothers, Oscar and Ben. Oscar has a flighty, unhappy wife and a dishonest worm of a son. Will the daughter have to marry this contemptible cousin? Who will she grow up to be - her mother or her aunt? Or can she escape the fate of both?",1.745592,/AcbaV4lh9U9r08orBiLrUdg0wo4.jpg,"[{'name': 'RKO Radio Pictures', 'id': 6}, {'name': 'Samuel Goldwyn Company, The', 'id': 28205}]","[{'iso_3166_1': 'US', 'name': 'United States of America'}]",1941-08-20,0.0,115.0,"[{'iso_639_1': 'en', 'name': 'English'}]",Released,"...the film version of the stage hit, as the ruthless beauty whose ambition spelt the doom of three men",The Little Foxes,False,7.7,31.0
False,,1365000,"[{'id': 35, 'name': 'Comedy'}, {'id': 10749, 'name': 'Romance'}]",,1859,tt0031725,en,Ninotchka,A stern Russian woman sent to Paris on official business finds herself attracted to a man who represents everything she is supposed to detest.,5.120036,/aFrCsI3e3oUSSiKkuDiPtrdfWyb.jpg,"[{'name': 'Metro-Goldwyn-Mayer (MGM)', 'id': 8411}]","[{'iso_3166_1': 'US', 'name': 'United States of America'}]",1939-10-06,2279000.0,110.0,"[{'iso_639_1': 'en', 'name': 'English'}]",Released,Greta Garbo laughs!,Ninotchka,False,7.3,77.0
False,"{'id': 338327, 'name': 'Beach Party Collection', 'poster_path': None, 'backdrop_path': None}",0,"[{'id': 35, 'name': 'Comedy'}, {'id': 10402, 'name': 'Music'}, {'id': 10749, 'name': 'Romance'}]",,26879,tt0059287,en,How to Stuff a Wild Bikini,"When he's stationed in Tahiti, a sailor hires a witch doctor to keep an eye on his girlfriend.",1.283731,/iVbPIfGpJnUYZltZzBBsc1Ry0LP.jpg,[],"[{'iso_3166_1': 'US', 'name': 'United States of America'}]",1965-07-14,0.0,93.0,"[{'iso_639_1': 'en', 'name': 'English'}]",Released,,How to Stuff a Wild Bikini,False,6.6,10.0
False,,0,"[{'id': 18, 'name': 'Drama'}, {'id': 10749, 'name': 'Romance'}]",,57204,tt0092104,en,Touch and Go,"An ice hockey star is accosted by a youth gang who attempt to rob him; after he chases them off he catches the youngest member and gives him a ride home, where he meets the boy's mother. A romantic plot ensues, as well as a confrontation with the gang leaders.",1.491589,/9QhgS5CMedrLTwTZ6Wh1wMyRzox.jpg,"[{'name': 'TriStar Pictures', 'id': 559}, {'name': 'Kings Road Entertainment', 'id': 4255}]","[{'iso_3166_1': 'US', 'name': 'United States of America'}]",1986-08-22,1300000.0,101.0,"[{'iso_639_1': 'en', 'name': 'English'}]",Released,"Yesterday, he was a fun loving sports hero. Today he's had his life threatened, his Jaguar wrecked, his career jeopardized... And now someone's trying to cook him breakfast.",Touch and Go,False,7.1,8.0
False,,0,"[{'id': 35, 'name': 'Comedy'}, {'id': 10749, 'name': 'Romance'}]",,55727,tt0087666,en,Making the Grade,"Lazy preppie Palmer Woodrow hires street-smart Eddie Keaton to go to school for him while he lives it up in Europe. Eddie falls in love with preppie gal Tracey, upsetting Biff, the Hoover Academy bully. When his bookie from the old neighborhood, Dice, comes to collect on Eddie's gambling debts and Palmer returns early from Europe, the the scheme slowly starts to unravel. Soon, Eddie can't even tell whose side he's really on.",0.411365,/jfHuZijVTYCFYYBHGbZa7pELqZ6.jpg,"[{'name': 'Cannon Group', 'id': 1444}, {'name': 'Metro-Goldwyn-Mayer (MGM)', 'id': 8411}]",[],1984-05-18,0.0,105.0,"[{'iso_639_1': 'en', 'name': 'English'}]",Released,His major was attitude.,Making the Grade,False,5.8,9.0
False,,0,"[{'id': 10749, 'name': 'Romance'}, {'id': 18, 'name': 'Drama'}]",,27099,tt0242795,fr,Presque rien,"Story of two gorgeous, young French boys who begin a passionate relationship that boils over and threatens to destroy both their lives. Shy Mathieu is 18-years-old and on summer vacation in the south of France. He spends his days lazily sunning himself at the beach, until he spies the handsome Cédric and falls in love. The film, like a dream, flows back and forth between the past and present, often asking us to fill the deliberate jumps in time.",2.242307,/AgbHIosBI2NdWbHEIbWpR3U49J4.jpg,"[{'name': ""Man's Films"", 'id': 1016}, {'name': 'Arte France Cinéma', 'id': 6916}, {'name': 'Radio Télévision Belge Francophone (RTBF)', 'id': 7466}, {'name': 'Lancelot Films', 'id': 18982}]","[{'iso_3166_1': 'BE', 'name': 'Belgium'}, {'iso_3166_1': 'FR', 'name': 'France'}]",2000-06-07,0.0,100.0,"[{'iso_639_1': 'fr', 'name': 'Français'}]",Released,,Come Undone,False,6.1,24.0
False,,0,"[{'id': 10752, 'name': 'War'}, {'id': 12, 'name': 'Adventure'}, {'id': 18, 'name': 'Drama'}, {'id': 10749, 'name': 'Romance'}]",,10568,tt0031334,en,The Four Feathers,A disgraced officer risks his life to help his childhood friends in battle.,7.055347,/gerXrUoZdRpwSYVT7f8y7C0MiFy.jpg,"[{'name': 'London Film Productions', 'id': 659}]","[{'iso_3166_1': 'GB', 'name': 'United Kingdom'}]",1939-04-20,0.0,129.0,"[{'iso_639_1': 'en', 'name': 'English'}]",Released,See...The Dreaded Dervishes! - Kipling's Famous FUZZY WUZZIES!,The Four Feathers,False,7.3,22.0
False,,0,"[{'id': 28, 'name': 'Action'}, {'id': 10749, 'name': 'Romance'}, {'id': 37, 'name': 'Western'}]",,40685,tt0034889,en,In Old California,"Boston pharmacist Tom Craig comes to Sacramento, where he runs afoul of local political boss Britt Dawson, who exacts protection payment from the citizenry. Dawson frames Craig with poisoned medicine, but Craig redeems himself during a Gold Rush epidemic.",0.889252,/gZ5lF0uBsbIlo3vKwbaAfB0zs95.jpg,"[{'name': 'Republic Pictures', 'id': 1432}]","[{'iso_3166_1': 'US', 'name': 'United States of America'}]",1942-05-31,0.0,91.0,"[{'iso_639_1': 'en', 'name': 'English'}, {'iso_639_1': 'es', 'name': 'Español'}]",Released,,In Old California,False,4.4,5.0
False,,0,"[{'id': 10770, 'name': 'TV Movie'}, {'id': 14, 'name': 'Fantasy'}, {'id': 35, 'name': 'Comedy'}, {'id': 10749, 'name': 'Romance'}, {'id': 10751, 'name': 'Family'}]",,52060,tt1699746,en,Christmas Cupid,"Sloan is beautiful, stylish, and on the fast track to success at her public relations firm. After her client Caitlin ends up in a coma and becomes her own personal ghost of Christmas past, present, and future; she finds out first hand that her unethical ways needs to change and reuniting with a past jilted lover may be the answer.",6.622907,/g1G0qJN4xHQQqpvrPsoBGGIwR7X.jpg,"[{'name': 'ABC Family', 'id': 5948}]","[{'iso_3166_1': 'US', 'name': 'United States of America'}]",2010-12-12,0.0,85.0,"[{'iso_639_1': 'en', 'name': 'English'}]",Released,,Christmas Cupid,False,5.0,45.0
False,,0,"[{'id': 18, 'name': 'Drama'}, {'id': 10749, 'name': 'Romance'}]",,77964,tt0029650,en,That Certain Woman,A gangster's widow fights for love despite society's disapproval.,0.074806,/v2Qg5NWWjMTmzkORDrHpg7CoPY.jpg,"[{'name': 'First National Pictures', 'id': 3245}, {'name': 'Warner Bros.', 'id': 6194}]","[{'iso_3166_1': 'US', 'name': 'United States of America'}]",1937-09-18,0.0,93.0,"[{'iso_639_1': 'en', 'name': 'English'}]",Released,Love Broke Her Heart !,That Certain Woman,False,6.5,2.0
False,,26000000,"[{'id': 18, 'name': 'Drama'}, {'id': 10749, 'name': 'Romance'}, {'id': 35, 'name': 'Comedy'}]",,9454,tt0120631,en,EverAfter,"A unique 16th century woman, Danielle possesses a love of books, and can easily quote from Sir Thomas More’s Utopia. An intriguing mix of tomboyish athleticism and physical beauty, she has more than enough charm to capture the heart of a prince ... after beaning him with an apple.",13.309701,/1ELrosU04wEbfmxK9wLBjdEECqm.jpg,"[{'name': 'Twentieth Century Fox Film Corporation', 'id': 306}]","[{'iso_3166_1': 'US', 'name': 'United States of America'}]",1998-07-31,65705772.0,121.0,"[{'iso_639_1': 'en', 'name': 'English'}]",Released,Desire. Defy. Escape.,Ever After: A Cinderella Story,False,6.8,408.0
False,,0,"[{'id': 18, 'name': 'Drama'}, {'id': 10749, 'name': 'Romance'}]",,65403,tt0100879,en,Vital Signs,"Jimmy Smits leads an all-star ensemble including Diane Lane, Adrian Pasdar, William Devane, Laura San Giacomo and Bradley Whitford in a film that's as fascinating and fast-paced as the medical profession it explores. Third year med school means too much work, too little respect, and striving to impress the chief of surgery (Smits). When Michael (Pasdar) falls in love in fellow student Gina (Lane), whose boyfriend is a resident, he risks his entire future. As the pressure mounts and the emergencies continue nonstop, Michael and Gina learn whether or not they have what it takes to save lives.",0.462832,/5nGYaxHPUCQh1WXLZOskvI9yI93.jpg,"[{'name': 'Twentieth Century Fox Film Corporation', 'id': 306}, {'name': 'CBS Entertainment Productions', 'id': 3902}]","[{'iso_3166_1': 'US', 'name': 'United States of America'}]",1990-04-13,0.0,102.0,"[{'iso_639_1': 'en', 'name': 'English'}]",Released,,Vital Signs,False,4.5,4.0
False,,0,"[{'id': 35, 'name': 'Comedy'}, {'id': 10749, 'name': 'Romance'}]",http://www.yasonrafilm.com,57739,tt1808691,en,Ya Sonra?,"Onların da aşkı masallar gibiydi ve evlendiler. Yani masallara göre sona geldiler… Adem'le Didem birbirlerini hala sevmektedirler. Ama evlilik, Adem'in sevgisini ve ilgisini açığa çıkartma reflekslerini köreltmiştir. Didem ise özgüveni ve özgür iradesi elinden alınmış mutsuz bir kadına dönüşmüştür. Tek tutunduğu onu yeniden hayata döndürecek işidir. Adem'i hala çok seviyordur. Kocasının peşinden ailesini, dostlarını, kariyerini bırakarak daha önce sadece haritalarda gördüğü şehirlere bile yerleşmekte tereddüt etmeyen Didem, şimdi aynı fedakarlığı Adem'den bekler. İşte tam bu sırada başka bir masalın prensi hikayemize girer. Artık uyanma vakti gelmiştir…",0.297242,/hTpUMFcmNODm8U817vsrmgKVk9o.jpg,[],[],2011-02-24,0.0,0.0,"[{'iso_639_1': 'tr', 'name': 'Türkçe'}]",Released,Külkedisi prens ile evlenir ve masal biter. Peki ya sonra?,Ya Sonra?,False,7.0,2.0
