adult,belongs_to_collection,budget,genres,homepage,id,imdb_id,original_language,original_title,overview,popularity,poster_path,production_companies,production_countries,release_date,revenue,runtime,spoken_languages,status,tagline,title,video,vote_average,vote_count
False,"{'id': 123720, 'name': 'Frankenstein (Hammer Series)', 'poster_path': '/fKiok5TbCKWRgfNd4Rj8gPMzGJp.jpg', 'backdrop_path': '/gl9Gi60C9WYVkObOMll19OROhMC.jpg'}",0,"[{'id': 27, 'name': 'Horror'}, {'id': 878, 'name': 'Science Fiction'}]",,3127,tt0050894,en,The Revenge of Frankenstein,"Baron Frankenstein, working under the protective pseudonym Dr. Victor Stein, together with his assistant Dr. Kleve, transplants a dwarf's brain into another body and unleashes a deranged being.",3.522296,/fSCIM3ooWw3gvIcYocq9SWnMML0.jpg,"[{'name': 'Hammer Film Productions', 'id': 1314}]","[{'iso_3166_1': 'GB', 'name': 'United Kingdom'}]",1958-06-01,0.0,89.0,"[{'iso_639_1': 'en', 'name': 'English'}, {'iso_639_1': 'la', 'name': 'Latin'}]",Released,We Dare You To See It! We Double-Dare You To Forget It!,The Revenge of Frankenstein,False,6.8,26.0
False,,417000,"[{'id': 27, 'name': 'Horror'}, {'id': 878, 'name': 'Science Fiction'}]",,11549,tt0049366,en,Invasion of the Body Snatchers,A small-town doctor learns that the population of his community is being replaced by emotionless alien duplicates.,6.135431,/6EVtwbBvGpfopVJdlgIs7mEHpuG.jpg,"[{'name': 'Allied Artists Pictures', 'id': 4928}, {'name': 'Walter Wanger Productions', 'id': 10096}]","[{'iso_3166_1': 'US', 'name': 'United States of America'}]",1956-02-05,0.0,80.0,"[{'iso_639_1': 'en', 'name': 'English'}]",Released,... there was nothing to hold onto - except each other.,Invasion of the Body Snatchers,False,7.3,277.0
False,"{'id': 106498, 'name': 'Dungeons & Dragons Collection', 'poster_path': '/tb70wYUa474fdfZSPj8CH6Ua6F9.jpg', 'backdrop_path': '/21twikCptcVJHUt9AdV8DXts92q.jpg'}",35000000,"[{'id': 28, 'name': 'Action'}, {'id': 12, 'name': 'Adventure'}, {'id': 14, 'name': 'Fantasy'}, {'id': 878, 'name': 'Science Fiction'}]",,11849,tt0190374,en,Dungeons & Dragons,"The classic role-playing game comes to life in this magical adventure. The empire of Izmer is a divided land: Elite magicians called Mages rule while lowly commoners are powerless. When Empress Savina (Thora Birch) vows to bring equality and prosperity to her land, the evil Mage Profion (Jeremy Irons) plots to depose her. But this good-vs.-evil battle is no game!",4.884311,/hHoMqCagqwnahAvwkzCOp6MPMWC.jpg,"[{'name': 'New Line Cinema', 'id': 12}, {'name': 'Silver Pictures', 'id': 1885}, {'name': 'Sweetpea Entertainment', 'id': 8933}]","[{'iso_3166_1': 'CZ', 'name': 'Czech Republic'}, {'iso_3166_1': 'US', 'name': 'United States of America'}]",2000-12-08,15185241.0,107.0,"[{'iso_639_1': 'en', 'name': 'English'}, {'iso_639_1': 'pl', 'name': 'Polski'}]",Released,This is no game.,Dungeons & Dragons,False,3.9,159.0
False,"{'id': 161766, 'name': 'Gamera Films', 'poster_path': '/oqZJgOoXjUcS9alAkzYzq9sCIfG.jpg', 'backdrop_path': '/8vNDD5NXSHhMEVJO4ItELGkZPNp.jpg'}",0,"[{'id': 12, 'name': 'Adventure'}, {'id': 878, 'name': 'Science Fiction'}, {'id': 28, 'name': 'Action'}]",,26947,tt0064360,ja,Gamera tai daiakuju Giron,"Aliens kidnap two children and take them to another planet for the purpose of getting knowledge from their brains, but Gamera follows and tries to rescue them.",0.441542,/wSaXA7KNnVWjL2MbB9ZfbLxVKlq.jpg,"[{'name': 'Daiei Motion Picture Company', 'id': 3214}]","[{'iso_3166_1': 'JP', 'name': 'Japan'}]",1969-03-21,0.0,82.0,"[{'iso_639_1': 'ja', 'name': '日本語'}]",Released,,Gamera vs. Guiron,False,4.3,11.0
False,,130000000,"[{'id': 16, 'name': 'Animation'}, {'id': 28, 'name': 'Action'}, {'id': 35, 'name': 'Comedy'}, {'id': 10751, 'name': 'Family'}, {'id': 878, 'name': 'Science Fiction'}]",http://www.megamind.com,38055,tt1001526,en,Megamind,"Bumbling supervillain Megamind finally defeats his nemesis, the superhero Metro Man. But without a hero, he loses all purpose and must find new meaning to his life.",11.603905,/amXAUSAUrnGuLGEyc1ZNhBvgbnF.jpg,"[{'name': 'DreamWorks Animation', 'id': 521}]","[{'iso_3166_1': 'US', 'name': 'United States of America'}]",2010-10-28,321887208.0,95.0,"[{'iso_639_1': 'en', 'name': 'English'}]",Released,His brain is off the chain.,Megamind,False,6.7,1968.0
False,,0,"[{'id': 53, 'name': 'Thriller'}, {'id': 27, 'name': 'Horror'}, {'id': 878, 'name': 'Science Fiction'}]",http://www.lakeeeriemovie.com/,316268,tt2948078,en,Lake Eerie,"A young widow moves into an old house on Lake Erie to recover from the sudden loss of her husband; however, she soon discovers a dark secret and that she is not alone.",3.264722,/wqsGwJSdR5X7BxfTJmCEpx0GHS9.jpg,"[{'name': 'Solid Weld Production', 'id': 43436}, {'name': 'Savage Beast Film', 'id': 43437}]","[{'iso_3166_1': 'US', 'name': 'United States of America'}]",2016-01-15,0.0,104.0,"[{'iso_639_1': 'en', 'name': 'English'}]",Released,A dark secret locked away...will soon be discovered.,Lake Eerie,False,3.4,28.0
False,,0,"[{'id': 16, 'name': 'Animation'}, {'id': 878, 'name': 'Science Fiction'}, {'id': 10751, 'name': 'Family'}]",,18890,tt0108526,en,We're Back! A Dinosaur's Story,"Captain New Eyes travels back in time and feeds dinosaurs his Brain Grain cereal, which makes them intelligent and non-violent. They agree to go to the Middle Future in order to grant the wishes of children in New York city. They are to meet Dr. Bleeb of the Museum of Natural History, but get sidetracked with their new children friends and run into the Captain's evil brother, Professor",13.58903,/oDbywMYMM8TZD9B4XuksKkwMgUa.jpg,"[{'name': 'Universal Studios', 'id': 13}, {'name': 'Amblin Entertainment', 'id': 56}, {'name': 'Amblimation', 'id': 4105}]","[{'iso_3166_1': 'US', 'name': 'United States of America'}]",1993-11-24,9317021.0,72.0,"[{'iso_639_1': 'en', 'name': 'English'}]",Released,Wish for a dinosaur and watch all your dreams come true.,We're Back! A Dinosaur's Story,False,5.8,109.0
False,,0,"[{'id': 18, 'name': 'Drama'}, {'id': 878, 'name': 'Science Fiction'}, {'id': 9648, 'name': 'Mystery'}]",,21430,tt0133122,en,New Rose Hotel,A corporate raider (Christopher Walken) and his henchman (Willem Dafoe) use a chanteuse (Asia Argento) to lure a scientific genius away from his employer and family.,10.255215,/zRgR1UEHV7xolS2eE2W1uzH9F5I.jpg,"[{'name': 'Quadra Entertainment', 'id': 1438}, {'name': 'Edward R. Pressman Film', 'id': 6455}]","[{'iso_3166_1': 'US', 'name': 'United States of America'}]",1998-09-05,0.0,93.0,"[{'iso_639_1': 'ja', 'name': '日本語'}, {'iso_639_1': 'en', 'name': 'English'}, {'iso_639_1': 'de', 'name': 'Deutsch'}]",Released,No possession is sacred.  No secret is safe.,New Rose Hotel,False,5.0,24.0
False,,0,"[{'id': 18, 'name': 'Drama'}, {'id': 35, 'name': 'Comedy'}, {'id': 878, 'name': 'Science Fiction'}]",,43680,tt0096126,ru,Собачье сердце,"Old Prof. Preobrazhensky and his young colleague Dr. Bormental inserted the human's hypophysis into a dog's brain. Couple of weeks later the dog became ""human looking"". The main question is ""Is anybody who is looking like a man, A REAL MAN?""",2.870907,/dT62tOsTB73lCBkcZ0pWcsktfyr.jpg,"[{'name': 'Lenfilm', 'id': 10845}]","[{'iso_3166_1': 'RU', 'name': 'Russia'}]",1988-01-01,0.0,136.0,"[{'iso_639_1': 'ru', 'name': 'Pусский'}]",Released,,Heart of a Dog,False,7.1,38.0
False,"{'id': 225961, 'name': 'Birdemic Collection', 'poster_path': '/x3MZmE83eHBsLfNZZn68Ua2NAKB.jpg', 'backdrop_path': '/zr8q5nGsLf6yjL9yKPZhgYRYc63.jpg'}",0,"[{'id': 27, 'name': 'Horror'}, {'id': 878, 'name': 'Science Fiction'}]",http://www.birdemic.com/,40016,tt1316037,en,Birdemic: Shock and Terror,"A platoon of eagles and vultures attacks the residents of a small town. Many people die. It's not known what caused the flying menace to attack. Two people manage to fight back, but will they survive Birdemic?",2.52968,/vYGp5RtaLKxKO8RNeyHZUIdOi5r.jpg,[],"[{'iso_3166_1': 'US', 'name': 'United States of America'}]",2010-02-27,0.0,95.0,"[{'iso_639_1': 'en', 'name': 'English'}]",Released,Why did the eagles and vultures attack?,Birdemic: Shock and Terror,False,2.1,69.0
False,"{'id': 423877, 'name': 'Turkish Star Wars', 'poster_path': None, 'backdrop_path': None}",0,"[{'id': 878, 'name': 'Science Fiction'}]",,20787,tt0182060,tr,Dünyayı Kurtaran Adam,"The film follows the adventures of Murat (Arkın) and Ali (Akkaya), whose spaceships crash on a desert planet following a battle, shown by using footage from Star Wars as well as Soviet and American space program newsreel clips. While hiking across the desert, they speculate that the planet is inhabited only by women. Murat does his ""wolf whistle"", which he uses on attractive women. However, he blows the wrong whistle and they are attacked by skeletons on horseback, which they defeat in hand-to-hand combat. The main villain soon shows up and captures the heroes, bringing them to his gladiatorial arena so they can fight. The villain tells them he is actually from Earth and is a 1,000 year old wizard. He tried to defeat Earth, but was always repelled by a shield of concentrated human brain molecules, which looks like the Death Star from Star Wars. The only way he can bypass this impenetrable defense is to use a human brain against it.",1.125238,/bMv3ljHpObzvoMSUYWtPqxjwd1b.jpg,"[{'name': 'Anit Film', 'id': 13031}]","[{'iso_3166_1': 'TR', 'name': 'Turkey'}]",1982-11-04,0.0,91.0,"[{'iso_639_1': 'tr', 'name': 'Türkçe'}]",Released,,The Man Who Saves The World,False,5.8,12.0
False,,2000000,"[{'id': 878, 'name': 'Science Fiction'}]",,14460,tt0080421,en,Battle Beyond the Stars,A young farmer assembles a band of diverse mercenaries to defend his peaceful planet from an evil tyrant.,2.921405,/7ETT8MvudloEZwF6paNt74uBdRc.jpg,"[{'name': 'New World Pictures', 'id': 1950}]","[{'iso_3166_1': 'US', 'name': 'United States of America'}]",1980-09-08,11000000.0,104.0,"[{'iso_639_1': 'en', 'name': 'English'}]",Released,"A battle beyond time, beyond space.",Battle Beyond the Stars,False,5.9,42.0
False,,0,"[{'id': 16, 'name': 'Animation'}, {'id': 878, 'name': 'Science Fiction'}]",http://www.studio-rikka.com/page/pale/pale_top.htm,20683,tt1506448,ja,ペイル・コクーン,"In the far future when the continuity of the history has been lost, humans live in an ever more deteriorating completely artificial and enclosed world. The sea and the sky have disappeared, and the only window to ""living"" scenery exists in the records from the past, excavated in the relic.The Bureau of Record Excavation is an organization responsible for this task. Ura works for the 92nd office of the bureau. He is absorbed by the restoration of various records and fascinated by world of the past. Riko keeps a little distance to watch him, but averts her eyes from the records, believing that sometimes people just want things to stay the same.Everyone in this world knows that to know the past means to know the misery of this world, the present reality. But one day, Ura restores a strange video...",1.437723,/2xRRMkxAprYFDz0d9CORLF4iCZx.jpg,"[{'name': 'Directions Inc.', 'id': 22701}]","[{'iso_3166_1': 'JP', 'name': 'Japan'}]",2006-01-18,0.0,23.0,"[{'iso_639_1': 'ja', 'name': '日本語'}]",Released,,Pale Cocoon,False,6.8,16.0
