adult,belongs_to_collection,budget,genres,homepage,id,imdb_id,original_language,original_title,overview,popularity,poster_path,production_companies,production_countries,release_date,revenue,runtime,spoken_languages,status,tagline,title,video,vote_average,vote_count
False,,0,"[{'id': 27, 'name': 'Horror'}]",,12517,tt0407621,fr,Calvaire,"A few days before Christmas, traveling entertainer Marc Stevens is stuck at nightfall in a remote wood in the swampy Hautes Fagnes region of Liège, his van conked out. An odd chap who's looking for a lost dog leads Marc to a shuttered inn...",4.392346,/9JLsWhjwIdg2dI1NAdus3IgX0DQ.jpg,"[{'name': 'La Parti Productions', 'id': 2675}, {'name': 'The Film', 'id': 3921}, {'name': 'Backup Films', 'id': 5381}, {'name': 'Studio Canal', 'id': 5870}, {'name': 'Tarantula', 'id': 8471}]","[{'iso_3166_1': 'BE', 'name': 'Belgium'}, {'iso_3166_1': 'FR', 'name': 'France'}]",2006-08-11,0.0,88.0,"[{'iso_639_1': 'fr', 'name': 'Français'}]",Released,,The Ordeal,False,5.6,62.0
False,,0,"[{'id': 27, 'name': 'Horror'}, {'id': 878, 'name': 'Science Fiction'}, {'id': 53, 'name': 'Thriller'}]",,27625,tt0049370,en,It Conquered the World,An alien from Venus tries to take over the world with the help of a disillusioned human scientist.,2.141695,/tVJFcfYX5XzKMDSRtjGQdznEaq1.jpg,"[{'name': 'Sunset Productions', 'id': 4697}]","[{'iso_3166_1': 'US', 'name': 'United States of America'}]",1956-07-14,0.0,71.0,"[{'iso_639_1': 'en', 'name': 'English'}]",Released,Every man its prisoner... every woman its slave!,It Conquered the World,False,4.0,10.0
False,,300000,"[{'id': 27, 'name': 'Horror'}]",,30875,tt0084298,it,Manhattan Baby,"An archaelogist opens an Egyptian tomb and accidently releases an evil spirit. His young daughter becomes possessed by the freed enity and, upon arrival back in New York, the gory murders begin.",1.243242,/pfp74efox66tsTqqfsQSjsgvVgy.jpg,[],"[{'iso_3166_1': 'IT', 'name': 'Italy'}]",1982-08-12,0.0,89.0,"[{'iso_639_1': 'it', 'name': 'Italiano'}]",Released,,Manhattan Baby,False,5.4,11.0
False,,0,"[{'id': 27, 'name': 'Horror'}]",,72648,tt0071413,en,Devil Times Five,"Five extremely disturbed, sociopathic children escape from their psychiatric transport and are taken in unwittingly by a group of adult villagers on winter vacation.",0.007963,/vsSechjeYHeaPPKWLrAELOsif0D.jpg,"[{'name': 'Barrister Productions Inc.', 'id': 14237}]","[{'iso_3166_1': 'US', 'name': 'United States of America'}]",1974-05-31,0.0,88.0,"[{'iso_639_1': 'en', 'name': 'English'}]",Released,Who survives? Who would want to survive?,Devil Times Five,False,4.6,10.0
False,,0,"[{'id': 27, 'name': 'Horror'}]",,422472,tt4933238,en,Family Possessions,"After moving into the home of a deceased relative, a family discovers they may have inherited more than just the house.",0.056003,/a9mJM5kZoZXMv2KbZce9aJopxYh.jpg,[],[],2016-10-21,0.0,0.0,[],Released,,Family Possessions,False,0.0,0.0
False,,0,"[{'id': 35, 'name': 'Comedy'}, {'id': 27, 'name': 'Horror'}]",,141210,tt2250194,en,The Sleepover,"The town of Derry has a secret, but no one told the new kid. It's gonna be a long night.",0.135596,/pQpyEmFTGaox4yLuUXmiD2IDIbA.jpg,[],[],2013-10-12,0.0,6.0,[],Released,,The Sleepover,False,8.0,1.0
False,,15000000,"[{'id': 80, 'name': 'Crime'}, {'id': 53, 'name': 'Thriller'}, {'id': 27, 'name': 'Horror'}, {'id': 18, 'name': 'Drama'}]",http://www.thelasthouseontheleft.com/,18405,tt0844708,en,The Last House on the Left,"A group of teenage girls heading into the city hook up with a gang of drug-addled ne'er-do-wells and are brutally murdered. The killers find their way to the home of one of their victim's parents, where both father and mother exact a horrible revenge.",13.634766,/2Y35XCUS8U8vC8vs0HDEVkPu1BM.jpg,"[{'name': 'Rogue Pictures', 'id': 134}, {'name': 'Film Afrika', 'id': 773}, {'name': 'Sean S. Cunningham Films', 'id': 17611}]","[{'iso_3166_1': 'US', 'name': 'United States of America'}]",2009-03-13,32721635.0,110.0,"[{'iso_639_1': 'en', 'name': 'English'}]",Released,"If someone hurt someone you love, how far would you go to get revenge?",The Last House on the Left,False,6.2,449.0
False,,0,"[{'id': 35, 'name': 'Comedy'}, {'id': 27, 'name': 'Horror'}]",,27814,tt0094793,en,Brain Damage,"A normal, average guy who lives in New York City becomes dependent on an evil, disembodied brain.",4.899686,/eB0cTAa0ishWLEfjvlpJAeagUMD.jpg,"[{'name': 'Palisades Partners', 'id': 65285}]","[{'iso_3166_1': 'US', 'name': 'United States of America'}]",1988-04-15,0.0,86.0,"[{'iso_639_1': 'en', 'name': 'English'}]",Released,It's A Headache From Hell!,Brain Damage,False,6.8,54.0
False,,0,"[{'id': 27, 'name': 'Horror'}, {'id': 9648, 'name': 'Mystery'}]",,185495,tt0070783,en,Terror in the Wax Museum,"This is a rehash of old movies, starring the sculptor and manager of a mysterious wax museum. You can see the wax figures breathing.",0.698608,/vIUXPIpbd6ZfAY8McHHkxC5c2Gs.jpg,[],"[{'iso_3166_1': 'US', 'name': 'United States of America'}]",1973-05-02,0.0,93.0,"[{'iso_639_1': 'en', 'name': 'English'}]",Released,,Terror in the Wax Museum,False,5.9,5.0
False,,0,"[{'id': 27, 'name': 'Horror'}, {'id': 53, 'name': 'Thriller'}, {'id': 10749, 'name': 'Romance'}]",,66164,tt1614456,en,Little Deaths,"Composed of three disturbingly sensual and terrifying short narratives, unified by the twin themes of sex and death.",2.022045,/aOHbf3DtzeiP6qDFVtwqmx3moN3.jpg,"[{'name': 'Almost Midnight Productions', 'id': 25814}]","[{'iso_3166_1': 'GB', 'name': 'United Kingdom'}]",2011-02-25,0.0,90.0,"[{'iso_639_1': 'en', 'name': 'English'}]",Released,Experimentation...Revenge...All Part of Life's Twisted Games...,Little Deaths,False,4.8,25.0
False,,0,"[{'id': 27, 'name': 'Horror'}, {'id': 18, 'name': 'Drama'}]",,141757,tt0088399,pl,Widziadlo,"Set in the early years of the century. A story of a country gentleman haunted by the memory of his first wife. His current wife, had enough of his obsession and has taken a lover, who is mysteriously paralyzed. Meanwhile, main character's son gets his first taste of sensual experience with a mute peasant girl.",0.011938,/A2qIN37MuSGPLnKg7L8BNsZzG5b.jpg,"[{'name': 'Zespol Filmowy ""Perspektywa""', 'id': 46568}]","[{'iso_3166_1': 'PL', 'name': 'Poland'}]",1984-07-05,0.0,90.0,"[{'iso_639_1': 'pl', 'name': 'Polski'}]",Released,,The Phantom,False,0.0,0.0
False,,40000,"[{'id': 27, 'name': 'Horror'}]",,30385,tt0385592,en,Chainsaw Sally,No overview found.,0.151445,/uqaE4CqMYOKpjDmitTltp9xsIIK.jpg,[],"[{'iso_3166_1': 'US', 'name': 'United States of America'}]",2004-10-02,0.0,83.0,"[{'iso_639_1': 'en', 'name': 'English'}]",Released,,Chainsaw Sally,False,3.5,2.0
False,,0,"[{'id': 28, 'name': 'Action'}, {'id': 27, 'name': 'Horror'}, {'id': 53, 'name': 'Thriller'}]",,41656,tt0221905,en,Octopus,"During the Cuban missile crisis in 1962, a Russian submarine strays into American waters. On board is a nuclear cargo destined for Castro. The Americans attack and destroy the sub. 38 years later US submarine Roosevelt is in the same waters. An unknown object attacks and disables the sub with devastating force and drags the vessel to the bottom of the ocean. What lies on the ocean bed beggars belief: dozens of wrecks, among them the sub destroyed 38 years ago. Whatever was on board has fed a creature of unbelievable size and strength! The only way out is the emergency submersible and a passing cruise ship. Above or below the water, there is no escape from the monster mutant octopus with a nuclear diet...",1.699418,/mziGMnBCQpM3oP7KAeidzpYM9w2.jpg,"[{'name': 'Martien Holdings A.V.V.', 'id': 9077}, {'name': 'Nu Image / Millennium Films', 'id': 25473}]","[{'iso_3166_1': 'US', 'name': 'United States of America'}]",2000-09-21,0.0,100.0,"[{'iso_639_1': 'en', 'name': 'English'}]",Released,A cruise to hell,Octopus,False,3.5,16.0
False,,0,"[{'id': 18, 'name': 'Drama'}, {'id': 27, 'name': 'Horror'}, {'id': 9648, 'name': 'Mystery'}, {'id': 878, 'name': 'Science Fiction'}, {'id': 53, 'name': 'Thriller'}, {'id': 10770, 'name': 'TV Movie'}]",,374430,tt3973198,en,Black Mirror: White Christmas,"This feature-length special consists of three interwoven stories. In a mysterious and remote snowy outpost, Matt and Potter share a Christmas meal, swapping creepy tales of their earlier lives in the outside world. Matt is a charismatic American trying to bring the reserved, secretive Potter out of his shell. But are both men who they appear to be? A woman gets thrust into a nightmarish world of 'smart' gadgetry. Plus a look at what would happen if you could 'block' people in real life.",24.910782,/he609rnU3tiwBjRklKNa4n2jQSd.jpg,[],[],2014-12-16,0.0,74.0,"[{'iso_639_1': 'en', 'name': 'English'}]",Released,,Black Mirror: White Christmas,False,8.3,211.0
False,,0,"[{'id': 27, 'name': 'Horror'}]",,163447,tt0088959,en,Criminally Insane 2,"A mental hospital, faced with a severe decrease in funding, is forced to release mass-murderer Ethel Janowski into a halfway house. Ethel is psychotic, delusional and has a hefty appetite. In fact, her killing spree began 13 years before with the murder of her grandmother, who had forced her to go on a diet. Now that she's tasted the home-cooked fare at the halfway house, she'll do absolutely anything to get more.",0.310577,/3dAuqi3tt7N1I5bdd7UH7olunQo.jpg,[],[],1987-01-01,0.0,70.0,"[{'iso_639_1': 'en', 'name': 'English'}]",Released,"Fatty, fatty 4X4, can't get in the kitchen door!",Criminally Insane 2,False,2.3,6.0
