adult,belongs_to_collection,budget,genres,homepage,id,imdb_id,original_language,original_title,overview,popularity,poster_path,production_companies,production_countries,release_date,revenue,runtime,spoken_languages,status,tagline,title,video,vote_average,vote_count
False,"{'id': 86311, 'name': 'The Avengers Collection', 'poster_path': '/qJawKUQcIBha507UahUlX0keOT7.jpg', 'backdrop_path': '/zuW6fOiusv4X9nnW3paHGfXcSll.jpg'}",280000000,"[{'id': 28, 'name': 'Action'}, {'id': 12, 'name': 'Adventure'}, {'id': 878, 'name': 'Science Fiction'}]",http://marvel.com/movies/movie/193/avengers_age_of_ultron,99861,tt2395427,en,Avengers: Age of Ultron,"When Tony Stark tries to jumpstart a dormant peacekeeping program, things go awry and Earth’s Mightiest Heroes are put to the ultimate test as the fate of the planet hangs in the balance. As the villainous Ultron emerges, it is up to The Avengers to stop him from enacting his terrible plans, and soon uneasy alliances and unexpected action pave the way for an epic and unique global adventure.",37.37942,/t90Y3G8UGQp0f0DrP60wRu9gfrH.jpg,"[{'name': 'Marvel Studios', 'id': 420}, {'name': 'Prime Focus', 'id': 15357}, {'name': 'Revolution Sun Studios', 'id': 76043}]","[{'iso_3166_1': 'US', 'name': 'United States of America'}]",2015-04-22,1405403694.0,141.0,"[{'iso_639_1': 'en', 'name': 'English'}]",Released,A New Age Has Come.,Avengers: Age of Ultron,False,7.3,6908.0
False,,0,"[{'id': 12, 'name': 'Adventure'}, {'id': 878, 'name': 'Science Fiction'}, {'id': 14, 'name': 'Fantasy'}, {'id': 10751, 'name': 'Family'}]",,294093,tt3261302,en,Dinosaur Island,"The adventure begins when Lucas, a 13 year old boy, embarks on the vacation of a lifetime. When disaster strikes, Lucas finds himself stranded in a strange land littered with ghost ships and prehistoric creatures. While searching for other signs of life, Lucas hears a radio broadcast in the distance and is drawn into the jungle where he encounters a beautiful young girl who claims to have come from the 1950s. Together they set out on a quest to get home all the while uncovering secrets that will forever change the future.",4.668314,/vP0muFZYdlb0GfFZgnoPrgMmuE8.jpg,"[{'name': 'Extinct Production', 'id': 45229}]","[{'iso_3166_1': 'AU', 'name': 'Australia'}]",2014-09-01,0.0,90.0,"[{'iso_639_1': 'en', 'name': 'English'}]",Released,Their world is closer than you think.,Dinosaur Island,False,4.4,25.0
False,,0,"[{'id': 878, 'name': 'Science Fiction'}, {'id': 27, 'name': 'Horror'}]",,41032,tt0069316,en,The Stone Tape,"A research team from an electronics company move into an old Victorian house to start work on finding a new recording medium. When team member Jill Greeley witnesses a ghost, team director Peter Brock decides not only to analyse the apparition, which he believes is a psychic impression trapped in a stone wall (dubbed a ""stone tape""), but to exorcise it too - with terrifying results...",0.48421,/xOMFNqPuFqcKCUx7gq9NbMt95jN.jpg,"[{'name': 'British Broadcasting Corporation (BBC)', 'id': 3324}]","[{'iso_3166_1': 'GB', 'name': 'United Kingdom'}]",1972-01-31,0.0,90.0,[],Released,,The Stone Tape,False,6.6,9.0
False,,0,"[{'id': 878, 'name': 'Science Fiction'}, {'id': 18, 'name': 'Drama'}, {'id': 35, 'name': 'Comedy'}]",,32633,tt0466669,en,Almost Normal,"A gay man approaching a mid-life crisis is tired of being different because he is gay. He wants to be normal. Suddenly he is yanked back in time to when he was in high school. But this time, the world is gay and to be straight is considered deviant behavior. Then something else happens. He meets a girl. And suddenly normal becomes ...well almost normal.",1.175873,/u917XLsbvAZJRxZ8bZ4PIVgfWZo.jpg,[],"[{'iso_3166_1': 'US', 'name': 'United States of America'}]",2005-05-26,0.0,90.0,"[{'iso_639_1': 'en', 'name': 'English'}]",Released,What if everyone in the world was gay? Except for you.,Almost Normal,False,5.3,8.0
False,,1500000,"[{'id': 35, 'name': 'Comedy'}, {'id': 80, 'name': 'Crime'}, {'id': 878, 'name': 'Science Fiction'}, {'id': 53, 'name': 'Thriller'}]",,13820,tt0087995,en,Repo Man,"A down and out young punk gets a job working with a seasoned repo man, but what awaits him in his new career is a series of outlandish adventures revolving around aliens, the CIA, and a most wanted '64 Chevy.",6.357559,/e3I831drBvpHe6FFb93geZxqU5c.jpg,"[{'name': 'Edge City', 'id': 11463}]","[{'iso_3166_1': 'US', 'name': 'United States of America'}]",1984-02-20,2300000.0,92.0,"[{'iso_639_1': 'en', 'name': 'English'}]",Released,It’s 4 a.m. Do you know where your car is?,Repo Man,False,6.7,146.0
False,,0,"[{'id': 14, 'name': 'Fantasy'}, {'id': 16, 'name': 'Animation'}, {'id': 18, 'name': 'Drama'}, {'id': 35, 'name': 'Comedy'}, {'id': 878, 'name': 'Science Fiction'}]",,22561,tt0074121,it,Allegro non troppo,"The film is a parody of Disney's Fantasia, though possibly more of a challenge to Fantasia than parody status would imply. In the context of this film, ""Allegro non Troppo"" means Not So Fast!, an interjection meaning ""slow down"" or ""think before you act"" and refers to the film's pessimistic view of Western progress (as opposed to the optimism of Disney's original).",1.115905,/hiB3BxFjJFVJVZHLaYkwTF1F4WN.jpg,"[{'name': 'Ministero del Turismo e dello Spettacolo', 'id': 13561}]","[{'iso_3166_1': 'IT', 'name': 'Italy'}]",1976-03-12,0.0,85.0,"[{'iso_639_1': 'it', 'name': 'Italiano'}]",Released,,Allegro non troppo,False,6.9,22.0
